aiter/configs/a8w8_bpreshuffle_cktile_tuned_gemm.csv
cu_num,M,N,K,kernelId,splitK,us,kernelName
80,1,1280,8192,2,0,13.4098,a8w8_bpreshuffle_cktile_0x0x8x4x1x0x0x0x0x1_16x64x512_1x4x1_16x16x64_default
80,1,4608,4096,2,0,9.2262,a8w8_bpreshuffle_cktile_0x0x8x4x1x0x0x0x0x1_16x64x512_1x4x1_16x16x64_default
80,1,8192,1024,2,0,6.9106,a8w8_bpreshuffle_cktile_0x0x8x4x1x0x0x0x0x1_16x64x512_1x4x1_16x16x64_default
80,1,9216,4096,3,0,14.4674,a8w8_bpreshuffle_cktile_0x0x8x4x1x0x0x0x0x1_16x128x512_1x4x1_16x16x64_default
80,2,4608,4096,2,0,9.2982,a8w8_bpreshuffle_cktile_0x0x8x4x1x0x0x0x0x1_16x64x512_1x4x1_16x16x64_default
80,2,9216,4096,2,0,13.2678,a8w8_bpreshuffle_cktile_0x0x8x4x1x0x0x0x0x1_16x64x512_1x4x1_16x16x64_default
80,4,4608,4096,2,0,9.3022,a8w8_bpreshuffle_cktile_0x0x8x4x1x0x0x0x0x1_16x64x512_1x4x1_16x16x64_default
80,4,9216,4096,2,0,13.3471,a8w8_bpreshuffle_cktile_0x0x8x4x1x0x0x0x0x1_16x64x512_1x4x1_16x16x64_default
80,8,4608,4096,2,0,9.4266,a8w8_bpreshuffle_cktile_0x0x8x4x1x0x0x0x0x1_16x64x512_1x4x1_16x16x64_default
80,8,9216,4096,3,0,14.735,a8w8_bpreshuffle_cktile_0x0x8x4x1x0x0x0x0x1_16x128x512_1x4x1_16x16x64_default
80,16,512,7168,2,0,12.0086,a8w8_bpreshuffle_cktile_0x0x8x4x1x0x0x0x0x1_16x64x512_1x4x1_16x16x64_default
80,16,576,7168,2,0,12.019,a8w8_bpreshuffle_cktile_0x0x8x4x1x0x0x0x0x1_16x64x512_1x4x1_16x16x64_default
80,16,1536,7168,2,0,12.7398,a8w8_bpreshuffle_cktile_0x0x8x4x1x0x0x0x0x1_16x64x512_1x4x1_16x16x64_default
80,16,3072,1536,2,0,6.069,a8w8_bpreshuffle_cktile_0x0x8x4x1x0x0x0x0x1_16x64x512_1x4x1_16x16x64_default
80,16,4096,512,5,0,4.0354,a8w8_bpreshuffle_cktile_0x0x8x4x1x0x0x0x0x1_16x64x256_1x4x1_16x16x64_default
80,16,4608,4096,2,0,9.7514,a8w8_bpreshuffle_cktile_0x0x8x4x1x0x0x0x0x1_16x64x512_1x4x1_16x16x64_default
80,16,4608,7168,2,0,13.5686,a8w8_bpreshuffle_cktile_0x0x8x4x1x0x0x0x0x1_16x64x512_1x4x1_16x16x64_default
80,16,7168,256,5,0,3.9894,a8w8_bpreshuffle_cktile_0x0x8x4x1x0x0x0x0x1_16x64x256_1x4x1_16x16x64_default
80,16,7168,2048,2,0,8.5946,a8w8_bpreshuffle_cktile_0x0x8x4x1x0x0x0x0x1_16x64x512_1x4x1_16x16x64_default
80,16,7168,2304,5,0,10.093,a8w8_bpreshuffle_cktile_0x0x8x4x1x0x0x0x0x1_16x64x256_1x4x1_16x16x64_default
80,16,9216,4096,2,0,14.5387,a8w8_bpreshuffle_cktile_0x0x8x4x1x0x0x0x0x1_16x64x512_1x4x1_16x16x64_default
80,32,512,7168,2,0,12.3426,a8w8_bpreshuffle_cktile_0x0x8x4x1x0x0x0x0x1_16x64x512_1x4x1_16x16x64_default
80,32,576,7168,2,0,12.293,a8w8_bpreshuffle_cktile_0x0x8x4x1x0x0x0x0x1_16x64x512_1x4x1_16x16x64_default
80,32,1280,8192,2,0,13.8346,a8w8_bpreshuffle_cktile_0x0x8x4x1x0x0x0x0x1_16x64x512_1x4x1_16x16x64_default
80,32,1536,7168,2,0,12.8378,a8w8_bpreshuffle_cktile_0x0x8x4x1x0x0x0x0x1_16x64x512_1x4x1_16x16x64_default
80,32,3072,1536,9,0,7.7946,a8w8_bpreshuffle_cktile_0x0x8x4x1x0x0x0x0x1_32x64x512_1x4x1_16x16x64_default
80,32,4096,512,21,0,4.4022,a8w8_bpreshuffle_cktile_0x0x8x4x1x0x0x0x0x1_32x64x256_1x4x1_16x16x64_default
80,32,4608,4096,9,0,10.8934,a8w8_bpreshuffle_cktile_0x0x8x4x1x0x0x0x0x1_32x64x512_1x4x1_16x16x64_default
80,32,4608,7168,9,0,15.4038,a8w8_bpreshuffle_cktile_0x0x8x4x1x0x0x0x0x1_32x64x512_1x4x1_16x16x64_default
80,32,7168,256,15,0,4.2086,a8w8_bpreshuffle_cktile_0x0x8x4x1x0x0x0x0x1_32x64x128_1x4x1_16x16x64_default
80,32,7168,2048,23,0,10.0226,a8w8_bpreshuffle_cktile_0x0x8x4x1x0x0x0x0x1_32x128x256_1x4x1_16x16x64_default
80,32,7168,2304,23,0,11.1102,a8w8_bpreshuffle_cktile_0x0x8x4x1x0x0x0x0x1_32x128x256_1x4x1_16x16x64_default
80,32,8192,1024,15,0,8.349,a8w8_bpreshuffle_cktile_0x0x8x4x1x0x0x0x0x1_32x64x128_1x4x1_16x16x64_default
80,32,9216,4096,9,0,17.2195,a8w8_bpreshuffle_cktile_0x0x8x4x1x0x0x0x0x1_32x64x512_1x4x1_16x16x64_default
80,64,512,7168,2,0,12.2646,a8w8_bpreshuffle_cktile_0x0x8x4x1x0x0x0x0x1_16x64x512_1x4x1_16x16x64_default
80,64,576,7168,2,0,12.5298,a8w8_bpreshuffle_cktile_0x0x8x4x1x0x0x0x0x1_16x64x512_1x4x1_16x16x64_default
80,64,1280,8192,2,0,14.075,a8w8_bpreshuffle_cktile_0x0x8x4x1x0x0x0x0x1_16x64x512_1x4x1_16x16x64_default
80,64,1536,7168,9,0,15.171,a8w8_bpreshuffle_cktile_0x0x8x4x1x0x0x0x0x1_32x64x512_1x4x1_16x16x64_default
80,64,3072,1536,23,0,8.4782,a8w8_bpreshuffle_cktile_0x0x8x4x1x0x0x0x0x1_32x128x256_1x4x1_16x16x64_default
80,64,4096,512,23,0,5.2986,a8w8_bpreshuffle_cktile_0x0x8x4x1x0x0x0x0x1_32x128x256_1x4x1_16x16x64_default
80,64,4608,4096,23,0,15.7379,a8w8_bpreshuffle_cktile_0x0x8x4x1x0x0x0x0x1_32x128x256_1x4x1_16x16x64_default
80,64,4608,7168,23,0,23.4831,a8w8_bpreshuffle_cktile_0x0x8x4x1x0x0x0x0x1_32x128x256_1x4x1_16x16x64_default
80,64,7168,256,22,0,5.7006,a8w8_bpreshuffle_cktile_0x0x8x4x1x0x0x0x0x1_64x64x256_1x4x1_16x16x64_default
80,64,7168,2048,24,0,14.0375,a8w8_bpreshuffle_cktile_0x0x8x4x1x0x0x0x0x1_64x128x256_1x4x1_16x16x64_default
80,64,7168,2304,21,0,14.8214,a8w8_bpreshuffle_cktile_0x0x8x4x1x0x0x0x0x1_32x64x256_1x4x1_16x16x64_default
80,64,8192,1024,24,0,9.8202,a8w8_bpreshuffle_cktile_0x0x8x4x1x0x0x0x0x1_64x128x256_1x4x1_16x16x64_default
80,64,9216,4096,24,0,24.0659,a8w8_bpreshuffle_cktile_0x0x8x4x1x0x0x0x0x1_64x128x256_1x4x1_16x16x64_default
80,128,512,7168,2,0,12.3606,a8w8_bpreshuffle_cktile_0x0x8x4x1x0x0x0x0x1_16x64x512_1x4x1_16x16x64_default
80,128,576,7168,9,0,14.7915,a8w8_bpreshuffle_cktile_0x0x8x4x1x0x0x0x0x1_32x64x512_1x4x1_16x16x64_default
80,128,1280,8192,9,0,16.7891,a8w8_bpreshuffle_cktile_0x0x8x4x1x0x0x0x0x1_32x64x512_1x4x1_16x16x64_default
80,128,1536,7168,21,0,21.0163,a8w8_bpreshuffle_cktile_0x0x8x4x1x0x0x0x0x1_32x64x256_1x4x1_16x16x64_default
80,128,3072,1536,23,0,10.8558,a8w8_bpreshuffle_cktile_0x0x8x4x1x0x0x0x0x1_32x128x256_1x4x1_16x16x64_default
80,128,4096,512,17,0,8.1026,a8w8_bpreshuffle_cktile_0x0x8x4x1x0x0x0x0x1_32x128x128_1x4x1_16x16x64_default
80,128,4608,4096,24,0,22.5027,a8w8_bpreshuffle_cktile_0x0x8x4x1x0x0x0x0x1_64x128x256_1x4x1_16x16x64_default
80,128,4608,7168,24,0,34.6987,a8w8_bpreshuffle_cktile_0x0x8x4x1x0x0x0x0x1_64x128x256_1x4x1_16x16x64_default
80,128,7168,256,23,0,8.127,a8w8_bpreshuffle_cktile_0x0x8x4x1x0x0x0x0x1_32x128x256_1x4x1_16x16x64_default
80,128,7168,2048,23,0,19.6727,a8w8_bpreshuffle_cktile_0x0x8x4x1x0x0x0x0x1_32x128x256_1x4x1_16x16x64_default
80,128,7168,2304,17,0,21.2635,a8w8_bpreshuffle_cktile_0x0x8x4x1x0x0x0x0x1_32x128x128_1x4x1_16x16x64_default
80,128,8192,1024,23,0,14.6211,a8w8_bpreshuffle_cktile_0x0x8x4x1x0x0x0x0x1_32x128x256_1x4x1_16x16x64_default
80,128,9216,4096,24,0,34.9359,a8w8_bpreshuffle_cktile_0x0x8x4x1x0x0x0x0x1_64x128x256_1x4x1_16x16x64_default
80,192,1280,8192,23,0,25.4003,a8w8_bpreshuffle_cktile_0x0x8x4x1x0x0x0x0x1_32x128x256_1x4x1_16x16x64_default
80,192,8192,1024,23,0,18.3863,a8w8_bpreshuffle_cktile_0x0x8x4x1x0x0x0x0x1_32x128x256_1x4x1_16x16x64_default
80,256,512,7168,9,0,14.9498,a8w8_bpreshuffle_cktile_0x0x8x4x1x0x0x0x0x1_32x64x512_1x4x1_16x16x64_default
80,256,576,7168,9,0,15.1626,a8w8_bpreshuffle_cktile_0x0x8x4x1x0x0x0x0x1_32x64x512_1x4x1_16x16x64_default
80,256,1280,8192,23,0,25.7379,a8w8_bpreshuffle_cktile_0x0x8x4x1x0x0x0x0x1_32x128x256_1x4x1_16x16x64_default
80,256,1536,7168,24,0,33.8519,a8w8_bpreshuffle_cktile_0x0x8x4x1x0x0x0x0x1_64x128x256_1x4x1_16x16x64_default
80,256,3072,1536,23,0,15.601,a8w8_bpreshuffle_cktile_0x0x8x4x1x0x0x0x0x1_32x128x256_1x4x1_16x16x64_default
80,256,4096,512,23,0,9.9758,a8w8_bpreshuffle_cktile_0x0x8x4x1x0x0x0x0x1_32x128x256_1x4x1_16x16x64_default
80,256,4608,4096,24,0,34.3699,a8w8_bpreshuffle_cktile_0x0x8x4x1x0x0x0x0x1_64x128x256_1x4x1_16x16x64_default
80,256,4608,7168,24,0,55.2052,a8w8_bpreshuffle_cktile_0x0x8x4x1x0x0x0x0x1_64x128x256_1x4x1_16x16x64_default
80,256,7168,256,18,0,9.809,a8w8_bpreshuffle_cktile_0x0x8x4x1x0x0x0x0x1_64x128x128_1x4x1_16x16x64_default
80,256,7168,2048,18,0,29.8823,a8w8_bpreshuffle_cktile_0x0x8x4x1x0x0x0x0x1_64x128x128_1x4x1_16x16x64_default
80,256,7168,2304,18,0,30.9971,a8w8_bpreshuffle_cktile_0x0x8x4x1x0x0x0x0x1_64x128x128_1x4x1_16x16x64_default
80,256,8192,1024,20,0,22.1547,a8w8_bpreshuffle_cktile_0x0x8x4x1x0x0x0x0x1_64x256x128_1x4x1_16x16x64_default
80,256,9216,4096,20,0,62.1032,a8w8_bpreshuffle_cktile_0x0x8x4x1x0x0x0x0x1_64x256x128_1x4x1_16x16x64_default
80,320,1280,8192,23,0,35.7359,a8w8_bpreshuffle_cktile_0x0x8x4x1x0x0x0x0x1_32x128x256_1x4x1_16x16x64_default
80,320,8192,1024,20,0,22.9799,a8w8_bpreshuffle_cktile_0x0x8x4x1x0x0x0x0x1_64x256x128_1x4x1_16x16x64_default
80,512,512,7168,9,0,22.3511,a8w8_bpreshuffle_cktile_0x0x8x4x1x0x0x0x0x1_32x64x512_1x4x1_16x16x64_default
80,512,576,7168,9,0,22.8355,a8w8_bpreshuffle_cktile_0x0x8x4x1x0x0x0x0x1_32x64x512_1x4x1_16x16x64_default
80,512,1280,8192,24,0,38.4391,a8w8_bpreshuffle_cktile_0x0x8x4x1x0x0x0x0x1_64x128x256_1x4x1_16x16x64_default
80,512,1536,7168,23,0,49.754,a8w8_bpreshuffle_cktile_0x0x8x4x1x0x0x0x0x1_32x128x256_1x4x1_16x16x64_default
80,512,3072,1536,23,0,23.2159,a8w8_bpreshuffle_cktile_0x0x8x4x1x0x0x0x0x1_32x128x256_1x4x1_16x16x64_default
80,512,4096,512,18,0,15.3866,a8w8_bpreshuffle_cktile_0x0x8x4x1x0x0x0x0x1_64x128x128_1x4x1_16x16x64_default
80,512,4608,7168,0,0,100.9421,a8w8_bpreshuffle_cktile_0x0x8x4x1x0x0x0x0x1_128x128x128_1x4x1_16x16x64_default
80,512,7168,256,13,0,15.6718,a8w8_bpreshuffle_cktile_0x0x8x4x1x0x0x0x0x1_128x128x64_1x4x1_16x16x64_default
80,512,7168,2048,18,0,53.0888,a8w8_bpreshuffle_cktile_0x0x8x4x1x0x0x0x0x1_64x128x128_1x4x1_16x16x64_default
80,512,7168,2304,18,0,55.5452,a8w8_bpreshuffle_cktile_0x0x8x4x1x0x0x0x0x1_64x128x128_1x4x1_16x16x64_default
80,512,8192,1024,18,0,36.7943,a8w8_bpreshuffle_cktile_0x0x8x4x1x0x0x0x0x1_64x128x128_1x4x1_16x16x64_default
80,1024,512,7168,24,0,34.1667,a8w8_bpreshuffle_cktile_0x0x8x4x1x0x0x0x0x1_64x128x256_1x4x1_16x16x64_default
80,1024,576,7168,22,0,35.6719,a8w8_bpreshuffle_cktile_0x0x8x4x1x0x0x0x0x1_64x64x256_1x4x1_16x16x64_default
80,1024,1280,8192,24,0,63.8904,a8w8_bpreshuffle_cktile_0x0x8x4x1x0x0x0x0x1_64x128x256_1x4x1_16x16x64_default
80,1024,1536,7168,23,0,80.1889,a8w8_bpreshuffle_cktile_0x0x8x4x1x0x0x0x0x1_32x128x256_1x4x1_16x16x64_default
80,1024,3072,1536,18,0,38.5955,a8w8_bpreshuffle_cktile_0x0x8x4x1x0x0x0x0x1_64x128x128_1x4x1_16x16x64_default
80,1024,4096,512,18,0,24.2979,a8w8_bpreshuffle_cktile_0x0x8x4x1x0x0x0x0x1_64x128x128_1x4x1_16x16x64_default
80,1024,4608,4096,18,0,119.0658,a8w8_bpreshuffle_cktile_0x0x8x4x1x0x0x0x0x1_64x128x128_1x4x1_16x16x64_default
80,1024,4608,7168,0,0,197.8749,a8w8_bpreshuffle_cktile_0x0x8x4x1x0x0x0x0x1_128x128x128_1x4x1_16x16x64_default
80,1024,7168,256,13,0,27.2755,a8w8_bpreshuffle_cktile_0x0x8x4x1x0x0x0x0x1_128x128x64_1x4x1_16x16x64_default
80,1024,7168,2048,18,0,98.2941,a8w8_bpreshuffle_cktile_0x0x8x4x1x0x0x0x0x1_64x128x128_1x4x1_16x16x64_default
80,1024,7168,2304,18,0,103.5474,a8w8_bpreshuffle_cktile_0x0x8x4x1x0x0x0x0x1_64x128x128_1x4x1_16x16x64_default
80,1024,8192,1024,18,0,65.966,a8w8_bpreshuffle_cktile_0x0x8x4x1x0x0x0x0x1_64x128x128_1x4x1_16x16x64_default
80,1024,9216,4096,18,0,219.9733,a8w8_bpreshuffle_cktile_0x0x8x4x1x0x0x0x0x1_64x128x128_1x4x1_16x16x64_default
80,1536,512,7168,23,0,49.1596,a8w8_bpreshuffle_cktile_0x0x8x4x1x0x0x0x0x1_32x128x256_1x4x1_16x16x64_default
80,1536,576,7168,22,0,58.6084,a8w8_bpreshuffle_cktile_0x0x8x4x1x0x0x0x0x1_64x64x256_1x4x1_16x16x64_default
80,1536,1536,7168,20,0,100.8805,a8w8_bpreshuffle_cktile_0x0x8x4x1x0x0x0x0x1_64x256x128_1x4x1_16x16x64_default
80,1536,3072,1536,18,0,53.5436,a8w8_bpreshuffle_cktile_0x0x8x4x1x0x0x0x0x1_64x128x128_1x4x1_16x16x64_default
80,1536,4096,512,18,0,32.4163,a8w8_bpreshuffle_cktile_0x0x8x4x1x0x0x0x0x1_64x128x128_1x4x1_16x16x64_default
80,1536,4608,7168,18,0,274.8619,a8w8_bpreshuffle_cktile_0x0x8x4x1x0x0x0x0x1_64x128x128_1x4x1_16x16x64_default
80,1536,7168,256,19,0,36.8063,a8w8_bpreshuffle_cktile_0x0x8x4x1x0x0x0x0x1_32x256x128_1x4x1_16x16x64_default
80,1536,7168,2048,18,0,135.0262,a8w8_bpreshuffle_cktile_0x0x8x4x1x0x0x0x0x1_64x128x128_1x4x1_16x16x64_default
80,1536,7168,2304,18,0,145.2795,a8w8_bpreshuffle_cktile_0x0x8x4x1x0x0x0x0x1_64x128x128_1x4x1_16x16x64_default
80,2048,512,7168,24,0,53.7264,a8w8_bpreshuffle_cktile_0x0x8x4x1x0x0x0x0x1_64x128x256_1x4x1_16x16x64_default
80,2048,576,7168,11,0,66.5692,a8w8_bpreshuffle_cktile_0x0x8x4x1x0x0x0x0x1_128x64x128_1x4x1_16x16x64_default
80,2048,1280,8192,0,0,116.051,a8w8_bpreshuffle_cktile_0x0x8x4x1x0x0x0x0x1_128x128x128_1x4x1_16x16x64_default
80,2048,1536,7168,24,0,130.1758,a8w8_bpreshuffle_cktile_0x0x8x4x1x0x0x0x0x1_64x128x256_1x4x1_16x16x64_default
80,2048,3072,1536,0,0,68.7752,a8w8_bpreshuffle_cktile_0x0x8x4x1x0x0x0x0x1_128x128x128_1x4x1_16x16x64_default
80,2048,4096,512,19,0,42.9131,a8w8_bpreshuffle_cktile_0x0x8x4x1x0x0x0x0x1_32x256x128_1x4x1_16x16x64_default
80,2048,4608,4096,18,0,221.7241,a8w8_bpreshuffle_cktile_0x0x8x4x1x0x0x0x0x1_64x128x128_1x4x1_16x16x64_default
80,2048,4608,7168,18,0,370.5347,a8w8_bpreshuffle_cktile_0x0x8x4x1x0x0x0x0x1_64x128x128_1x4x1_16x16x64_default
80,2048,7168,256,18,0,47.6936,a8w8_bpreshuffle_cktile_0x0x8x4x1x0x0x0x0x1_64x128x128_1x4x1_16x16x64_default
80,2048,7168,2048,18,0,183.8204,a8w8_bpreshuffle_cktile_0x0x8x4x1x0x0x0x0x1_64x128x128_1x4x1_16x16x64_default
80,2048,7168,2304,18,0,194.6209,a8w8_bpreshuffle_cktile_0x0x8x4x1x0x0x0x0x1_64x128x128_1x4x1_16x16x64_default
80,2048,8192,1024,18,0,118.959,a8w8_bpreshuffle_cktile_0x0x8x4x1x0x0x0x0x1_64x128x128_1x4x1_16x16x64_default
80,2048,9216,4096,18,0,413.5632,a8w8_bpreshuffle_cktile_0x0x8x4x1x0x0x0x0x1_64x128x128_1x4x1_16x16x64_default
80,4096,512,7168,0,0,100.4177,a8w8_bpreshuffle_cktile_0x0x8x4x1x0x0x0x0x1_128x128x128_1x4x1_16x16x64_default
80,4096,576,7168,22,0,132.6314,a8w8_bpreshuffle_cktile_0x0x8x4x1x0x0x0x0x1_64x64x256_1x4x1_16x16x64_default
80,4096,1280,8192,0,0,225.2709,a8w8_bpreshuffle_cktile_0x0x8x4x1x0x0x0x0x1_128x128x128_1x4x1_16x16x64_default
80,4096,1536,7168,20,0,248.2182,a8w8_bpreshuffle_cktile_0x0x8x4x1x0x0x0x0x1_64x256x128_1x4x1_16x16x64_default
80,4096,3072,1536,18,0,123.539,a8w8_bpreshuffle_cktile_0x0x8x4x1x0x0x0x0x1_64x128x128_1x4x1_16x16x64_default
80,4096,4096,512,10,0,76.9861,a8w8_bpreshuffle_cktile_0x0x8x4x1x0x0x0x0x1_64x256x64_1x4x1_16x16x64_default
80,4096,4608,4096,18,0,412.8216,a8w8_bpreshuffle_cktile_0x0x8x4x1x0x0x0x0x1_64x128x128_1x4x1_16x16x64_default
80,4096,4608,7168,18,0,700.8117,a8w8_bpreshuffle_cktile_0x0x8x4x1x0x0x0x0x1_64x128x128_1x4x1_16x16x64_default
80,4096,7168,256,10,0,87.3533,a8w8_bpreshuffle_cktile_0x0x8x4x1x0x0x0x0x1_64x256x64_1x4x1_16x16x64_default
80,4096,7168,2048,18,0,344.2661,a8w8_bpreshuffle_cktile_0x0x8x4x1x0x0x0x0x1_64x128x128_1x4x1_16x16x64_default
80,4096,7168,2304,18,0,372.3558,a8w8_bpreshuffle_cktile_0x0x8x4x1x0x0x0x0x1_64x128x128_1x4x1_16x16x64_default
80,4096,8192,1024,18,0,227.453,a8w8_bpreshuffle_cktile_0x0x8x4x1x0x0x0x0x1_64x128x128_1x4x1_16x16x64_default
80,4096,9216,4096,0,0,829.0846,a8w8_bpreshuffle_cktile_0x0x8x4x1x0x0x0x0x1_128x128x128_1x4x1_16x16x64_default
80,4240,9216,4096,18,0,859.5263,a8w8_bpreshuffle_cktile_0x0x8x4x1x0x0x0x0x1_64x128x128_1x4x1_16x16x64_default
80,8192,512,7168,24,0,182.4268,a8w8_bpreshuffle_cktile_0x0x8x4x1x0x0x0x0x1_64x128x256_1x4x1_16x16x64_default
80,8192,576,7168,22,0,248.939,a8w8_bpreshuffle_cktile_0x0x8x4x1x0x0x0x0x1_64x64x256_1x4x1_16x16x64_default
80,8192,1280,8192,20,0,444.2489,a8w8_bpreshuffle_cktile_0x0x8x4x1x0x0x0x0x1_64x256x128_1x4x1_16x16x64_default
80,8192,1536,7168,18,0,482.8762,a8w8_bpreshuffle_cktile_0x0x8x4x1x0x0x0x0x1_64x128x128_1x4x1_16x16x64_default
80,8192,3072,1536,18,0,237.4442,a8w8_bpreshuffle_cktile_0x0x8x4x1x0x0x0x0x1_64x128x128_1x4x1_16x16x64_default
80,8192,4096,512,18,0,142.1119,a8w8_bpreshuffle_cktile_0x0x8x4x1x0x0x0x0x1_64x128x128_1x4x1_16x16x64_default
80,8192,4608,7168,0,0,1395.2117,a8w8_bpreshuffle_cktile_0x0x8x4x1x0x0x0x0x1_128x128x128_1x4x1_16x16x64_default
80,8192,7168,256,10,0,163.3959,a8w8_bpreshuffle_cktile_0x0x8x4x1x0x0x0x0x1_64x256x64_1x4x1_16x16x64_default
80,8192,7168,2048,18,0,677.7193,a8w8_bpreshuffle_cktile_0x0x8x4x1x0x0x0x0x1_64x128x128_1x4x1_16x16x64_default
80,8192,7168,2304,18,0,741.0839,a8w8_bpreshuffle_cktile_0x0x8x4x1x0x0x0x0x1_64x128x128_1x4x1_16x16x64_default
80,8192,8192,1024,18,0,442.8701,a8w8_bpreshuffle_cktile_0x0x8x4x1x0x0x0x0x1_64x128x128_1x4x1_16x16x64_default
80,16384,512,7168,24,0,330.6281,a8w8_bpreshuffle_cktile_0x0x8x4x1x0x0x0x0x1_64x128x256_1x4x1_16x16x64_default
80,16384,576,7168,22,0,477.5882,a8w8_bpreshuffle_cktile_0x0x8x4x1x0x0x0x0x1_64x64x256_1x4x1_16x16x64_default
80,16384,1280,8192,0,0,879.9267,a8w8_bpreshuffle_cktile_0x0x8x4x1x0x0x0x0x1_128x128x128_1x4x1_16x16x64_default
80,16384,1536,7168,18,0,951.5762,a8w8_bpreshuffle_cktile_0x0x8x4x1x0x0x0x0x1_64x128x128_1x4x1_16x16x64_default
80,16384,3072,1536,18,0,460.9537,a8w8_bpreshuffle_cktile_0x0x8x4x1x0x0x0x0x1_64x128x128_1x4x1_16x16x64_default
80,16384,4096,512,18,0,276.3391,a8w8_bpreshuffle_cktile_0x0x8x4x1x0x0x0x0x1_64x128x128_1x4x1_16x16x64_default
80,16384,4608,4096,20,0,1665.007,a8w8_bpreshuffle_cktile_0x0x8x4x1x0x0x0x0x1_64x256x128_1x4x1_16x16x64_default
80,16384,4608,7168,18,0,2760.4754,a8w8_bpreshuffle_cktile_0x0x8x4x1x0x0x0x0x1_64x128x128_1x4x1_16x16x64_default
80,16384,7168,256,10,0,317.3753,a8w8_bpreshuffle_cktile_0x0x8x4x1x0x0x0x0x1_64x256x64_1x4x1_16x16x64_default
80,16384,7168,2048,18,0,1338.4815,a8w8_bpreshuffle_cktile_0x0x8x4x1x0x0x0x0x1_64x128x128_1x4x1_16x16x64_default
80,16384,7168,2304,18,0,1476.6004,a8w8_bpreshuffle_cktile_0x0x8x4x1x0x0x0x0x1_64x128x128_1x4x1_16x16x64_default
80,16384,8192,1024,18,0,866.8111,a8w8_bpreshuffle_cktile_0x0x8x4x1x0x0x0x0x1_64x128x128_1x4x1_16x16x64_default
80,16384,9216,4096,0,0,3293.2216,a8w8_bpreshuffle_cktile_0x0x8x4x1x0x0x0x0x1_128x128x128_1x4x1_16x16x64_default
80,20480,512,7168,20,0,398.5671,a8w8_bpreshuffle_cktile_0x0x8x4x1x0x0x0x0x1_64x256x128_1x4x1_16x16x64_default
80,20480,576,7168,16,0,630.8847,a8w8_bpreshuffle_cktile_0x0x8x4x1x0x0x0x0x1_64x64x128_1x4x1_16x16x64_default
80,20480,1536,7168,0,0,1159.5373,a8w8_bpreshuffle_cktile_0x0x8x4x1x0x0x0x0x1_128x128x128_1x4x1_16x16x64_default
80,20480,3072,1536,18,0,573.2885,a8w8_bpreshuffle_cktile_0x0x8x4x1x0x0x0x0x1_64x128x128_1x4x1_16x16x64_default
80,20480,4096,512,10,0,341.3629,a8w8_bpreshuffle_cktile_0x0x8x4x1x0x0x0x0x1_64x256x64_1x4x1_16x16x64_default
80,20480,4608,7168,18,0,3436.7637,a8w8_bpreshuffle_cktile_0x0x8x4x1x0x0x0x0x1_64x128x128_1x4x1_16x16x64_default
80,20480,7168,256,10,0,395.0211,a8w8_bpreshuffle_cktile_0x0x8x4x1x0x0x0x0x1_64x256x64_1x4x1_16x16x64_default
80,20480,7168,2048,18,0,1676.2894,a8w8_bpreshuffle_cktile_0x0x8x4x1x0x0x0x0x1_64x128x128_1x4x1_16x16x64_default
80,20480,7168,2304,18,0,1871.0601,a8w8_bpreshuffle_cktile_0x0x8x4x1x0x0x0x0x1_64x128x128_1x4x1_16x16x64_default
80,32768,4608,4096,18,0,3212.2533,a8w8_bpreshuffle_cktile_0x0x8x4x1x0x0x0x0x1_64x128x128_1x4x1_16x16x64_default
80,32768,9216,4096,18,0,6398.4537,a8w8_bpreshuffle_cktile_0x0x8x4x1x0x0x0x0x1_64x128x128_1x4x1_16x16x64_default
