aiter/configs/a8w8_blockscale_wpreshuffle_tuned_gemm.csv
cu_num,M,N,K,kernelId,splitK,us,kernelName
80,16,1536,7168,8,0,21.0635,a8w8_blockscale_wpreshuffle_1x128x128_256x16x64x256_16x16_16x16_16x16x1_16x16x1_1x16x1x16_4_1x1_intrawave_v1
80,16,3072,1536,8,0,7.9214,a8w8_blockscale_wpreshuffle_1x128x128_256x16x64x256_16x16_16x16_16x16x1_16x16x1_1x16x1x16_4_1x1_intrawave_v1
80,16,576,7168,8,0,20.0795,a8w8_blockscale_wpreshuffle_1x128x128_256x16x64x256_16x16_16x16_16x16x1_16x16x1_1x16x1x16_4_1x1_intrawave_v1
80,16,7168,256,8,0,3.9406,a8w8_blockscale_wpreshuffle_1x128x128_256x16x64x256_16x16_16x16_16x16x1_16x16x1_1x16x1x16_4_1x1_intrawave_v1
80,16,7168,2048,8,0,11.3346,a8w8_blockscale_wpreshuffle_1x128x128_256x16x64x256_16x16_16x16_16x16x1_16x16x1_1x16x1x16_4_1x1_intrawave_v1
80,16,4608,7168,8,0,21.7363,a8w8_blockscale_wpreshuffle_1x128x128_256x16x64x256_16x16_16x16_16x16x1_16x16x1_1x16x1x16_4_1x1_intrawave_v1
80,16,7168,2304,8,0,11.6926,a8w8_blockscale_wpreshuffle_1x128x128_256x16x64x256_16x16_16x16_16x16x1_16x16x1_1x16x1x16_4_1x1_intrawave_v1
80,16,512,7168,8,0,20.0967,a8w8_blockscale_wpreshuffle_1x128x128_256x16x64x256_16x16_16x16_16x16x1_16x16x1_1x16x1x16_4_1x1_intrawave_v1
80,16,4096,512,8,0,3.8642,a8w8_blockscale_wpreshuffle_1x128x128_256x16x64x256_16x16_16x16_16x16x1_16x16x1_1x16x1x16_4_1x1_intrawave_v1
80,32,1536,7168,8,0,21.1831,a8w8_blockscale_wpreshuffle_1x128x128_256x16x64x256_16x16_16x16_16x16x1_16x16x1_1x16x1x16_4_1x1_intrawave_v1
80,32,3072,1536,13,0,9.599,a8w8_blockscale_wpreshuffle_1x128x128_256x32x64x256_16x16_16x16_16x16x1_16x16x1_1x32x1x8_8_2x1_intrawave_v1
80,32,576,7168,8,0,20.5371,a8w8_blockscale_wpreshuffle_1x128x128_256x16x64x256_16x16_16x16_16x16x1_16x16x1_1x16x1x16_4_1x1_intrawave_v1
80,32,7168,256,11,0,4.9838,a8w8_blockscale_wpreshuffle_1x128x128_256x32x64x128_16x16_16x16_8x32x1_8x32x1_1x32x1x8_8_2x1_intrawave_v1
80,32,7168,2048,8,0,14.9715,a8w8_blockscale_wpreshuffle_1x128x128_256x16x64x256_16x16_16x16_16x16x1_16x16x1_1x16x1x16_4_1x1_intrawave_v1
80,32,4608,7168,13,0,25.5599,a8w8_blockscale_wpreshuffle_1x128x128_256x32x64x256_16x16_16x16_16x16x1_16x16x1_1x32x1x8_8_2x1_intrawave_v1
80,32,7168,2304,13,0,14.9778,a8w8_blockscale_wpreshuffle_1x128x128_256x32x64x256_16x16_16x16_16x16x1_16x16x1_1x32x1x8_8_2x1_intrawave_v1
80,32,512,7168,8,0,20.3155,a8w8_blockscale_wpreshuffle_1x128x128_256x16x64x256_16x16_16x16_16x16x1_16x16x1_1x16x1x16_4_1x1_intrawave_v1
80,32,4096,512,8,0,5.1662,a8w8_blockscale_wpreshuffle_1x128x128_256x16x64x256_16x16_16x16_16x16x1_16x16x1_1x16x1x16_4_1x1_intrawave_v1
80,64,1536,7168,13,0,25.1775,a8w8_blockscale_wpreshuffle_1x128x128_256x32x64x256_16x16_16x16_16x16x1_16x16x1_1x32x1x8_8_2x1_intrawave_v1
80,64,3072,1536,7,0,11.5383,a8w8_blockscale_wpreshuffle_1x128x128_256x16x128x256_16x16_16x16_16x16x1_16x16x1_1x16x1x16_8_1x2_intrawave_v1
80,64,576,7168,8,0,20.4323,a8w8_blockscale_wpreshuffle_1x128x128_256x16x64x256_16x16_16x16_16x16x1_16x16x1_1x16x1x16_4_1x1_intrawave_v1
80,64,7168,256,11,0,6.8162,a8w8_blockscale_wpreshuffle_1x128x128_256x32x64x128_16x16_16x16_8x32x1_8x32x1_1x32x1x8_8_2x1_intrawave_v1
80,64,7168,2048,13,0,19.8071,a8w8_blockscale_wpreshuffle_1x128x128_256x32x64x256_16x16_16x16_16x16x1_16x16x1_1x32x1x8_8_2x1_intrawave_v1
80,64,4608,7168,18,0,36.9255,a8w8_blockscale_wpreshuffle_1x128x128_256x64x64x256_16x16_16x16_16x16x1_16x16x1_1x32x1x8_8_2x2_intrawave_v1
80,64,7168,2304,13,0,20.3171,a8w8_blockscale_wpreshuffle_1x128x128_256x32x64x256_16x16_16x16_16x16x1_16x16x1_1x32x1x8_8_2x1_intrawave_v1
80,64,512,7168,8,0,20.1307,a8w8_blockscale_wpreshuffle_1x128x128_256x16x64x256_16x16_16x16_16x16x1_16x16x1_1x16x1x16_4_1x1_intrawave_v1
80,64,4096,512,8,0,6.7138,a8w8_blockscale_wpreshuffle_1x128x128_256x16x64x256_16x16_16x16_16x16x1_16x16x1_1x16x1x16_4_1x1_intrawave_v1
80,128,1536,7168,18,0,36.5259,a8w8_blockscale_wpreshuffle_1x128x128_256x64x64x256_16x16_16x16_16x16x1_16x16x1_1x32x1x8_8_2x2_intrawave_v1
80,128,3072,1536,13,0,15.3131,a8w8_blockscale_wpreshuffle_1x128x128_256x32x64x256_16x16_16x16_16x16x1_16x16x1_1x32x1x8_8_2x1_intrawave_v1
80,128,576,7168,8,0,20.3263,a8w8_blockscale_wpreshuffle_1x128x128_256x16x64x256_16x16_16x16_16x16x1_16x16x1_1x16x1x16_4_1x1_intrawave_v1
80,128,7168,256,11,0,9.9602,a8w8_blockscale_wpreshuffle_1x128x128_256x32x64x128_16x16_16x16_8x32x1_8x32x1_1x32x1x8_8_2x1_intrawave_v1
80,128,7168,2048,18,0,32.5855,a8w8_blockscale_wpreshuffle_1x128x128_256x64x64x256_16x16_16x16_16x16x1_16x16x1_1x32x1x8_8_2x2_intrawave_v1
80,128,4608,7168,12,0,62.2008,a8w8_blockscale_wpreshuffle_1x128x128_256x32x128x256_16x16_16x16_16x16x1_16x16x1_1x32x1x8_8_2x2_intrawave_v1
80,128,7168,2304,12,0,30.8263,a8w8_blockscale_wpreshuffle_1x128x128_256x32x128x256_16x16_16x16_16x16x1_16x16x1_1x32x1x8_8_2x2_intrawave_v1
80,128,512,7168,8,0,20.5079,a8w8_blockscale_wpreshuffle_1x128x128_256x16x64x256_16x16_16x16_16x16x1_16x16x1_1x16x1x16_4_1x1_intrawave_v1
80,128,4096,512,8,0,9.9702,a8w8_blockscale_wpreshuffle_1x128x128_256x16x64x256_16x16_16x16_16x16x1_16x16x1_1x16x1x16_4_1x1_intrawave_v1
80,256,1536,7168,13,0,52.064,a8w8_blockscale_wpreshuffle_1x128x128_256x32x64x256_16x16_16x16_16x16x1_16x16x1_1x32x1x8_8_2x1_intrawave_v1
80,256,3072,1536,13,0,22.7451,a8w8_blockscale_wpreshuffle_1x128x128_256x32x64x256_16x16_16x16_16x16x1_16x16x1_1x32x1x8_8_2x1_intrawave_v1
80,256,576,7168,13,0,24.4615,a8w8_blockscale_wpreshuffle_1x128x128_256x32x64x256_16x16_16x16_16x16x1_16x16x1_1x32x1x8_8_2x1_intrawave_v1
80,256,7168,256,10,0,15.1819,a8w8_blockscale_wpreshuffle_1x128x128_256x32x128x128_16x16_16x16_8x32x1_8x32x1_1x32x1x8_8_2x2_intrawave_v1
80,256,7168,2048,17,0,56.0344,a8w8_blockscale_wpreshuffle_1x128x128_256x64x128x256_16x16_16x16_16x16x1_16x16x1_1x32x1x8_8_2x2_intrawave_v1
80,256,4608,7168,17,0,103.9278,a8w8_blockscale_wpreshuffle_1x128x128_256x64x128x256_16x16_16x16_16x16x1_16x16x1_1x32x1x8_8_2x2_intrawave_v1
80,256,7168,2304,9,0,52.0096,a8w8_blockscale_wpreshuffle_1x128x128_256x32x256x128_16x16_16x16_8x32x1_8x32x1_1x32x1x8_8_2x2_intrawave_v1
80,256,512,7168,13,0,24.1731,a8w8_blockscale_wpreshuffle_1x128x128_256x32x64x256_16x16_16x16_16x16x1_16x16x1_1x32x1x8_8_2x1_intrawave_v1
80,256,4096,512,13,0,13.3762,a8w8_blockscale_wpreshuffle_1x128x128_256x32x64x256_16x16_16x16_16x16x1_16x16x1_1x32x1x8_8_2x1_intrawave_v1
80,512,1536,7168,13,0,82.5045,a8w8_blockscale_wpreshuffle_1x128x128_256x32x64x256_16x16_16x16_16x16x1_16x16x1_1x32x1x8_8_2x1_intrawave_v1
80,512,3072,1536,10,0,38.0791,a8w8_blockscale_wpreshuffle_1x128x128_256x32x128x128_16x16_16x16_8x32x1_8x32x1_1x32x1x8_8_2x2_intrawave_v1
80,512,576,7168,18,0,36.5223,a8w8_blockscale_wpreshuffle_1x128x128_256x64x64x256_16x16_16x16_16x16x1_16x16x1_1x32x1x8_8_2x2_intrawave_v1
80,512,7168,256,11,0,23.0151,a8w8_blockscale_wpreshuffle_1x128x128_256x32x64x128_16x16_16x16_8x32x1_8x32x1_1x32x1x8_8_2x1_intrawave_v1
80,512,7168,2048,17,0,98.1562,a8w8_blockscale_wpreshuffle_1x128x128_256x64x128x256_16x16_16x16_16x16x1_16x16x1_1x32x1x8_8_2x2_intrawave_v1
80,512,4608,7168,14,0,196.1198,a8w8_blockscale_wpreshuffle_1x128x128_256x64x256x128_16x16_16x16_8x32x1_8x32x1_1x32x1x8_8_2x2_intrawave_v1
80,512,7168,2304,12,0,101.0638,a8w8_blockscale_wpreshuffle_1x128x128_256x32x128x256_16x16_16x16_16x16x1_16x16x1_1x32x1x8_8_2x2_intrawave_v1
80,512,512,7168,13,0,36.2907,a8w8_blockscale_wpreshuffle_1x128x128_256x32x64x256_16x16_16x16_16x16x1_16x16x1_1x32x1x8_8_2x1_intrawave_v1
80,512,4096,512,12,0,21.4155,a8w8_blockscale_wpreshuffle_1x128x128_256x32x128x256_16x16_16x16_16x16x1_16x16x1_1x32x1x8_8_2x2_intrawave_v1
80,1024,1536,7168,12,0,143.4972,a8w8_blockscale_wpreshuffle_1x128x128_256x32x128x256_16x16_16x16_16x16x1_16x16x1_1x32x1x8_8_2x2_intrawave_v1
80,1024,3072,1536,9,0,60.3752,a8w8_blockscale_wpreshuffle_1x128x128_256x32x256x128_16x16_16x16_8x32x1_8x32x1_1x32x1x8_8_2x2_intrawave_v1
80,1024,576,7168,18,0,60.9192,a8w8_blockscale_wpreshuffle_1x128x128_256x64x64x256_16x16_16x16_16x16x1_16x16x1_1x32x1x8_8_2x2_intrawave_v1
80,1024,7168,256,9,0,42.7136,a8w8_blockscale_wpreshuffle_1x128x128_256x32x256x128_16x16_16x16_8x32x1_8x32x1_1x32x1x8_8_2x2_intrawave_v1
80,1024,7168,2048,17,0,184.0865,a8w8_blockscale_wpreshuffle_1x128x128_256x64x128x256_16x16_16x16_16x16x1_16x16x1_1x32x1x8_8_2x2_intrawave_v1
80,1024,4608,7168,17,0,387.5469,a8w8_blockscale_wpreshuffle_1x128x128_256x64x128x256_16x16_16x16_16x16x1_16x16x1_1x32x1x8_8_2x2_intrawave_v1
80,1024,7168,2304,9,0,182.5945,a8w8_blockscale_wpreshuffle_1x128x128_256x32x256x128_16x16_16x16_8x32x1_8x32x1_1x32x1x8_8_2x2_intrawave_v1
80,1024,512,7168,12,0,59.8284,a8w8_blockscale_wpreshuffle_1x128x128_256x32x128x256_16x16_16x16_16x16x1_16x16x1_1x32x1x8_8_2x2_intrawave_v1
80,1024,4096,512,13,0,34.3563,a8w8_blockscale_wpreshuffle_1x128x128_256x32x64x256_16x16_16x16_16x16x1_16x16x1_1x32x1x8_8_2x1_intrawave_v1
80,1536,1536,7168,14,0,197.5802,a8w8_blockscale_wpreshuffle_1x128x128_256x64x256x128_16x16_16x16_8x32x1_8x32x1_1x32x1x8_8_2x2_intrawave_v1
80,1536,3072,1536,9,0,90.675,a8w8_blockscale_wpreshuffle_1x128x128_256x32x256x128_16x16_16x16_8x32x1_8x32x1_1x32x1x8_8_2x2_intrawave_v1
80,1536,576,7168,18,0,90.2729,a8w8_blockscale_wpreshuffle_1x128x128_256x64x64x256_16x16_16x16_16x16x1_16x16x1_1x32x1x8_8_2x2_intrawave_v1
80,1536,7168,256,11,0,57.5528,a8w8_blockscale_wpreshuffle_1x128x128_256x32x64x128_16x16_16x16_8x32x1_8x32x1_1x32x1x8_8_2x1_intrawave_v1
80,1536,7168,2048,9,0,268.8492,a8w8_blockscale_wpreshuffle_1x128x128_256x32x256x128_16x16_16x16_8x32x1_8x32x1_1x32x1x8_8_2x2_intrawave_v1
80,1536,4608,7168,9,0,546.3363,a8w8_blockscale_wpreshuffle_1x128x128_256x32x256x128_16x16_16x16_8x32x1_8x32x1_1x32x1x8_8_2x2_intrawave_v1
80,1536,7168,2304,9,0,258.028,a8w8_blockscale_wpreshuffle_1x128x128_256x32x256x128_16x16_16x16_8x32x1_8x32x1_1x32x1x8_8_2x2_intrawave_v1
80,1536,512,7168,13,0,82.6933,a8w8_blockscale_wpreshuffle_1x128x128_256x32x64x256_16x16_16x16_16x16x1_16x16x1_1x32x1x8_8_2x1_intrawave_v1
80,1536,4096,512,13,0,48.2244,a8w8_blockscale_wpreshuffle_1x128x128_256x32x64x256_16x16_16x16_16x16x1_16x16x1_1x32x1x8_8_2x1_intrawave_v1
80,2048,1536,7168,17,0,251.0496,a8w8_blockscale_wpreshuffle_1x128x128_256x64x128x256_16x16_16x16_16x16x1_16x16x1_1x32x1x8_8_2x2_intrawave_v1
80,2048,3072,1536,9,0,112.2346,a8w8_blockscale_wpreshuffle_1x128x128_256x32x256x128_16x16_16x16_8x32x1_8x32x1_1x32x1x8_8_2x2_intrawave_v1
80,2048,576,7168,18,0,116.4119,a8w8_blockscale_wpreshuffle_1x128x128_256x64x64x256_16x16_16x16_16x16x1_16x16x1_1x32x1x8_8_2x2_intrawave_v1
80,2048,7168,256,11,0,75.2361,a8w8_blockscale_wpreshuffle_1x128x128_256x32x64x128_16x16_16x16_8x32x1_8x32x1_1x32x1x8_8_2x1_intrawave_v1
80,2048,7168,2048,9,0,353.3944,a8w8_blockscale_wpreshuffle_1x128x128_256x32x256x128_16x16_16x16_8x32x1_8x32x1_1x32x1x8_8_2x2_intrawave_v1
80,2048,4608,7168,17,0,711.9046,a8w8_blockscale_wpreshuffle_1x128x128_256x64x128x256_16x16_16x16_16x16x1_16x16x1_1x32x1x8_8_2x2_intrawave_v1
80,2048,7168,2304,9,0,344.5519,a8w8_blockscale_wpreshuffle_1x128x128_256x32x256x128_16x16_16x16_8x32x1_8x32x1_1x32x1x8_8_2x2_intrawave_v1
80,2048,512,7168,17,0,101.5026,a8w8_blockscale_wpreshuffle_1x128x128_256x64x128x256_16x16_16x16_16x16x1_16x16x1_1x32x1x8_8_2x2_intrawave_v1
80,2048,4096,512,13,0,62.4016,a8w8_blockscale_wpreshuffle_1x128x128_256x32x64x256_16x16_16x16_16x16x1_16x16x1_1x32x1x8_8_2x1_intrawave_v1
80,4096,1536,7168,14,0,478.0408,a8w8_blockscale_wpreshuffle_1x128x128_256x64x256x128_16x16_16x16_8x32x1_8x32x1_1x32x1x8_8_2x2_intrawave_v1
80,4096,3072,1536,9,0,214.4782,a8w8_blockscale_wpreshuffle_1x128x128_256x32x256x128_16x16_16x16_8x32x1_8x32x1_1x32x1x8_8_2x2_intrawave_v1
80,4096,576,7168,18,0,225.9639,a8w8_blockscale_wpreshuffle_1x128x128_256x64x64x256_16x16_16x16_16x16x1_16x16x1_1x32x1x8_8_2x2_intrawave_v1
80,4096,7168,256,9,0,145.852,a8w8_blockscale_wpreshuffle_1x128x128_256x32x256x128_16x16_16x16_8x32x1_8x32x1_1x32x1x8_8_2x2_intrawave_v1
80,4096,7168,2048,17,0,665.21,a8w8_blockscale_wpreshuffle_1x128x128_256x64x128x256_16x16_16x16_16x16x1_16x16x1_1x32x1x8_8_2x2_intrawave_v1
80,4096,4608,7168,17,0,1378.0931,a8w8_blockscale_wpreshuffle_1x128x128_256x64x128x256_16x16_16x16_16x16x1_16x16x1_1x32x1x8_8_2x2_intrawave_v1
80,4096,7168,2304,9,0,667.166,a8w8_blockscale_wpreshuffle_1x128x128_256x32x256x128_16x16_16x16_8x32x1_8x32x1_1x32x1x8_8_2x2_intrawave_v1
80,4096,512,7168,12,0,195.839,a8w8_blockscale_wpreshuffle_1x128x128_256x32x128x256_16x16_16x16_16x16x1_16x16x1_1x32x1x8_8_2x2_intrawave_v1
80,4096,4096,512,13,0,116.9999,a8w8_blockscale_wpreshuffle_1x128x128_256x32x64x256_16x16_16x16_16x16x1_16x16x1_1x32x1x8_8_2x1_intrawave_v1
80,8192,1536,7168,14,0,934.8066,a8w8_blockscale_wpreshuffle_1x128x128_256x64x256x128_16x16_16x16_8x32x1_8x32x1_1x32x1x8_8_2x2_intrawave_v1
80,8192,3072,1536,9,0,412.1838,a8w8_blockscale_wpreshuffle_1x128x128_256x32x256x128_16x16_16x16_8x32x1_8x32x1_1x32x1x8_8_2x2_intrawave_v1
80,8192,576,7168,18,0,420.381,a8w8_blockscale_wpreshuffle_1x128x128_256x64x64x256_16x16_16x16_16x16x1_16x16x1_1x32x1x8_8_2x2_intrawave_v1
80,8192,7168,256,11,0,283.8361,a8w8_blockscale_wpreshuffle_1x128x128_256x32x64x128_16x16_16x16_8x32x1_8x32x1_1x32x1x8_8_2x1_intrawave_v1
80,8192,7168,2048,14,0,1324.9129,a8w8_blockscale_wpreshuffle_1x128x128_256x64x256x128_16x16_16x16_8x32x1_8x32x1_1x32x1x8_8_2x2_intrawave_v1
80,8192,4608,7168,14,0,2753.112,a8w8_blockscale_wpreshuffle_1x128x128_256x64x256x128_16x16_16x16_8x32x1_8x32x1_1x32x1x8_8_2x2_intrawave_v1
80,8192,7168,2304,9,0,1334.2238,a8w8_blockscale_wpreshuffle_1x128x128_256x32x256x128_16x16_16x16_8x32x1_8x32x1_1x32x1x8_8_2x2_intrawave_v1
80,8192,512,7168,17,0,342.2355,a8w8_blockscale_wpreshuffle_1x128x128_256x64x128x256_16x16_16x16_16x16x1_16x16x1_1x32x1x8_8_2x2_intrawave_v1
80,8192,4096,512,13,0,226.8211,a8w8_blockscale_wpreshuffle_1x128x128_256x32x64x256_16x16_16x16_16x16x1_16x16x1_1x32x1x8_8_2x1_intrawave_v1
80,16384,1536,7168,17,0,1857.5914,a8w8_blockscale_wpreshuffle_1x128x128_256x64x128x256_16x16_16x16_16x16x1_16x16x1_1x32x1x8_8_2x2_intrawave_v1
80,16384,3072,1536,9,0,811.5677,a8w8_blockscale_wpreshuffle_1x128x128_256x32x256x128_16x16_16x16_8x32x1_8x32x1_1x32x1x8_8_2x2_intrawave_v1
80,16384,576,7168,18,0,795.3725,a8w8_blockscale_wpreshuffle_1x128x128_256x64x64x256_16x16_16x16_16x16x1_16x16x1_1x32x1x8_8_2x2_intrawave_v1
80,16384,7168,256,14,0,550.5519,a8w8_blockscale_wpreshuffle_1x128x128_256x64x256x128_16x16_16x16_8x32x1_8x32x1_1x32x1x8_8_2x2_intrawave_v1
80,16384,7168,2048,14,0,2660.3345,a8w8_blockscale_wpreshuffle_1x128x128_256x64x256x128_16x16_16x16_8x32x1_8x32x1_1x32x1x8_8_2x2_intrawave_v1
80,16384,4608,7168,14,0,5388.6158,a8w8_blockscale_wpreshuffle_1x128x128_256x64x256x128_16x16_16x16_8x32x1_8x32x1_1x32x1x8_8_2x2_intrawave_v1
80,16384,7168,2304,9,0,2637.5028,a8w8_blockscale_wpreshuffle_1x128x128_256x32x256x128_16x16_16x16_8x32x1_8x32x1_1x32x1x8_8_2x2_intrawave_v1
80,16384,512,7168,17,0,657.0879,a8w8_blockscale_wpreshuffle_1x128x128_256x64x128x256_16x16_16x16_16x16x1_16x16x1_1x32x1x8_8_2x2_intrawave_v1
80,16384,4096,512,13,0,453.74,a8w8_blockscale_wpreshuffle_1x128x128_256x32x64x256_16x16_16x16_16x16x1_16x16x1_1x32x1x8_8_2x1_intrawave_v1
80,20480,1536,7168,14,0,2232.712,a8w8_blockscale_wpreshuffle_1x128x128_256x64x256x128_16x16_16x16_8x32x1_8x32x1_1x32x1x8_8_2x2_intrawave_v1
80,20480,3072,1536,9,0,1012.2001,a8w8_blockscale_wpreshuffle_1x128x128_256x32x256x128_16x16_16x16_8x32x1_8x32x1_1x32x1x8_8_2x2_intrawave_v1
80,20480,576,7168,18,0,978.2568,a8w8_blockscale_wpreshuffle_1x128x128_256x64x64x256_16x16_16x16_16x16x1_16x16x1_1x32x1x8_8_2x2_intrawave_v1
80,20480,7168,256,14,0,685.0909,a8w8_blockscale_wpreshuffle_1x128x128_256x64x256x128_16x16_16x16_8x32x1_8x32x1_1x32x1x8_8_2x2_intrawave_v1
80,20480,7168,2048,14,0,3299.7477,a8w8_blockscale_wpreshuffle_1x128x128_256x64x256x128_16x16_16x16_8x32x1_8x32x1_1x32x1x8_8_2x2_intrawave_v1
80,20480,4608,7168,14,0,6693.6665,a8w8_blockscale_wpreshuffle_1x128x128_256x64x256x128_16x16_16x16_8x32x1_8x32x1_1x32x1x8_8_2x2_intrawave_v1
80,20480,7168,2304,9,0,3290.1013,a8w8_blockscale_wpreshuffle_1x128x128_256x32x256x128_16x16_16x16_8x32x1_8x32x1_1x32x1x8_8_2x2_intrawave_v1
80,20480,512,7168,17,0,762.5643,a8w8_blockscale_wpreshuffle_1x128x128_256x64x128x256_16x16_16x16_16x16x1_16x16x1_1x32x1x8_8_2x2_intrawave_v1
80,20480,4096,512,13,0,548.1999,a8w8_blockscale_wpreshuffle_1x128x128_256x32x64x256_16x16_16x16_16x16x1_16x16x1_1x32x1x8_8_2x1_intrawave_v1
