aiter/configs/a8w8_blockscale_wpreshuffle_tuned_gemm.csv
M,N,K,kernelId,splitK,us,kernelName
16,1536,7168,8,0,20.3785,a8w8_blockscale_wpreshuffle_1x128x128_256x16x64x256_16x16_16x16_16x16x1_16x16x1_1x16x1x16_4_1x1_intrawave_v1
16,3072,1536,8,0,7.8312,a8w8_blockscale_wpreshuffle_1x128x128_256x16x64x256_16x16_16x16_16x16x1_16x16x1_1x16x1x16_4_1x1_intrawave_v1
16,576,7168,8,0,19.7897,a8w8_blockscale_wpreshuffle_1x128x128_256x16x64x256_16x16_16x16_16x16x1_16x16x1_1x16x1x16_4_1x1_intrawave_v1
16,7168,256,8,0,3.5388,a8w8_blockscale_wpreshuffle_1x128x128_256x16x64x256_16x16_16x16_16x16x1_16x16x1_1x16x1x16_4_1x1_intrawave_v1
16,7168,2048,8,0,10.7256,a8w8_blockscale_wpreshuffle_1x128x128_256x16x64x256_16x16_16x16_16x16x1_16x16x1_1x16x1x16_4_1x1_intrawave_v1
16,4608,7168,8,0,20.8993,a8w8_blockscale_wpreshuffle_1x128x128_256x16x64x256_16x16_16x16_16x16x1_16x16x1_1x16x1x16_4_1x1_intrawave_v1
16,7168,2304,8,0,11.1284,a8w8_blockscale_wpreshuffle_1x128x128_256x16x64x256_16x16_16x16_16x16x1_16x16x1_1x16x1x16_4_1x1_intrawave_v1
16,512,7168,8,0,19.5321,a8w8_blockscale_wpreshuffle_1x128x128_256x16x64x256_16x16_16x16_16x16x1_16x16x1_1x16x1x16_4_1x1_intrawave_v1
16,4096,512,8,0,3.4608,a8w8_blockscale_wpreshuffle_1x128x128_256x16x64x256_16x16_16x16_16x16x1_16x16x1_1x16x1x16_4_1x1_intrawave_v1
32,1536,7168,8,0,20.1381,a8w8_blockscale_wpreshuffle_1x128x128_256x16x64x256_16x16_16x16_16x16x1_16x16x1_1x16x1x16_4_1x1_intrawave_v1
32,3072,1536,13,0,8.5252,a8w8_blockscale_wpreshuffle_1x128x128_256x32x64x256_16x16_16x16_16x16x1_16x16x1_1x32x1x8_8_2x1_intrawave_v1
32,576,7168,8,0,19.9881,a8w8_blockscale_wpreshuffle_1x128x128_256x16x64x256_16x16_16x16_16x16x1_16x16x1_1x16x1x16_4_1x1_intrawave_v1
32,7168,256,11,0,4.9484,a8w8_blockscale_wpreshuffle_1x128x128_256x32x64x128_16x16_16x16_8x32x1_8x32x1_1x32x1x8_8_2x1_intrawave_v1
32,7168,2048,13,0,13.9868,a8w8_blockscale_wpreshuffle_1x128x128_256x32x64x256_16x16_16x16_16x16x1_16x16x1_1x32x1x8_8_2x1_intrawave_v1
32,4608,7168,13,0,24.8173,a8w8_blockscale_wpreshuffle_1x128x128_256x32x64x256_16x16_16x16_16x16x1_16x16x1_1x32x1x8_8_2x1_intrawave_v1
32,7168,2304,13,0,14.4049,a8w8_blockscale_wpreshuffle_1x128x128_256x32x64x256_16x16_16x16_16x16x1_16x16x1_1x32x1x8_8_2x1_intrawave_v1
32,512,7168,8,0,19.3769,a8w8_blockscale_wpreshuffle_1x128x128_256x16x64x256_16x16_16x16_16x16x1_16x16x1_1x16x1x16_4_1x1_intrawave_v1
32,4096,512,13,0,5.1704,a8w8_blockscale_wpreshuffle_1x128x128_256x32x64x256_16x16_16x16_16x16x1_16x16x1_1x32x1x8_8_2x1_intrawave_v1
64,1536,7168,8,0,24.1017,a8w8_blockscale_wpreshuffle_1x128x128_256x16x64x256_16x16_16x16_16x16x1_16x16x1_1x16x1x16_4_1x1_intrawave_v1
64,3072,1536,8,0,10.6076,a8w8_blockscale_wpreshuffle_1x128x128_256x16x64x256_16x16_16x16_16x16x1_16x16x1_1x16x1x16_4_1x1_intrawave_v1
64,576,7168,8,0,19.7797,a8w8_blockscale_wpreshuffle_1x128x128_256x16x64x256_16x16_16x16_16x16x1_16x16x1_1x16x1x16_4_1x1_intrawave_v1
64,7168,256,7,0,6.5528,a8w8_blockscale_wpreshuffle_1x128x128_256x16x128x256_16x16_16x16_16x16x1_16x16x1_1x16x1x16_8_1x2_intrawave_v1
64,7168,2048,13,0,18.8357,a8w8_blockscale_wpreshuffle_1x128x128_256x32x64x256_16x16_16x16_16x16x1_16x16x1_1x32x1x8_8_2x1_intrawave_v1
64,4608,7168,18,0,35.8041,a8w8_blockscale_wpreshuffle_1x128x128_256x64x64x256_16x16_16x16_16x16x1_16x16x1_1x32x1x8_8_2x2_intrawave_v1
64,7168,2304,13,0,19.6049,a8w8_blockscale_wpreshuffle_1x128x128_256x32x64x256_16x16_16x16_16x16x1_16x16x1_1x32x1x8_8_2x1_intrawave_v1
64,512,7168,8,0,19.6893,a8w8_blockscale_wpreshuffle_1x128x128_256x16x64x256_16x16_16x16_16x16x1_16x16x1_1x16x1x16_4_1x1_intrawave_v1
64,4096,512,7,0,6.7812,a8w8_blockscale_wpreshuffle_1x128x128_256x16x128x256_16x16_16x16_16x16x1_16x16x1_1x16x1x16_8_1x2_intrawave_v1
128,1536,7168,13,0,33.8257,a8w8_blockscale_wpreshuffle_1x128x128_256x32x64x256_16x16_16x16_16x16x1_16x16x1_1x32x1x8_8_2x1_intrawave_v1
128,3072,1536,13,0,14.2212,a8w8_blockscale_wpreshuffle_1x128x128_256x32x64x256_16x16_16x16_16x16x1_16x16x1_1x32x1x8_8_2x1_intrawave_v1
128,576,7168,8,0,20.0341,a8w8_blockscale_wpreshuffle_1x128x128_256x16x64x256_16x16_16x16_16x16x1_16x16x1_1x16x1x16_4_1x1_intrawave_v1
128,7168,256,7,0,8.692,a8w8_blockscale_wpreshuffle_1x128x128_256x16x128x256_16x16_16x16_16x16x1_16x16x1_1x16x1x16_8_1x2_intrawave_v1
128,7168,2048,18,0,31.5237,a8w8_blockscale_wpreshuffle_1x128x128_256x64x64x256_16x16_16x16_16x16x1_16x16x1_1x32x1x8_8_2x2_intrawave_v1
128,4608,7168,18,0,61.5938,a8w8_blockscale_wpreshuffle_1x128x128_256x64x64x256_16x16_16x16_16x16x1_16x16x1_1x32x1x8_8_2x2_intrawave_v1
128,7168,2304,10,0,32.2841,a8w8_blockscale_wpreshuffle_1x128x128_256x32x128x128_16x16_16x16_8x32x1_8x32x1_1x32x1x8_8_2x2_intrawave_v1
128,512,7168,8,0,19.6689,a8w8_blockscale_wpreshuffle_1x128x128_256x16x64x256_16x16_16x16_16x16x1_16x16x1_1x16x1x16_4_1x1_intrawave_v1
128,4096,512,8,0,8.9212,a8w8_blockscale_wpreshuffle_1x128x128_256x16x64x256_16x16_16x16_16x16x1_16x16x1_1x16x1x16_4_1x1_intrawave_v1
256,1536,7168,13,0,50.7894,a8w8_blockscale_wpreshuffle_1x128x128_256x32x64x256_16x16_16x16_16x16x1_16x16x1_1x32x1x8_8_2x1_intrawave_v1
256,3072,1536,13,0,21.5997,a8w8_blockscale_wpreshuffle_1x128x128_256x32x64x256_16x16_16x16_16x16x1_16x16x1_1x32x1x8_8_2x1_intrawave_v1
256,576,7168,13,0,24.2881,a8w8_blockscale_wpreshuffle_1x128x128_256x32x64x256_16x16_16x16_16x16x1_16x16x1_1x32x1x8_8_2x1_intrawave_v1
256,7168,256,7,0,13.3144,a8w8_blockscale_wpreshuffle_1x128x128_256x16x128x256_16x16_16x16_16x16x1_16x16x1_1x16x1x16_8_1x2_intrawave_v1
256,7168,2048,9,0,55.917,a8w8_blockscale_wpreshuffle_1x128x128_256x32x256x128_16x16_16x16_8x32x1_8x32x1_1x32x1x8_8_2x2_intrawave_v1
256,4608,7168,14,0,109.2541,a8w8_blockscale_wpreshuffle_1x128x128_256x64x256x128_16x16_16x16_8x32x1_8x32x1_1x32x1x8_8_2x2_intrawave_v1
256,7168,2304,15,0,56.2302,a8w8_blockscale_wpreshuffle_1x128x128_256x64x128x128_16x16_16x16_8x32x1_8x32x1_1x32x1x8_8_2x2_intrawave_v1
256,512,7168,13,0,24.0053,a8w8_blockscale_wpreshuffle_1x128x128_256x32x64x256_16x16_16x16_16x16x1_16x16x1_1x32x1x8_8_2x1_intrawave_v1
256,4096,512,7,0,12.8985,a8w8_blockscale_wpreshuffle_1x128x128_256x16x128x256_16x16_16x16_16x16x1_16x16x1_1x16x1x16_8_1x2_intrawave_v1
512,1536,7168,13,0,80.4183,a8w8_blockscale_wpreshuffle_1x128x128_256x32x64x256_16x16_16x16_16x16x1_16x16x1_1x32x1x8_8_2x1_intrawave_v1
512,3072,1536,10,0,36.7901,a8w8_blockscale_wpreshuffle_1x128x128_256x32x128x128_16x16_16x16_8x32x1_8x32x1_1x32x1x8_8_2x2_intrawave_v1
512,576,7168,18,0,35.5226,a8w8_blockscale_wpreshuffle_1x128x128_256x64x64x256_16x16_16x16_16x16x1_16x16x1_1x32x1x8_8_2x2_intrawave_v1
512,7168,256,7,0,21.9057,a8w8_blockscale_wpreshuffle_1x128x128_256x16x128x256_16x16_16x16_16x16x1_16x16x1_1x16x1x16_8_1x2_intrawave_v1
512,7168,2048,0,0,93.6596,a8w8_blockscale_wpreshuffle_1x128x128_256x128x128x128_16x16_16x16_8x32x1_8x32x1_1x32x1x8_8_2x2_intrawave_v3
512,4608,7168,0,0,179.3536,a8w8_blockscale_wpreshuffle_1x128x128_256x128x128x128_16x16_16x16_8x32x1_8x32x1_1x32x1x8_8_2x2_intrawave_v3
512,7168,2304,0,0,87.3876,a8w8_blockscale_wpreshuffle_1x128x128_256x128x128x128_16x16_16x16_8x32x1_8x32x1_1x32x1x8_8_2x2_intrawave_v3
512,512,7168,18,0,35.4678,a8w8_blockscale_wpreshuffle_1x128x128_256x64x64x256_16x16_16x16_16x16x1_16x16x1_1x32x1x8_8_2x2_intrawave_v1
512,4096,512,13,0,20.6049,a8w8_blockscale_wpreshuffle_1x128x128_256x32x64x256_16x16_16x16_16x16x1_16x16x1_1x32x1x8_8_2x1_intrawave_v1
1024,1536,7168,18,0,140.9482,a8w8_blockscale_wpreshuffle_1x128x128_256x64x64x256_16x16_16x16_16x16x1_16x16x1_1x32x1x8_8_2x2_intrawave_v1
1024,3072,1536,9,0,65.4191,a8w8_blockscale_wpreshuffle_1x128x128_256x32x256x128_16x16_16x16_8x32x1_8x32x1_1x32x1x8_8_2x2_intrawave_v1
1024,576,7168,18,0,60.0843,a8w8_blockscale_wpreshuffle_1x128x128_256x64x64x256_16x16_16x16_16x16x1_16x16x1_1x32x1x8_8_2x2_intrawave_v1
1024,7168,256,7,0,38.5394,a8w8_blockscale_wpreshuffle_1x128x128_256x16x128x256_16x16_16x16_16x16x1_16x16x1_1x16x1x16_8_1x2_intrawave_v1
1024,7168,2048,0,0,170.8703,a8w8_blockscale_wpreshuffle_1x128x128_256x128x128x128_16x16_16x16_8x32x1_8x32x1_1x32x1x8_8_2x2_intrawave_v3
1024,4608,7168,0,0,361.2799,a8w8_blockscale_wpreshuffle_1x128x128_256x128x128x128_16x16_16x16_8x32x1_8x32x1_1x32x1x8_8_2x2_intrawave_v3
1024,7168,2304,0,0,161.1143,a8w8_blockscale_wpreshuffle_1x128x128_256x128x128x128_16x16_16x16_8x32x1_8x32x1_1x32x1x8_8_2x2_intrawave_v3
1024,512,7168,12,0,59.363,a8w8_blockscale_wpreshuffle_1x128x128_256x32x128x256_16x16_16x16_16x16x1_16x16x1_1x32x1x8_8_2x2_intrawave_v1
1024,4096,512,12,0,34.8533,a8w8_blockscale_wpreshuffle_1x128x128_256x32x128x256_16x16_16x16_16x16x1_16x16x1_1x32x1x8_8_2x2_intrawave_v1
1536,1536,7168,0,0,185.5068,a8w8_blockscale_wpreshuffle_1x128x128_256x128x128x128_16x16_16x16_8x32x1_8x32x1_1x32x1x8_8_2x2_intrawave_v3
1536,3072,1536,0,0,83.9328,a8w8_blockscale_wpreshuffle_1x128x128_256x128x128x128_16x16_16x16_8x32x1_8x32x1_1x32x1x8_8_2x2_intrawave_v3
1536,576,7168,18,0,88.8028,a8w8_blockscale_wpreshuffle_1x128x128_256x64x64x256_16x16_16x16_16x16x1_16x16x1_1x32x1x8_8_2x2_intrawave_v1
1536,7168,256,4,0,54.7422,a8w8_blockscale_wpreshuffle_1x128x128_256x16x256x128_8x16_16x16_16x16x1_8x32x1_1x16x1x16_8_1x2_intrawave_v1
1536,7168,2048,0,0,254.1279,a8w8_blockscale_wpreshuffle_1x128x128_256x128x128x128_16x16_16x16_8x32x1_8x32x1_1x32x1x8_8_2x2_intrawave_v3
1536,4608,7168,0,0,537.6895,a8w8_blockscale_wpreshuffle_1x128x128_256x128x128x128_16x16_16x16_8x32x1_8x32x1_1x32x1x8_8_2x2_intrawave_v3
1536,7168,2304,0,0,237.201,a8w8_blockscale_wpreshuffle_1x128x128_256x128x128x128_16x16_16x16_8x32x1_8x32x1_1x32x1x8_8_2x2_intrawave_v3
1536,512,7168,13,0,80.8375,a8w8_blockscale_wpreshuffle_1x128x128_256x32x64x256_16x16_16x16_16x16x1_16x16x1_1x32x1x8_8_2x1_intrawave_v1
1536,4096,512,12,0,49.8462,a8w8_blockscale_wpreshuffle_1x128x128_256x32x128x256_16x16_16x16_16x16x1_16x16x1_1x32x1x8_8_2x2_intrawave_v1
2048,1536,7168,9,0,266.2075,a8w8_blockscale_wpreshuffle_1x128x128_256x32x256x128_16x16_16x16_8x32x1_8x32x1_1x32x1x8_8_2x2_intrawave_v1
2048,3072,1536,0,0,105.2,a8w8_blockscale_wpreshuffle_1x128x128_256x128x128x128_16x16_16x16_8x32x1_8x32x1_1x32x1x8_8_2x2_intrawave_v3
2048,576,7168,18,0,113.5405,a8w8_blockscale_wpreshuffle_1x128x128_256x64x64x256_16x16_16x16_16x16x1_16x16x1_1x32x1x8_8_2x2_intrawave_v1
2048,7168,256,4,0,70.4287,a8w8_blockscale_wpreshuffle_1x128x128_256x16x256x128_8x16_16x16_16x16x1_8x32x1_1x16x1x16_8_1x2_intrawave_v1
2048,7168,2048,0,0,330.8498,a8w8_blockscale_wpreshuffle_1x128x128_256x128x128x128_16x16_16x16_8x32x1_8x32x1_1x32x1x8_8_2x2_intrawave_v3
2048,4608,7168,0,0,704.5378,a8w8_blockscale_wpreshuffle_1x128x128_256x128x128x128_16x16_16x16_8x32x1_8x32x1_1x32x1x8_8_2x2_intrawave_v3
2048,7168,2304,0,0,312.1013,a8w8_blockscale_wpreshuffle_1x128x128_256x128x128x128_16x16_16x16_8x32x1_8x32x1_1x32x1x8_8_2x2_intrawave_v3
2048,512,7168,14,0,108.9301,a8w8_blockscale_wpreshuffle_1x128x128_256x64x256x128_16x16_16x16_8x32x1_8x32x1_1x32x1x8_8_2x2_intrawave_v1
2048,4096,512,12,0,63.5667,a8w8_blockscale_wpreshuffle_1x128x128_256x32x128x256_16x16_16x16_16x16x1_16x16x1_1x32x1x8_8_2x2_intrawave_v1
4096,1536,7168,0,0,457.0023,a8w8_blockscale_wpreshuffle_1x128x128_256x128x128x128_16x16_16x16_8x32x1_8x32x1_1x32x1x8_8_2x2_intrawave_v3
4096,3072,1536,0,0,198.702,a8w8_blockscale_wpreshuffle_1x128x128_256x128x128x128_16x16_16x16_8x32x1_8x32x1_1x32x1x8_8_2x2_intrawave_v3
4096,576,7168,18,0,217.4405,a8w8_blockscale_wpreshuffle_1x128x128_256x64x64x256_16x16_16x16_16x16x1_16x16x1_1x32x1x8_8_2x2_intrawave_v1
4096,7168,256,4,0,133.0466,a8w8_blockscale_wpreshuffle_1x128x128_256x16x256x128_8x16_16x16_16x16x1_8x32x1_1x16x1x16_8_1x2_intrawave_v1
4096,7168,2048,0,0,623.3398,a8w8_blockscale_wpreshuffle_1x128x128_256x128x128x128_16x16_16x16_8x32x1_8x32x1_1x32x1x8_8_2x2_intrawave_v3
4096,4608,7168,0,0,1308.9399,a8w8_blockscale_wpreshuffle_1x128x128_256x128x128x128_16x16_16x16_8x32x1_8x32x1_1x32x1x8_8_2x2_intrawave_v3
4096,7168,2304,0,0,591.4189,a8w8_blockscale_wpreshuffle_1x128x128_256x128x128x128_16x16_16x16_8x32x1_8x32x1_1x32x1x8_8_2x2_intrawave_v3
4096,512,7168,0,0,180.0192,a8w8_blockscale_wpreshuffle_1x128x128_256x128x128x128_16x16_16x16_8x32x1_8x32x1_1x32x1x8_8_2x2_intrawave_v3
4096,4096,512,12,0,120.4749,a8w8_blockscale_wpreshuffle_1x128x128_256x32x128x256_16x16_16x16_16x16x1_16x16x1_1x32x1x8_8_2x2_intrawave_v1
8192,1536,7168,0,0,891.2454,a8w8_blockscale_wpreshuffle_1x128x128_256x128x128x128_16x16_16x16_8x32x1_8x32x1_1x32x1x8_8_2x2_intrawave_v3
8192,3072,1536,0,0,386.6836,a8w8_blockscale_wpreshuffle_1x128x128_256x128x128x128_16x16_16x16_8x32x1_8x32x1_1x32x1x8_8_2x2_intrawave_v3
8192,576,7168,18,0,402.4381,a8w8_blockscale_wpreshuffle_1x128x128_256x64x64x256_16x16_16x16_16x16x1_16x16x1_1x32x1x8_8_2x2_intrawave_v1
8192,7168,256,4,0,258.1351,a8w8_blockscale_wpreshuffle_1x128x128_256x16x256x128_8x16_16x16_16x16x1_8x32x1_1x16x1x16_8_1x2_intrawave_v1
8192,7168,2048,0,0,1208.6515,a8w8_blockscale_wpreshuffle_1x128x128_256x128x128x128_16x16_16x16_8x32x1_8x32x1_1x32x1x8_8_2x2_intrawave_v3
8192,4608,7168,0,0,2515.8206,a8w8_blockscale_wpreshuffle_1x128x128_256x128x128x128_16x16_16x16_8x32x1_8x32x1_1x32x1x8_8_2x2_intrawave_v3
8192,7168,2304,0,0,1153.1473,a8w8_blockscale_wpreshuffle_1x128x128_256x128x128x128_16x16_16x16_8x32x1_8x32x1_1x32x1x8_8_2x2_intrawave_v3
8192,512,7168,12,0,352.5523,a8w8_blockscale_wpreshuffle_1x128x128_256x32x128x256_16x16_16x16_16x16x1_16x16x1_1x32x1x8_8_2x2_intrawave_v1
8192,4096,512,12,0,233.7262,a8w8_blockscale_wpreshuffle_1x128x128_256x32x128x256_16x16_16x16_16x16x1_16x16x1_1x32x1x8_8_2x2_intrawave_v1
16384,1536,7168,0,0,1766.9003,a8w8_blockscale_wpreshuffle_1x128x128_256x128x128x128_16x16_16x16_8x32x1_8x32x1_1x32x1x8_8_2x2_intrawave_v3
16384,3072,1536,0,0,749.006,a8w8_blockscale_wpreshuffle_1x128x128_256x128x128x128_16x16_16x16_8x32x1_8x32x1_1x32x1x8_8_2x2_intrawave_v3
16384,576,7168,18,0,774.1537,a8w8_blockscale_wpreshuffle_1x128x128_256x64x64x256_16x16_16x16_16x16x1_16x16x1_1x32x1x8_8_2x2_intrawave_v1
16384,7168,256,4,0,509.4193,a8w8_blockscale_wpreshuffle_1x128x128_256x16x256x128_8x16_16x16_16x16x1_8x32x1_1x16x1x16_8_1x2_intrawave_v1
16384,7168,2048,0,0,2406.1186,a8w8_blockscale_wpreshuffle_1x128x128_256x128x128x128_16x16_16x16_8x32x1_8x32x1_1x32x1x8_8_2x2_intrawave_v3
16384,4608,7168,0,0,5016.5212,a8w8_blockscale_wpreshuffle_1x128x128_256x128x128x128_16x16_16x16_8x32x1_8x32x1_1x32x1x8_8_2x2_intrawave_v3
16384,7168,2304,0,0,2327.648,a8w8_blockscale_wpreshuffle_1x128x128_256x128x128x128_16x16_16x16_8x32x1_8x32x1_1x32x1x8_8_2x2_intrawave_v3
16384,512,7168,0,0,650.0943,a8w8_blockscale_wpreshuffle_1x128x128_256x128x128x128_16x16_16x16_8x32x1_8x32x1_1x32x1x8_8_2x2_intrawave_v3
16384,4096,512,0,0,455.4307,a8w8_blockscale_wpreshuffle_1x128x128_256x128x128x128_16x16_16x16_8x32x1_8x32x1_1x32x1x8_8_2x2_intrawave_v3
20480,1536,7168,0,0,2139.9862,a8w8_blockscale_wpreshuffle_1x128x128_256x128x128x128_16x16_16x16_8x32x1_8x32x1_1x32x1x8_8_2x2_intrawave_v3
20480,3072,1536,0,0,921.9559,a8w8_blockscale_wpreshuffle_1x128x128_256x128x128x128_16x16_16x16_8x32x1_8x32x1_1x32x1x8_8_2x2_intrawave_v3
20480,576,7168,18,0,959.7388,a8w8_blockscale_wpreshuffle_1x128x128_256x64x64x256_16x16_16x16_16x16x1_16x16x1_1x32x1x8_8_2x2_intrawave_v1
20480,7168,256,4,0,635.2738,a8w8_blockscale_wpreshuffle_1x128x128_256x16x256x128_8x16_16x16_16x16x1_8x32x1_1x16x1x16_8_1x2_intrawave_v1
20480,7168,2048,0,0,2991.1881,a8w8_blockscale_wpreshuffle_1x128x128_256x128x128x128_16x16_16x16_8x32x1_8x32x1_1x32x1x8_8_2x2_intrawave_v3
20480,4608,7168,0,0,6234.232,a8w8_blockscale_wpreshuffle_1x128x128_256x128x128x128_16x16_16x16_8x32x1_8x32x1_1x32x1x8_8_2x2_intrawave_v3
20480,7168,2304,0,0,2855.6991,a8w8_blockscale_wpreshuffle_1x128x128_256x128x128x128_16x16_16x16_8x32x1_8x32x1_1x32x1x8_8_2x2_intrawave_v3
20480,512,7168,0,0,753.2179,a8w8_blockscale_wpreshuffle_1x128x128_256x128x128x128_16x16_16x16_8x32x1_8x32x1_1x32x1x8_8_2x2_intrawave_v3
20480,4096,512,0,0,563.9783,a8w8_blockscale_wpreshuffle_1x128x128_256x128x128x128_16x16_16x16_8x32x1_8x32x1_1x32x1x8_8_2x2_intrawave_v3
