aiter/configs/a8w8_tuned_gemm.csv
cu_num,M,N,K,kernelId,splitK,us,kernelName
256,1,10240,4096,34,0,12.6591,a8w8_rowwise_256x16x64x512_16x16_1x1_32x8x1_32x8x1_1x16x1x16_4x4x1_1x1_intrawave_v3
256,32,10240,4096,30,0,12.8267,a8w8_rowwise_256x32x64x512_16x16_1x2_32x8x1_32x8x1_1x32x1x8_8x8x1_1x2_intrawave_v3
256,64,10240,4096,23,0,15.4108,a8w8_rowwise_256x64x64x512_32x32_1x1_32x8x1_32x8x1_1x32x1x8_8x8x1_1x1_intrawave_v3
256,128,10240,4096,15,0,18.928,a8w8_rowwise_256x128x64x256_32x32_2x1_16x16x1_16x16x1_1x32x1x8_8x8x1_1x1_intrawave_v3
256,256,10240,4096,41,0,26.3525,a8w8_rowwise_256x128x128x128_32x32_2x2_8x32x1_8x32x1_1x32x1x8_8x8x1_1x1_intrawave_v5
256,512,10240,4096,11,0,37.1298,a8w8_rowwise_256x128x160x128_32x32_1x5_8x32x1_8x32x1_1x64x1x4_8x8x1_1x1_intrawave_v3
256,1024,10240,4096,4,0,59.3048,a8w8_rowwise_256x256x160x128_32x32_2x5_8x32x1_8x32x1_1x64x1x4_8x8x1_2x1_intrawave_v3
256,2048,10240,4096,4,0,108.741,a8w8_rowwise_256x256x160x128_32x32_2x5_8x32x1_8x32x1_1x64x1x4_8x8x1_2x1_intrawave_v3
256,4096,10240,4096,40,0,195.3083,a8w8_rowwise_256x256x224x128_16x16_8x7_8x32x1_8x32x1_1x64x1x4_8x8x1_2x1_intrawave_v3
256,8192,10240,4096,1,0,354.1004,a8w8_rowwise_256x256x256x128_32x32_4x4_8x32x1_8x32x1_1x32x1x8_8x8x1_1x1_intrawave_v3
256,1,10240,8192,34,0,20.8088,a8w8_rowwise_256x16x64x512_16x16_1x1_32x8x1_32x8x1_1x16x1x16_4x4x1_1x1_intrawave_v3
256,32,10240,8192,30,0,21.4564,a8w8_rowwise_256x32x64x512_16x16_1x2_32x8x1_32x8x1_1x32x1x8_8x8x1_1x2_intrawave_v3
256,64,10240,8192,23,0,25.7553,a8w8_rowwise_256x64x64x512_32x32_1x1_32x8x1_32x8x1_1x32x1x8_8x8x1_1x1_intrawave_v3
256,128,10240,8192,15,0,32.8753,a8w8_rowwise_256x128x64x256_32x32_2x1_16x16x1_16x16x1_1x32x1x8_8x8x1_1x1_intrawave_v3
256,256,10240,8192,41,0,45.9863,a8w8_rowwise_256x128x128x128_32x32_2x2_8x32x1_8x32x1_1x32x1x8_8x8x1_1x1_intrawave_v5
256,512,10240,8192,11,0,66.4277,a8w8_rowwise_256x128x160x128_32x32_1x5_8x32x1_8x32x1_1x64x1x4_8x8x1_1x1_intrawave_v3
256,1024,10240,8192,4,0,100.0297,a8w8_rowwise_256x256x160x128_32x32_2x5_8x32x1_8x32x1_1x64x1x4_8x8x1_2x1_intrawave_v3
256,2048,10240,8192,4,0,186.1454,a8w8_rowwise_256x256x160x128_32x32_2x5_8x32x1_8x32x1_1x64x1x4_8x8x1_2x1_intrawave_v3
256,16384,10240,4096,1,0,708.5039,a8w8_rowwise_256x256x256x128_32x32_4x4_8x32x1_8x32x1_1x32x1x8_8x8x1_1x1_intrawave_v3
256,32768,10240,4096,39,0,1406.3386,a8w8_rowwise_256x224x256x128_16x16_7x8_8x32x1_8x32x1_1x32x1x8_8x8x1_1x2_intrawave_v3
256,1,10240,16384,34,0,36.9306,a8w8_rowwise_256x16x64x512_16x16_1x1_32x8x1_32x8x1_1x16x1x16_4x4x1_1x1_intrawave_v3
256,32,10240,16384,30,0,38.8142,a8w8_rowwise_256x32x64x512_16x16_1x2_32x8x1_32x8x1_1x32x1x8_8x8x1_1x2_intrawave_v3
256,64,10240,16384,23,0,44.8163,a8w8_rowwise_256x64x64x512_32x32_1x1_32x8x1_32x8x1_1x32x1x8_8x8x1_1x1_intrawave_v3
256,128,10240,16384,15,0,58.9844,a8w8_rowwise_256x128x64x256_32x32_2x1_16x16x1_16x16x1_1x32x1x8_8x8x1_1x1_intrawave_v3
256,256,10240,16384,41,0,82.7055,a8w8_rowwise_256x128x128x128_32x32_2x2_8x32x1_8x32x1_1x32x1x8_8x8x1_1x1_intrawave_v5
256,512,10240,16384,11,0,118.485,a8w8_rowwise_256x128x160x128_32x32_1x5_8x32x1_8x32x1_1x64x1x4_8x8x1_1x1_intrawave_v3
256,4096,10240,8192,39,0,349.0133,a8w8_rowwise_256x224x256x128_16x16_7x8_8x32x1_8x32x1_1x32x1x8_8x8x1_1x2_intrawave_v3
256,8192,10240,8192,1,0,627.6883,a8w8_rowwise_256x256x256x128_32x32_4x4_8x32x1_8x32x1_1x32x1x8_8x8x1_1x1_intrawave_v3
256,16384,10240,8192,1,0,1276.8484,a8w8_rowwise_256x256x256x128_32x32_4x4_8x32x1_8x32x1_1x32x1x8_8x8x1_1x1_intrawave_v3
256,32768,10240,8192,1,0,2519.685,a8w8_rowwise_256x256x256x128_32x32_4x4_8x32x1_8x32x1_1x32x1x8_8x8x1_1x1_intrawave_v3
256,1,57344,4096,34,0,46.1759,a8w8_rowwise_256x16x64x512_16x16_1x1_32x8x1_32x8x1_1x16x1x16_4x4x1_1x1_intrawave_v3
256,32,57344,4096,30,0,46.8907,a8w8_rowwise_256x32x64x512_16x16_1x2_32x8x1_32x8x1_1x32x1x8_8x8x1_1x2_intrawave_v3
256,64,57344,4096,23,0,53.752,a8w8_rowwise_256x64x64x512_32x32_1x1_32x8x1_32x8x1_1x32x1x8_8x8x1_1x1_intrawave_v3
256,128,57344,4096,41,0,62.6805,a8w8_rowwise_256x128x128x128_32x32_2x2_8x32x1_8x32x1_1x32x1x8_8x8x1_1x1_intrawave_v5
256,1024,10240,16384,4,0,186.0626,a8w8_rowwise_256x256x160x128_32x32_2x5_8x32x1_8x32x1_1x64x1x4_8x8x1_2x1_intrawave_v3
256,2048,10240,16384,4,0,335.1345,a8w8_rowwise_256x256x160x128_32x32_2x5_8x32x1_8x32x1_1x64x1x4_8x8x1_2x1_intrawave_v3
256,4096,10240,16384,39,0,630.6344,a8w8_rowwise_256x224x256x128_16x16_7x8_8x32x1_8x32x1_1x32x1x8_8x8x1_1x2_intrawave_v3
256,8192,10240,16384,1,0,1161.5457,a8w8_rowwise_256x256x256x128_32x32_4x4_8x32x1_8x32x1_1x32x1x8_8x8x1_1x1_intrawave_v3
256,16384,10240,16384,1,0,2310.0555,a8w8_rowwise_256x256x256x128_32x32_4x4_8x32x1_8x32x1_1x32x1x8_8x8x1_1x1_intrawave_v3
256,32768,10240,16384,1,0,4759.7512,a8w8_rowwise_256x256x256x128_32x32_4x4_8x32x1_8x32x1_1x32x1x8_8x8x1_1x1_intrawave_v3
256,64,57344,8192,21,0,98.2741,a8w8_rowwise_256x64x128x256_32x32_1x2_16x16x1_16x16x1_1x32x1x8_8x8x1_1x1_intrawave_v3
256,128,57344,8192,13,0,110.109,a8w8_rowwise_256x128x128x128_32x32_2x2_8x32x1_8x32x1_1x32x1x8_8x8x1_1x1_intrawave_v3
256,256,57344,8192,40,0,142.2198,a8w8_rowwise_256x256x224x128_16x16_8x7_8x32x1_8x32x1_1x64x1x4_8x8x1_2x1_intrawave_v3
256,512,57344,8192,2,0,247.8294,a8w8_rowwise_256x256x224x128_32x32_2x7_8x32x1_8x32x1_1x64x1x4_8x8x1_2x1_intrawave_v3
256,1024,57344,8192,2,0,468.119,a8w8_rowwise_256x256x224x128_32x32_2x7_8x32x1_8x32x1_1x64x1x4_8x8x1_2x1_intrawave_v3
256,2048,57344,8192,1,0,887.2881,a8w8_rowwise_256x256x256x128_32x32_4x4_8x32x1_8x32x1_1x32x1x8_8x8x1_1x1_intrawave_v3
256,4096,57344,8192,1,0,1723.4787,a8w8_rowwise_256x256x256x128_32x32_4x4_8x32x1_8x32x1_1x32x1x8_8x8x1_1x1_intrawave_v3
256,8192,57344,8192,1,0,3493.6296,a8w8_rowwise_256x256x256x128_32x32_4x4_8x32x1_8x32x1_1x32x1x8_8x8x1_1x1_intrawave_v3
256,16384,57344,8192,2,0,6947.0118,a8w8_rowwise_256x256x224x128_32x32_2x7_8x32x1_8x32x1_1x64x1x4_8x8x1_2x1_intrawave_v3
256,32768,57344,8192,1,0,13713.6812,a8w8_rowwise_256x256x256x128_32x32_4x4_8x32x1_8x32x1_1x32x1x8_8x8x1_1x1_intrawave_v3
256,1,57344,16384,50,0,170.4085,a8w8_rowwise_128x16x32x128_16x16_1x1_8x16x1_8x16x1_1x16x1x8_4x4x1_1x1_intrawave_v1
256,32,57344,16384,24,0,178.4539,a8w8_rowwise_256x32x256x128_32x32_1x2_8x32x1_8x32x1_1x32x1x8_8x8x1_1x1_intrawave_v3
256,64,57344,16384,17,0,185.452,a8w8_rowwise_256x64x224x128_16x16_2x7_8x32x1_8x32x1_1x64x1x4_8x8x1_2x1_intrawave_v3
256,128,57344,16384,41,0,212.4879,a8w8_rowwise_256x128x128x128_32x32_2x2_8x32x1_8x32x1_1x32x1x8_8x8x1_1x1_intrawave_v5
256,256,57344,16384,40,0,269.8866,a8w8_rowwise_256x256x224x128_16x16_8x7_8x32x1_8x32x1_1x64x1x4_8x8x1_2x1_intrawave_v3
256,512,57344,16384,40,0,468.5057,a8w8_rowwise_256x256x224x128_16x16_8x7_8x32x1_8x32x1_1x64x1x4_8x8x1_2x1_intrawave_v3
256,1024,57344,16384,2,0,858.1963,a8w8_rowwise_256x256x224x128_32x32_2x7_8x32x1_8x32x1_1x64x1x4_8x8x1_2x1_intrawave_v3
256,2048,57344,16384,1,0,1645.2431,a8w8_rowwise_256x256x256x128_32x32_4x4_8x32x1_8x32x1_1x32x1x8_8x8x1_1x1_intrawave_v3
256,4096,57344,16384,40,0,3309.4535,a8w8_rowwise_256x256x224x128_16x16_8x7_8x32x1_8x32x1_1x64x1x4_8x8x1_2x1_intrawave_v3
256,8192,57344,16384,1,0,6604.6245,a8w8_rowwise_256x256x256x128_32x32_4x4_8x32x1_8x32x1_1x32x1x8_8x8x1_1x1_intrawave_v3
256,1,4096,4096,34,0,10.7291,a8w8_rowwise_256x16x64x512_16x16_1x1_32x8x1_32x8x1_1x16x1x16_4x4x1_1x1_intrawave_v3
256,32,4096,4096,34,0,9.3495,a8w8_rowwise_256x16x64x512_16x16_1x1_32x8x1_32x8x1_1x16x1x16_4x4x1_1x1_intrawave_v3
256,64,4096,4096,34,0,9.4699,a8w8_rowwise_256x16x64x512_16x16_1x1_32x8x1_32x8x1_1x16x1x16_4x4x1_1x1_intrawave_v3
256,128,4096,4096,30,0,10.7563,a8w8_rowwise_256x32x64x512_16x16_1x2_32x8x1_32x8x1_1x32x1x8_8x8x1_1x2_intrawave_v3
256,256,4096,4096,23,0,13.6664,a8w8_rowwise_256x64x64x512_32x32_1x1_32x8x1_32x8x1_1x32x1x8_8x8x1_1x1_intrawave_v3
256,512,4096,4096,21,0,18.348,a8w8_rowwise_256x64x128x256_32x32_1x2_16x16x1_16x16x1_1x32x1x8_8x8x1_1x1_intrawave_v3
256,1024,4096,4096,41,0,28.8445,a8w8_rowwise_256x128x128x128_32x32_2x2_8x32x1_8x32x1_1x32x1x8_8x8x1_1x1_intrawave_v5
256,2048,4096,4096,13,0,52.8208,a8w8_rowwise_256x128x128x128_32x32_2x2_8x32x1_8x32x1_1x32x1x8_8x8x1_1x1_intrawave_v3
256,16384,57344,16384,1,0,13066.4076,a8w8_rowwise_256x256x256x128_32x32_4x4_8x32x1_8x32x1_1x32x1x8_8x8x1_1x1_intrawave_v3
256,32768,57344,16384,40,0,26293.0264,a8w8_rowwise_256x256x224x128_16x16_8x7_8x32x1_8x32x1_1x64x1x4_8x8x1_2x1_intrawave_v3
256,1,8192,8192,34,0,19.676,a8w8_rowwise_256x16x64x512_16x16_1x1_32x8x1_32x8x1_1x16x1x16_4x4x1_1x1_intrawave_v3
256,32,8192,8192,34,0,17.7448,a8w8_rowwise_256x16x64x512_16x16_1x1_32x8x1_32x8x1_1x16x1x16_4x4x1_1x1_intrawave_v3
256,64,8192,8192,30,0,19.9216,a8w8_rowwise_256x32x64x512_16x16_1x2_32x8x1_32x8x1_1x32x1x8_8x8x1_1x2_intrawave_v3
256,128,8192,8192,23,0,24.5073,a8w8_rowwise_256x64x64x512_32x32_1x1_32x8x1_32x8x1_1x32x1x8_8x8x1_1x1_intrawave_v3
256,256,8192,8192,15,0,33.4086,a8w8_rowwise_256x128x64x256_32x32_2x1_16x16x1_16x16x1_1x32x1x8_8x8x1_1x1_intrawave_v3
256,512,8192,8192,41,0,53.5929,a8w8_rowwise_256x128x128x128_32x32_2x2_8x32x1_8x32x1_1x32x1x8_8x8x1_1x1_intrawave_v5
256,4096,4096,4096,38,0,84.5408,a8w8_rowwise_256x256x256x64_16x16_8x8_4x64x1_4x64x1_1x32x1x8_8x8x1_1x2_intrawave_v3
256,8192,4096,4096,1,0,154.5989,a8w8_rowwise_256x256x256x128_32x32_4x4_8x32x1_8x32x1_1x32x1x8_8x8x1_1x1_intrawave_v3
256,16384,4096,4096,1,0,291.6466,a8w8_rowwise_256x256x256x128_32x32_4x4_8x32x1_8x32x1_1x32x1x8_8x8x1_1x1_intrawave_v3
256,32768,4096,4096,1,0,564.1904,a8w8_rowwise_256x256x256x128_32x32_4x4_8x32x1_8x32x1_1x32x1x8_8x8x1_1x1_intrawave_v3
256,1024,8192,8192,13,0,93.9717,a8w8_rowwise_256x128x128x128_32x32_2x2_8x32x1_8x32x1_1x32x1x8_8x8x1_1x1_intrawave_v3
256,2048,8192,8192,1,0,141.3971,a8w8_rowwise_256x256x256x128_32x32_4x4_8x32x1_8x32x1_1x32x1x8_8x8x1_1x1_intrawave_v3
256,4096,8192,8192,1,0,271.5607,a8w8_rowwise_256x256x256x128_32x32_4x4_8x32x1_8x32x1_1x32x1x8_8x8x1_1x1_intrawave_v3
256,8192,8192,8192,1,0,503.9143,a8w8_rowwise_256x256x256x128_32x32_4x4_8x32x1_8x32x1_1x32x1x8_8x8x1_1x1_intrawave_v3
256,16384,8192,8192,38,0,1022.2998,a8w8_rowwise_256x256x256x64_16x16_8x8_4x64x1_4x64x1_1x32x1x8_8x8x1_1x2_intrawave_v3
256,32768,8192,8192,38,0,2035.5561,a8w8_rowwise_256x256x256x64_16x16_8x8_4x64x1_4x64x1_1x32x1x8_8x8x1_1x2_intrawave_v3
256,256,57344,4096,40,0,79.8227,a8w8_rowwise_256x256x224x128_16x16_8x7_8x32x1_8x32x1_1x64x1x4_8x8x1_2x1_intrawave_v3
256,512,57344,4096,2,0,136.7809,a8w8_rowwise_256x256x224x128_32x32_2x7_8x32x1_8x32x1_1x64x1x4_8x8x1_2x1_intrawave_v3
256,1024,57344,4096,2,0,262.5167,a8w8_rowwise_256x256x224x128_32x32_2x7_8x32x1_8x32x1_1x64x1x4_8x8x1_2x1_intrawave_v3
256,2048,57344,4096,2,0,503.6789,a8w8_rowwise_256x256x224x128_32x32_2x7_8x32x1_8x32x1_1x64x1x4_8x8x1_2x1_intrawave_v3
256,4096,57344,4096,1,0,968.4228,a8w8_rowwise_256x256x256x128_32x32_4x4_8x32x1_8x32x1_1x32x1x8_8x8x1_1x1_intrawave_v3
256,8192,57344,4096,2,0,1972.4474,a8w8_rowwise_256x256x224x128_32x32_2x7_8x32x1_8x32x1_1x64x1x4_8x8x1_2x1_intrawave_v3
256,1,57344,8192,77,0,87.2639,a8w8_rowwise_64x16x16x64_16x16_1x1_4x16x1_4x16x1_1x16x1x4_4x4x1_1x1_interwave_v2
256,32,57344,8192,28,0,92.7312,a8w8_rowwise_256x32x128x256_32x32_1x1_16x16x1_16x16x1_1x32x1x8_8x8x1_1x1_intrawave_v3
256,16384,57344,4096,1,0,3812.9077,a8w8_rowwise_256x256x256x128_32x32_4x4_8x32x1_8x32x1_1x32x1x8_8x8x1_1x1_intrawave_v3
256,32768,57344,4096,1,0,7573.6879,a8w8_rowwise_256x256x256x128_32x32_4x4_8x32x1_8x32x1_1x32x1x8_8x8x1_1x1_intrawave_v3
