aiter/configs/a8w8_blockscale_tuned_gemm.csv
cu_num,M,N,K,kernelId,splitK,us,kernelName
80,16,1536,7168,8,0,24.3551,a8w8_blockscale_1x128x128_256x16x64x256_16x16_16x16_16x16x1_16x16x1_1x16x1x16_4_1x1_intrawave_v1
80,16,3072,1536,8,0,8.9846,a8w8_blockscale_1x128x128_256x16x64x256_16x16_16x16_16x16x1_16x16x1_1x16x1x16_4_1x1_intrawave_v1
80,16,576,7168,8,0,23.9967,a8w8_blockscale_1x128x128_256x16x64x256_16x16_16x16_16x16x1_16x16x1_1x16x1x16_4_1x1_intrawave_v1
80,16,7168,256,8,0,4.4182,a8w8_blockscale_1x128x128_256x16x64x256_16x16_16x16_16x16x1_16x16x1_1x16x1x16_4_1x1_intrawave_v1
80,16,7168,2048,7,0,13.4963,a8w8_blockscale_1x128x128_256x16x128x256_16x16_16x16_16x16x1_16x16x1_1x16x1x16_8_1x2_intrawave_v1
80,16,4608,7168,8,0,25.4203,a8w8_blockscale_1x128x128_256x16x64x256_16x16_16x16_16x16x1_16x16x1_1x16x1x16_4_1x1_intrawave_v1
80,16,7168,2304,7,0,12.6839,a8w8_blockscale_1x128x128_256x16x128x256_16x16_16x16_16x16x1_16x16x1_1x16x1x16_8_1x2_intrawave_v1
80,16,512,7168,8,0,23.7839,a8w8_blockscale_1x128x128_256x16x64x256_16x16_16x16_16x16x1_16x16x1_1x16x1x16_4_1x1_intrawave_v1
80,16,4096,512,8,0,4.5142,a8w8_blockscale_1x128x128_256x16x64x256_16x16_16x16_16x16x1_16x16x1_1x16x1x16_4_1x1_intrawave_v1
80,32,1536,7168,8,0,24.7375,a8w8_blockscale_1x128x128_256x16x64x256_16x16_16x16_16x16x1_16x16x1_1x16x1x16_4_1x1_intrawave_v1
80,32,3072,1536,13,0,10.661,a8w8_blockscale_1x128x128_256x32x64x256_16x16_16x16_16x16x1_16x16x1_1x32x1x8_8_2x1_intrawave_v1
80,32,576,7168,8,0,23.9867,a8w8_blockscale_1x128x128_256x16x64x256_16x16_16x16_16x16x1_16x16x1_1x16x1x16_4_1x1_intrawave_v1
80,32,7168,256,13,0,5.0066,a8w8_blockscale_1x128x128_256x32x64x256_16x16_16x16_16x16x1_16x16x1_1x32x1x8_8_2x1_intrawave_v1
80,32,7168,2048,12,0,15.6158,a8w8_blockscale_1x128x128_256x32x128x256_16x16_32x32_16x16x1_16x16x1_1x32x1x8_8_1x1_intrawave_v1
80,32,4608,7168,7,0,33.8967,a8w8_blockscale_1x128x128_256x16x128x256_16x16_16x16_16x16x1_16x16x1_1x16x1x16_8_1x2_intrawave_v1
80,32,7168,2304,12,0,15.4042,a8w8_blockscale_1x128x128_256x32x128x256_16x16_32x32_16x16x1_16x16x1_1x32x1x8_8_1x1_intrawave_v1
80,32,512,7168,8,0,23.7419,a8w8_blockscale_1x128x128_256x16x64x256_16x16_16x16_16x16x1_16x16x1_1x16x1x16_4_1x1_intrawave_v1
80,32,4096,512,13,0,4.933,a8w8_blockscale_1x128x128_256x32x64x256_16x16_16x16_16x16x1_16x16x1_1x32x1x8_8_2x1_intrawave_v1
80,64,1536,7168,8,0,28.1691,a8w8_blockscale_1x128x128_256x16x64x256_16x16_16x16_16x16x1_16x16x1_1x16x1x16_4_1x1_intrawave_v1
80,64,3072,1536,18,0,11.0418,a8w8_blockscale_1x128x128_256x64x64x256_16x16_32x32_16x16x1_16x16x1_1x32x1x8_8_1x1_intrawave_v1
80,64,576,7168,8,0,23.6115,a8w8_blockscale_1x128x128_256x16x64x256_16x16_16x16_16x16x1_16x16x1_1x16x1x16_4_1x1_intrawave_v1
80,64,7168,256,11,0,7.299,a8w8_blockscale_1x128x128_256x32x64x128_16x16_16x16_8x32x1_8x32x1_1x32x1x8_8_2x1_intrawave_v1
80,64,7168,2048,18,0,22.0667,a8w8_blockscale_1x128x128_256x64x64x256_16x16_32x32_16x16x1_16x16x1_1x32x1x8_8_1x1_intrawave_v1
80,64,4608,7168,18,0,33.7899,a8w8_blockscale_1x128x128_256x64x64x256_16x16_32x32_16x16x1_16x16x1_1x32x1x8_8_1x1_intrawave_v1
80,64,7168,2304,18,0,20.6855,a8w8_blockscale_1x128x128_256x64x64x256_16x16_32x32_16x16x1_16x16x1_1x32x1x8_8_1x1_intrawave_v1
80,64,512,7168,8,0,23.5687,a8w8_blockscale_1x128x128_256x16x64x256_16x16_16x16_16x16x1_16x16x1_1x16x1x16_4_1x1_intrawave_v1
80,64,4096,512,18,0,7.0222,a8w8_blockscale_1x128x128_256x64x64x256_16x16_32x32_16x16x1_16x16x1_1x32x1x8_8_1x1_intrawave_v1
80,128,1536,7168,18,0,32.6567,a8w8_blockscale_1x128x128_256x64x64x256_16x16_32x32_16x16x1_16x16x1_1x32x1x8_8_1x1_intrawave_v1
80,128,3072,1536,18,0,18.2371,a8w8_blockscale_1x128x128_256x64x64x256_16x16_32x32_16x16x1_16x16x1_1x32x1x8_8_1x1_intrawave_v1
80,128,576,7168,8,0,23.2135,a8w8_blockscale_1x128x128_256x16x64x256_16x16_16x16_16x16x1_16x16x1_1x16x1x16_4_1x1_intrawave_v1
80,128,7168,256,16,0,9.9102,a8w8_blockscale_1x128x128_256x64x64x128_16x16_32x32_8x32x1_8x32x1_1x32x1x8_8_1x1_intrawave_v1
80,128,7168,2048,16,0,38.9595,a8w8_blockscale_1x128x128_256x64x64x128_16x16_32x32_8x32x1_8x32x1_1x32x1x8_8_1x1_intrawave_v1
80,128,4608,7168,18,0,67.4657,a8w8_blockscale_1x128x128_256x64x64x256_16x16_32x32_16x16x1_16x16x1_1x32x1x8_8_1x1_intrawave_v1
80,128,7168,2304,18,0,31.0339,a8w8_blockscale_1x128x128_256x64x64x256_16x16_32x32_16x16x1_16x16x1_1x32x1x8_8_1x1_intrawave_v1
80,128,512,7168,8,0,23.0711,a8w8_blockscale_1x128x128_256x16x64x256_16x16_16x16_16x16x1_16x16x1_1x16x1x16_4_1x1_intrawave_v1
80,128,4096,512,18,0,9.9694,a8w8_blockscale_1x128x128_256x64x64x256_16x16_32x32_16x16x1_16x16x1_1x32x1x8_8_1x1_intrawave_v1
80,256,1536,7168,18,0,48.7936,a8w8_blockscale_1x128x128_256x64x64x256_16x16_32x32_16x16x1_16x16x1_1x32x1x8_8_1x1_intrawave_v1
80,256,3072,1536,18,0,23.9091,a8w8_blockscale_1x128x128_256x64x64x256_16x16_32x32_16x16x1_16x16x1_1x32x1x8_8_1x1_intrawave_v1
80,256,576,7168,8,0,29.6907,a8w8_blockscale_1x128x128_256x16x64x256_16x16_16x16_16x16x1_16x16x1_1x16x1x16_4_1x1_intrawave_v1
80,256,7168,256,16,0,14.8282,a8w8_blockscale_1x128x128_256x64x64x128_16x16_32x32_8x32x1_8x32x1_1x32x1x8_8_1x1_intrawave_v1
80,256,7168,2048,18,0,53.5376,a8w8_blockscale_1x128x128_256x64x64x256_16x16_32x32_16x16x1_16x16x1_1x32x1x8_8_1x1_intrawave_v1
80,256,4608,7168,18,0,98.3614,a8w8_blockscale_1x128x128_256x64x64x256_16x16_32x32_16x16x1_16x16x1_1x32x1x8_8_1x1_intrawave_v1
80,256,7168,2304,2,0,53.5928,a8w8_blockscale_1x128x128_256x64x128x128_16x16_32x32_8x32x1_8x32x1_1x32x1x8_8_1x1_intrawave_v3
80,256,512,7168,8,0,28.9955,a8w8_blockscale_1x128x128_256x16x64x256_16x16_16x16_16x16x1_16x16x1_1x16x1x16_4_1x1_intrawave_v1
80,256,4096,512,16,0,16.2123,a8w8_blockscale_1x128x128_256x64x64x128_16x16_32x32_8x32x1_8x32x1_1x32x1x8_8_1x1_intrawave_v1
80,512,1536,7168,18,0,78.9397,a8w8_blockscale_1x128x128_256x64x64x256_16x16_32x32_16x16x1_16x16x1_1x32x1x8_8_1x1_intrawave_v1
80,512,3072,1536,16,0,38.9576,a8w8_blockscale_1x128x128_256x64x64x128_16x16_32x32_8x32x1_8x32x1_1x32x1x8_8_1x1_intrawave_v1
80,512,576,7168,18,0,32.6107,a8w8_blockscale_1x128x128_256x64x64x256_16x16_32x32_16x16x1_16x16x1_1x32x1x8_8_1x1_intrawave_v1
80,512,7168,256,16,0,24.6259,a8w8_blockscale_1x128x128_256x64x64x128_16x16_32x32_8x32x1_8x32x1_1x32x1x8_8_1x1_intrawave_v1
80,512,7168,2048,2,0,102.1678,a8w8_blockscale_1x128x128_256x64x128x128_16x16_32x32_8x32x1_8x32x1_1x32x1x8_8_1x1_intrawave_v3
80,512,4608,7168,18,0,190.1586,a8w8_blockscale_1x128x128_256x64x64x256_16x16_32x32_16x16x1_16x16x1_1x32x1x8_8_1x1_intrawave_v1
80,512,7168,2304,2,0,96.0606,a8w8_blockscale_1x128x128_256x64x128x128_16x16_32x32_8x32x1_8x32x1_1x32x1x8_8_1x1_intrawave_v3
80,512,512,7168,18,0,32.5423,a8w8_blockscale_1x128x128_256x64x64x256_16x16_32x32_16x16x1_16x16x1_1x32x1x8_8_1x1_intrawave_v1
80,512,4096,512,16,0,24.2335,a8w8_blockscale_1x128x128_256x64x64x128_16x16_32x32_8x32x1_8x32x1_1x32x1x8_8_1x1_intrawave_v1
80,1024,1536,7168,18,0,124.8747,a8w8_blockscale_1x128x128_256x64x64x256_16x16_32x32_16x16x1_16x16x1_1x32x1x8_8_1x1_intrawave_v1
80,1024,3072,1536,16,0,67.5949,a8w8_blockscale_1x128x128_256x64x64x128_16x16_32x32_8x32x1_8x32x1_1x32x1x8_8_1x1_intrawave_v1
80,1024,576,7168,18,0,50.3108,a8w8_blockscale_1x128x128_256x64x64x256_16x16_32x32_16x16x1_16x16x1_1x32x1x8_8_1x1_intrawave_v1
80,1024,7168,256,16,0,42.5412,a8w8_blockscale_1x128x128_256x64x64x128_16x16_32x32_8x32x1_8x32x1_1x32x1x8_8_1x1_intrawave_v1
80,1024,7168,2048,2,0,189.0366,a8w8_blockscale_1x128x128_256x64x128x128_16x16_32x32_8x32x1_8x32x1_1x32x1x8_8_1x1_intrawave_v3
80,1024,4608,7168,18,0,352.3265,a8w8_blockscale_1x128x128_256x64x64x256_16x16_32x32_16x16x1_16x16x1_1x32x1x8_8_1x1_intrawave_v1
80,1024,7168,2304,3,0,187.8462,a8w8_blockscale_1x128x128_256x64x64x128_16x16_32x32_8x32x1_8x32x1_1x32x1x8_8_1x1_intrawave_v3
80,1024,512,7168,18,0,49.6472,a8w8_blockscale_1x128x128_256x64x64x256_16x16_32x32_16x16x1_16x16x1_1x32x1x8_8_1x1_intrawave_v1
80,1024,4096,512,16,0,40.0092,a8w8_blockscale_1x128x128_256x64x64x128_16x16_32x32_8x32x1_8x32x1_1x32x1x8_8_1x1_intrawave_v1
80,1536,1536,7168,18,0,190.4606,a8w8_blockscale_1x128x128_256x64x64x256_16x16_32x32_16x16x1_16x16x1_1x32x1x8_8_1x1_intrawave_v1
80,1536,3072,1536,16,0,97.1354,a8w8_blockscale_1x128x128_256x64x64x128_16x16_32x32_8x32x1_8x32x1_1x32x1x8_8_1x1_intrawave_v1
80,1536,576,7168,18,0,79.4869,a8w8_blockscale_1x128x128_256x64x64x256_16x16_32x32_16x16x1_16x16x1_1x32x1x8_8_1x1_intrawave_v1
80,1536,7168,256,16,0,60.6356,a8w8_blockscale_1x128x128_256x64x64x128_16x16_32x32_8x32x1_8x32x1_1x32x1x8_8_1x1_intrawave_v1
80,1536,7168,2048,18,0,280.3305,a8w8_blockscale_1x128x128_256x64x64x256_16x16_32x32_16x16x1_16x16x1_1x32x1x8_8_1x1_intrawave_v1
80,1536,4608,7168,18,0,544.8164,a8w8_blockscale_1x128x128_256x64x64x256_16x16_32x32_16x16x1_16x16x1_1x32x1x8_8_1x1_intrawave_v1
80,1536,7168,2304,2,0,265.3277,a8w8_blockscale_1x128x128_256x64x128x128_16x16_32x32_8x32x1_8x32x1_1x32x1x8_8_1x1_intrawave_v3
80,1536,512,7168,18,0,78.9793,a8w8_blockscale_1x128x128_256x64x64x256_16x16_32x32_16x16x1_16x16x1_1x32x1x8_8_1x1_intrawave_v1
80,1536,4096,512,16,0,57.1876,a8w8_blockscale_1x128x128_256x64x64x128_16x16_32x32_8x32x1_8x32x1_1x32x1x8_8_1x1_intrawave_v1
80,2048,1536,7168,18,0,236.7096,a8w8_blockscale_1x128x128_256x64x64x256_16x16_32x32_16x16x1_16x16x1_1x32x1x8_8_1x1_intrawave_v1
80,2048,3072,1536,2,0,125.5643,a8w8_blockscale_1x128x128_256x64x128x128_16x16_32x32_8x32x1_8x32x1_1x32x1x8_8_1x1_intrawave_v3
80,2048,576,7168,18,0,98.1258,a8w8_blockscale_1x128x128_256x64x64x256_16x16_32x32_16x16x1_16x16x1_1x32x1x8_8_1x1_intrawave_v1
80,2048,7168,256,16,0,82.8221,a8w8_blockscale_1x128x128_256x64x64x128_16x16_32x32_8x32x1_8x32x1_1x32x1x8_8_1x1_intrawave_v1
80,2048,7168,2048,2,0,351.24,a8w8_blockscale_1x128x128_256x64x128x128_16x16_32x32_8x32x1_8x32x1_1x32x1x8_8_1x1_intrawave_v3
80,2048,4608,7168,18,0,673.0226,a8w8_blockscale_1x128x128_256x64x64x256_16x16_32x32_16x16x1_16x16x1_1x32x1x8_8_1x1_intrawave_v1
80,2048,7168,2304,2,0,353.4808,a8w8_blockscale_1x128x128_256x64x128x128_16x16_32x32_8x32x1_8x32x1_1x32x1x8_8_1x1_intrawave_v3
80,2048,512,7168,18,0,97.1586,a8w8_blockscale_1x128x128_256x64x64x256_16x16_32x32_16x16x1_16x16x1_1x32x1x8_8_1x1_intrawave_v1
80,2048,4096,512,16,0,73.2045,a8w8_blockscale_1x128x128_256x64x64x128_16x16_32x32_8x32x1_8x32x1_1x32x1x8_8_1x1_intrawave_v1
80,4096,1536,7168,18,0,466.9121,a8w8_blockscale_1x128x128_256x64x64x256_16x16_32x32_16x16x1_16x16x1_1x32x1x8_8_1x1_intrawave_v1
80,4096,3072,1536,3,0,235.6056,a8w8_blockscale_1x128x128_256x64x64x128_16x16_32x32_8x32x1_8x32x1_1x32x1x8_8_1x1_intrawave_v3
80,4096,576,7168,18,0,189.3258,a8w8_blockscale_1x128x128_256x64x64x256_16x16_32x32_16x16x1_16x16x1_1x32x1x8_8_1x1_intrawave_v1
80,4096,7168,256,16,0,151.172,a8w8_blockscale_1x128x128_256x64x64x128_16x16_32x32_8x32x1_8x32x1_1x32x1x8_8_1x1_intrawave_v1
80,4096,7168,2048,0,0,697.3546,a8w8_blockscale_1x128x128_256x128x128x128_16x16_32x32_8x32x1_8x32x1_1x32x1x8_8_1x1_intrawave_v3
80,4096,4608,7168,18,0,1349.6161,a8w8_blockscale_1x128x128_256x64x64x256_16x16_32x32_16x16x1_16x16x1_1x32x1x8_8_1x1_intrawave_v1
80,4096,7168,2304,3,0,687.153,a8w8_blockscale_1x128x128_256x64x64x128_16x16_32x32_8x32x1_8x32x1_1x32x1x8_8_1x1_intrawave_v3
80,4096,512,7168,18,0,171.3105,a8w8_blockscale_1x128x128_256x64x64x256_16x16_32x32_16x16x1_16x16x1_1x32x1x8_8_1x1_intrawave_v1
80,4096,4096,512,16,0,138.4128,a8w8_blockscale_1x128x128_256x64x64x128_16x16_32x32_8x32x1_8x32x1_1x32x1x8_8_1x1_intrawave_v1
80,8192,1536,7168,18,0,907.3555,a8w8_blockscale_1x128x128_256x64x64x256_16x16_32x32_16x16x1_16x16x1_1x32x1x8_8_1x1_intrawave_v1
80,8192,3072,1536,16,0,456.8081,a8w8_blockscale_1x128x128_256x64x64x128_16x16_32x32_8x32x1_8x32x1_1x32x1x8_8_1x1_intrawave_v1
80,8192,576,7168,18,0,354.6956,a8w8_blockscale_1x128x128_256x64x64x256_16x16_32x32_16x16x1_16x16x1_1x32x1x8_8_1x1_intrawave_v1
80,8192,7168,256,16,0,304.387,a8w8_blockscale_1x128x128_256x64x64x128_16x16_32x32_8x32x1_8x32x1_1x32x1x8_8_1x1_intrawave_v1
80,8192,7168,2048,2,0,1328.7276,a8w8_blockscale_1x128x128_256x64x128x128_16x16_32x32_8x32x1_8x32x1_1x32x1x8_8_1x1_intrawave_v3
80,8192,4608,7168,18,0,2672.9598,a8w8_blockscale_1x128x128_256x64x64x256_16x16_32x32_16x16x1_16x16x1_1x32x1x8_8_1x1_intrawave_v1
80,8192,7168,2304,3,0,1351.1053,a8w8_blockscale_1x128x128_256x64x64x128_16x16_32x32_8x32x1_8x32x1_1x32x1x8_8_1x1_intrawave_v3
80,8192,512,7168,18,0,313.9555,a8w8_blockscale_1x128x128_256x64x64x256_16x16_32x32_16x16x1_16x16x1_1x32x1x8_8_1x1_intrawave_v1
80,8192,4096,512,16,0,268.3973,a8w8_blockscale_1x128x128_256x64x64x128_16x16_32x32_8x32x1_8x32x1_1x32x1x8_8_1x1_intrawave_v1
80,16384,1536,7168,18,0,1807.1407,a8w8_blockscale_1x128x128_256x64x64x256_16x16_32x32_16x16x1_16x16x1_1x32x1x8_8_1x1_intrawave_v1
80,16384,3072,1536,3,0,865.1565,a8w8_blockscale_1x128x128_256x64x64x128_16x16_32x32_8x32x1_8x32x1_1x32x1x8_8_1x1_intrawave_v3
80,16384,576,7168,18,0,682.1246,a8w8_blockscale_1x128x128_256x64x64x256_16x16_32x32_16x16x1_16x16x1_1x32x1x8_8_1x1_intrawave_v1
80,16384,7168,256,16,0,585.9346,a8w8_blockscale_1x128x128_256x64x64x128_16x16_32x32_8x32x1_8x32x1_1x32x1x8_8_1x1_intrawave_v1
80,16384,7168,2048,0,0,2635.8868,a8w8_blockscale_1x128x128_256x128x128x128_16x16_32x32_8x32x1_8x32x1_1x32x1x8_8_1x1_intrawave_v3
80,16384,4608,7168,18,0,5298.4791,a8w8_blockscale_1x128x128_256x64x64x256_16x16_32x32_16x16x1_16x16x1_1x32x1x8_8_1x1_intrawave_v1
80,16384,7168,2304,3,0,2693.8094,a8w8_blockscale_1x128x128_256x64x64x128_16x16_32x32_8x32x1_8x32x1_1x32x1x8_8_1x1_intrawave_v3
80,16384,512,7168,18,0,630.2491,a8w8_blockscale_1x128x128_256x64x64x256_16x16_32x32_16x16x1_16x16x1_1x32x1x8_8_1x1_intrawave_v1
80,16384,4096,512,16,0,528.8811,a8w8_blockscale_1x128x128_256x64x64x128_16x16_32x32_8x32x1_8x32x1_1x32x1x8_8_1x1_intrawave_v1
80,20480,1536,7168,18,0,2232.9719,a8w8_blockscale_1x128x128_256x64x64x256_16x16_32x32_16x16x1_16x16x1_1x32x1x8_8_1x1_intrawave_v1
80,20480,3072,1536,0,0,1093.5194,a8w8_blockscale_1x128x128_256x128x128x128_16x16_32x32_8x32x1_8x32x1_1x32x1x8_8_1x1_intrawave_v3
80,20480,576,7168,18,0,828.2115,a8w8_blockscale_1x128x128_256x64x64x256_16x16_32x32_16x16x1_16x16x1_1x32x1x8_8_1x1_intrawave_v1
80,20480,7168,256,16,0,736.2963,a8w8_blockscale_1x128x128_256x64x64x128_16x16_32x32_8x32x1_8x32x1_1x32x1x8_8_1x1_intrawave_v1
80,20480,7168,2048,0,0,3278.9573,a8w8_blockscale_1x128x128_256x128x128x128_16x16_32x32_8x32x1_8x32x1_1x32x1x8_8_1x1_intrawave_v3
80,20480,4608,7168,18,0,6602.9093,a8w8_blockscale_1x128x128_256x64x64x256_16x16_32x32_16x16x1_16x16x1_1x32x1x8_8_1x1_intrawave_v1
80,20480,7168,2304,3,0,3334.7915,a8w8_blockscale_1x128x128_256x64x64x128_16x16_32x32_8x32x1_8x32x1_1x32x1x8_8_1x1_intrawave_v3
80,20480,512,7168,2,0,731.4131,a8w8_blockscale_1x128x128_256x64x128x128_16x16_32x32_8x32x1_8x32x1_1x32x1x8_8_1x1_intrawave_v3
80,20480,4096,512,16,0,651.0048,a8w8_blockscale_1x128x128_256x64x64x128_16x16_32x32_8x32x1_8x32x1_1x32x1x8_8_1x1_intrawave_v1
