aiter/configs/a8w8_bpreshuffle_cktile_tuned_gemm.csv
cu_num,M,N,K,kernelId,splitK,us,kernelName
<<<<<<< HEAD
80,1,1280,8192,2,0,13.6042,a8w8_bpreshuffle_cktile_0x0x8x4x1x0x0x0x0x1_16x64x512_1x4x1_16x16x64_default
80,1,4608,4096,2,0,10.7858,a8w8_bpreshuffle_cktile_0x0x8x4x1x0x0x0x0x1_16x64x512_1x4x1_16x16x64_default
80,1,8192,1024,3,0,6.4938,a8w8_bpreshuffle_cktile_0x0x8x4x1x0x0x0x0x1_16x128x512_1x4x1_16x16x64_default
80,1,9216,4096,2,0,15.2091,a8w8_bpreshuffle_cktile_0x0x8x4x1x0x0x0x0x1_16x64x512_1x4x1_16x16x64_default
80,2,4608,4096,9,0,10.6422,a8w8_bpreshuffle_cktile_0x0x8x4x1x0x0x0x0x1_32x64x512_1x4x1_16x16x64_default
80,2,9216,4096,2,0,14.805,a8w8_bpreshuffle_cktile_0x0x8x4x1x0x0x0x0x1_16x64x512_1x4x1_16x16x64_default
80,4,4608,4096,2,0,10.2483,a8w8_bpreshuffle_cktile_0x0x8x4x1x0x0x0x0x1_16x64x512_1x4x1_16x16x64_default
80,4,9216,4096,2,0,15.7978,a8w8_bpreshuffle_cktile_0x0x8x4x1x0x0x0x0x1_16x64x512_1x4x1_16x16x64_default
80,8,4608,4096,2,0,10.2986,a8w8_bpreshuffle_cktile_0x0x8x4x1x0x0x0x0x1_16x64x512_1x4x1_16x16x64_default
80,8,9216,4096,2,0,15.4503,a8w8_bpreshuffle_cktile_0x0x8x4x1x0x0x0x0x1_16x64x512_1x4x1_16x16x64_default
80,16,512,7168,2,0,12.6462,a8w8_bpreshuffle_cktile_0x0x8x4x1x0x0x0x0x1_16x64x512_1x4x1_16x16x64_default
80,16,576,7168,2,0,12.2382,a8w8_bpreshuffle_cktile_0x0x8x4x1x0x0x0x0x1_16x64x512_1x4x1_16x16x64_default
80,16,1536,7168,2,0,13.0574,a8w8_bpreshuffle_cktile_0x0x8x4x1x0x0x0x0x1_16x64x512_1x4x1_16x16x64_default
80,16,3072,1536,2,0,6.3682,a8w8_bpreshuffle_cktile_0x0x8x4x1x0x0x0x0x1_16x64x512_1x4x1_16x16x64_default
80,16,4096,512,5,0,4.659,a8w8_bpreshuffle_cktile_0x0x8x4x1x0x0x0x0x1_16x64x256_1x4x1_16x16x64_default
80,16,4608,4096,2,0,10.9258,a8w8_bpreshuffle_cktile_0x0x8x4x1x0x0x0x0x1_16x64x512_1x4x1_16x16x64_default
80,16,4608,7168,2,0,14.545,a8w8_bpreshuffle_cktile_0x0x8x4x1x0x0x0x0x1_16x64x512_1x4x1_16x16x64_default
80,16,7168,256,5,0,4.521,a8w8_bpreshuffle_cktile_0x0x8x4x1x0x0x0x0x1_16x64x256_1x4x1_16x16x64_default
80,16,7168,2048,3,0,9.3906,a8w8_bpreshuffle_cktile_0x0x8x4x1x0x0x0x0x1_16x128x512_1x4x1_16x16x64_default
80,16,7168,2304,21,0,11.0714,a8w8_bpreshuffle_cktile_0x0x8x4x1x0x0x0x0x1_32x64x256_1x4x1_16x16x64_default
80,16,9216,4096,2,0,16.3078,a8w8_bpreshuffle_cktile_0x0x8x4x1x0x0x0x0x1_16x64x512_1x4x1_16x16x64_default
80,32,256,7168,2,0,11.9863,a8w8_bpreshuffle_cktile_0x0x8x4x1x0x0x0x0x1_16x64x512_1x4x1_16x16x64_default
80,32,512,7168,2,0,12.9242,a8w8_bpreshuffle_cktile_0x0x8x4x1x0x0x0x0x1_16x64x512_1x4x1_16x16x64_default
80,32,576,7168,2,0,12.4986,a8w8_bpreshuffle_cktile_0x0x8x4x1x0x0x0x0x1_16x64x512_1x4x1_16x16x64_default
80,32,1280,8192,2,0,14.6311,a8w8_bpreshuffle_cktile_0x0x8x4x1x0x0x0x0x1_16x64x512_1x4x1_16x16x64_default
80,32,1536,7168,2,0,13.7882,a8w8_bpreshuffle_cktile_0x0x8x4x1x0x0x0x0x1_16x64x512_1x4x1_16x16x64_default
80,32,2048,7168,2,0,13.9919,a8w8_bpreshuffle_cktile_0x0x8x4x1x0x0x0x0x1_16x64x512_1x4x1_16x16x64_default
80,32,2112,7168,2,0,13.7279,a8w8_bpreshuffle_cktile_0x0x8x4x1x0x0x0x0x1_16x64x512_1x4x1_16x16x64_default
80,32,3072,1536,9,0,7.2898,a8w8_bpreshuffle_cktile_0x0x8x4x1x0x0x0x0x1_32x64x512_1x4x1_16x16x64_default
80,32,4096,512,21,0,5.165,a8w8_bpreshuffle_cktile_0x0x8x4x1x0x0x0x0x1_32x64x256_1x4x1_16x16x64_default
80,32,4608,4096,9,0,12.0666,a8w8_bpreshuffle_cktile_0x0x8x4x1x0x0x0x0x1_32x64x512_1x4x1_16x16x64_default
80,32,4608,7168,9,0,16.4466,a8w8_bpreshuffle_cktile_0x0x8x4x1x0x0x0x0x1_32x64x512_1x4x1_16x16x64_default
80,32,7168,256,15,0,4.897,a8w8_bpreshuffle_cktile_0x0x8x4x1x0x0x0x0x1_32x64x128_1x4x1_16x16x64_default
80,32,7168,512,23,0,6.047,a8w8_bpreshuffle_cktile_0x0x8x4x1x0x0x0x0x1_32x128x256_1x4x1_16x16x64_default
80,32,7168,576,10,0,12.6186,a8w8_bpreshuffle_cktile_0x0x8x4x1x0x0x0x0x1_64x256x64_1x4x1_16x16x64_default
80,32,7168,1536,23,0,9.3051,a8w8_bpreshuffle_cktile_0x0x8x4x1x0x0x0x0x1_32x128x256_1x4x1_16x16x64_default
80,32,7168,2048,23,0,10.5766,a8w8_bpreshuffle_cktile_0x0x8x4x1x0x0x0x0x1_32x128x256_1x4x1_16x16x64_default
80,32,7168,2304,21,0,11.591,a8w8_bpreshuffle_cktile_0x0x8x4x1x0x0x0x0x1_32x64x256_1x4x1_16x16x64_default
80,32,8192,1024,21,0,7.7066,a8w8_bpreshuffle_cktile_0x0x8x4x1x0x0x0x0x1_32x64x256_1x4x1_16x16x64_default
80,32,9216,4096,9,0,18.6827,a8w8_bpreshuffle_cktile_0x0x8x4x1x0x0x0x0x1_32x64x512_1x4x1_16x16x64_default
80,64,256,7168,2,0,11.935,a8w8_bpreshuffle_cktile_0x0x8x4x1x0x0x0x0x1_16x64x512_1x4x1_16x16x64_default
80,64,512,7168,2,0,12.991,a8w8_bpreshuffle_cktile_0x0x8x4x1x0x0x0x0x1_16x64x512_1x4x1_16x16x64_default
80,64,576,7168,2,0,12.9595,a8w8_bpreshuffle_cktile_0x0x8x4x1x0x0x0x0x1_16x64x512_1x4x1_16x16x64_default
80,64,1280,8192,2,0,15.0163,a8w8_bpreshuffle_cktile_0x0x8x4x1x0x0x0x0x1_16x64x512_1x4x1_16x16x64_default
80,64,1536,7168,9,0,16.417,a8w8_bpreshuffle_cktile_0x0x8x4x1x0x0x0x0x1_32x64x512_1x4x1_16x16x64_default
80,64,2048,7168,9,0,15.8307,a8w8_bpreshuffle_cktile_0x0x8x4x1x0x0x0x0x1_32x64x512_1x4x1_16x16x64_default
80,64,2112,7168,9,0,16.353,a8w8_bpreshuffle_cktile_0x0x8x4x1x0x0x0x0x1_32x64x512_1x4x1_16x16x64_default
80,64,3072,1536,23,0,9.1626,a8w8_bpreshuffle_cktile_0x0x8x4x1x0x0x0x0x1_32x128x256_1x4x1_16x16x64_default
80,64,4096,512,21,0,5.8978,a8w8_bpreshuffle_cktile_0x0x8x4x1x0x0x0x0x1_32x64x256_1x4x1_16x16x64_default
80,64,4608,4096,23,0,16.6006,a8w8_bpreshuffle_cktile_0x0x8x4x1x0x0x0x0x1_32x128x256_1x4x1_16x16x64_default
80,64,4608,7168,23,0,25.0751,a8w8_bpreshuffle_cktile_0x0x8x4x1x0x0x0x0x1_32x128x256_1x4x1_16x16x64_default
80,64,7168,256,16,0,6.0306,a8w8_bpreshuffle_cktile_0x0x8x4x1x0x0x0x0x1_64x64x128_1x4x1_16x16x64_default
80,64,7168,512,21,0,7.3462,a8w8_bpreshuffle_cktile_0x0x8x4x1x0x0x0x0x1_32x64x256_1x4x1_16x16x64_default
80,64,7168,576,10,0,12.8178,a8w8_bpreshuffle_cktile_0x0x8x4x1x0x0x0x0x1_64x256x64_1x4x1_16x16x64_default
80,64,7168,1536,24,0,12.283,a8w8_bpreshuffle_cktile_0x0x8x4x1x0x0x0x0x1_64x128x256_1x4x1_16x16x64_default
80,64,7168,2048,24,0,14.0191,a8w8_bpreshuffle_cktile_0x0x8x4x1x0x0x0x0x1_64x128x256_1x4x1_16x16x64_default
80,64,7168,2304,21,0,15.3719,a8w8_bpreshuffle_cktile_0x0x8x4x1x0x0x0x0x1_32x64x256_1x4x1_16x16x64_default
80,64,8192,1024,24,0,10.0822,a8w8_bpreshuffle_cktile_0x0x8x4x1x0x0x0x0x1_64x128x256_1x4x1_16x16x64_default
80,64,9216,4096,24,0,25.6335,a8w8_bpreshuffle_cktile_0x0x8x4x1x0x0x0x0x1_64x128x256_1x4x1_16x16x64_default
80,96,256,7168,2,0,12.0478,a8w8_bpreshuffle_cktile_0x0x8x4x1x0x0x0x0x1_16x64x512_1x4x1_16x16x64_default
80,96,2048,7168,21,0,21.5243,a8w8_bpreshuffle_cktile_0x0x8x4x1x0x0x0x0x1_32x64x256_1x4x1_16x16x64_default
80,96,2112,7168,9,0,23.7107,a8w8_bpreshuffle_cktile_0x0x8x4x1x0x0x0x0x1_32x64x512_1x4x1_16x16x64_default
80,96,7168,512,17,0,9.0182,a8w8_bpreshuffle_cktile_0x0x8x4x1x0x0x0x0x1_32x128x128_1x4x1_16x16x64_default
80,96,7168,576,10,0,13.0203,a8w8_bpreshuffle_cktile_0x0x8x4x1x0x0x0x0x1_64x256x64_1x4x1_16x16x64_default
80,96,7168,1536,17,0,15.5371,a8w8_bpreshuffle_cktile_0x0x8x4x1x0x0x0x0x1_32x128x128_1x4x1_16x16x64_default
80,128,256,7168,2,0,11.5986,a8w8_bpreshuffle_cktile_0x0x8x4x1x0x0x0x0x1_16x64x512_1x4x1_16x16x64_default
80,128,512,7168,2,0,13.1135,a8w8_bpreshuffle_cktile_0x0x8x4x1x0x0x0x0x1_16x64x512_1x4x1_16x16x64_default
80,128,576,7168,2,0,13.4551,a8w8_bpreshuffle_cktile_0x0x8x4x1x0x0x0x0x1_16x64x512_1x4x1_16x16x64_default
80,128,1280,8192,9,0,17.5622,a8w8_bpreshuffle_cktile_0x0x8x4x1x0x0x0x0x1_32x64x512_1x4x1_16x16x64_default
80,128,1536,7168,21,0,21.9019,a8w8_bpreshuffle_cktile_0x0x8x4x1x0x0x0x0x1_32x64x256_1x4x1_16x16x64_default
80,128,2048,7168,9,0,23.7263,a8w8_bpreshuffle_cktile_0x0x8x4x1x0x0x0x0x1_32x64x512_1x4x1_16x16x64_default
80,128,2112,7168,9,0,24.3243,a8w8_bpreshuffle_cktile_0x0x8x4x1x0x0x0x0x1_32x64x512_1x4x1_16x16x64_default
80,128,3072,1536,21,0,11.6962,a8w8_bpreshuffle_cktile_0x0x8x4x1x0x0x0x0x1_32x64x256_1x4x1_16x16x64_default
80,128,4096,512,23,0,7.457,a8w8_bpreshuffle_cktile_0x0x8x4x1x0x0x0x0x1_32x128x256_1x4x1_16x16x64_default
80,128,4608,4096,24,0,22.7135,a8w8_bpreshuffle_cktile_0x0x8x4x1x0x0x0x0x1_64x128x256_1x4x1_16x16x64_default
80,128,4608,7168,24,0,35.3359,a8w8_bpreshuffle_cktile_0x0x8x4x1x0x0x0x0x1_64x128x256_1x4x1_16x16x64_default
80,128,7168,256,17,0,7.599,a8w8_bpreshuffle_cktile_0x0x8x4x1x0x0x0x0x1_32x128x128_1x4x1_16x16x64_default
80,128,7168,512,17,0,9.359,a8w8_bpreshuffle_cktile_0x0x8x4x1x0x0x0x0x1_32x128x128_1x4x1_16x16x64_default
80,128,7168,576,10,0,13.2578,a8w8_bpreshuffle_cktile_0x0x8x4x1x0x0x0x0x1_64x256x64_1x4x1_16x16x64_default
80,128,7168,1536,23,0,16.7475,a8w8_bpreshuffle_cktile_0x0x8x4x1x0x0x0x0x1_32x128x256_1x4x1_16x16x64_default
80,128,7168,2048,23,0,20.1779,a8w8_bpreshuffle_cktile_0x0x8x4x1x0x0x0x0x1_32x128x256_1x4x1_16x16x64_default
80,128,7168,2304,23,0,21.7571,a8w8_bpreshuffle_cktile_0x0x8x4x1x0x0x0x0x1_32x128x256_1x4x1_16x16x64_default
80,128,8192,1024,24,0,14.3095,a8w8_bpreshuffle_cktile_0x0x8x4x1x0x0x0x0x1_64x128x256_1x4x1_16x16x64_default
80,128,9216,4096,24,0,35.3523,a8w8_bpreshuffle_cktile_0x0x8x4x1x0x0x0x0x1_64x128x256_1x4x1_16x16x64_default
80,192,1280,8192,9,0,25.4107,a8w8_bpreshuffle_cktile_0x0x8x4x1x0x0x0x0x1_32x64x512_1x4x1_16x16x64_default
80,192,8192,1024,18,0,18.5495,a8w8_bpreshuffle_cktile_0x0x8x4x1x0x0x0x0x1_64x128x128_1x4x1_16x16x64_default
80,256,256,7168,2,0,12.9182,a8w8_bpreshuffle_cktile_0x0x8x4x1x0x0x0x0x1_16x64x512_1x4x1_16x16x64_default
80,256,512,7168,9,0,16.1911,a8w8_bpreshuffle_cktile_0x0x8x4x1x0x0x0x0x1_32x64x512_1x4x1_16x16x64_default
80,256,576,7168,9,0,16.2022,a8w8_bpreshuffle_cktile_0x0x8x4x1x0x0x0x0x1_32x64x512_1x4x1_16x16x64_default
80,256,1280,8192,23,0,25.9367,a8w8_bpreshuffle_cktile_0x0x8x4x1x0x0x0x0x1_32x128x256_1x4x1_16x16x64_default
80,256,1536,7168,23,0,32.5851,a8w8_bpreshuffle_cktile_0x0x8x4x1x0x0x0x0x1_32x128x256_1x4x1_16x16x64_default
80,256,2048,7168,24,0,35.3415,a8w8_bpreshuffle_cktile_0x0x8x4x1x0x0x0x0x1_64x128x256_1x4x1_16x16x64_default
80,256,2112,7168,22,0,36.3295,a8w8_bpreshuffle_cktile_0x0x8x4x1x0x0x0x0x1_64x64x256_1x4x1_16x16x64_default
80,256,3072,1536,26,0,16.1743,a8w8_bpreshuffle_cktile_0x0x8x4x1x0x0x0x0x1_64x192x128_1x4x1_16x16x64_default
80,256,4096,512,24,0,10.425,a8w8_bpreshuffle_cktile_0x0x8x4x1x0x0x0x0x1_64x128x256_1x4x1_16x16x64_default
80,256,4608,4096,24,0,35.0003,a8w8_bpreshuffle_cktile_0x0x8x4x1x0x0x0x0x1_64x128x256_1x4x1_16x16x64_default
80,256,4608,7168,24,0,56.4576,a8w8_bpreshuffle_cktile_0x0x8x4x1x0x0x0x0x1_64x128x256_1x4x1_16x16x64_default
80,256,7168,256,18,0,10.3027,a8w8_bpreshuffle_cktile_0x0x8x4x1x0x0x0x0x1_64x128x128_1x4x1_16x16x64_default
80,256,7168,512,18,0,13.7754,a8w8_bpreshuffle_cktile_0x0x8x4x1x0x0x0x0x1_64x128x128_1x4x1_16x16x64_default
80,256,7168,576,10,0,17.7211,a8w8_bpreshuffle_cktile_0x0x8x4x1x0x0x0x0x1_64x256x64_1x4x1_16x16x64_default
80,256,7168,1536,18,0,25.6575,a8w8_bpreshuffle_cktile_0x0x8x4x1x0x0x0x0x1_64x128x128_1x4x1_16x16x64_default
80,256,7168,2048,18,0,30.8599,a8w8_bpreshuffle_cktile_0x0x8x4x1x0x0x0x0x1_64x128x128_1x4x1_16x16x64_default
80,256,7168,2304,18,0,31.4675,a8w8_bpreshuffle_cktile_0x0x8x4x1x0x0x0x0x1_64x128x128_1x4x1_16x16x64_default
80,256,8192,1024,18,0,22.3339,a8w8_bpreshuffle_cktile_0x0x8x4x1x0x0x0x0x1_64x128x128_1x4x1_16x16x64_default
80,256,9216,4096,20,0,62.3904,a8w8_bpreshuffle_cktile_0x0x8x4x1x0x0x0x0x1_64x256x128_1x4x1_16x16x64_default
80,320,1280,8192,23,0,37.1911,a8w8_bpreshuffle_cktile_0x0x8x4x1x0x0x0x0x1_32x128x256_1x4x1_16x16x64_default
80,320,8192,1024,20,0,23.5307,a8w8_bpreshuffle_cktile_0x0x8x4x1x0x0x0x0x1_64x256x128_1x4x1_16x16x64_default
80,512,256,7168,9,0,15.7166,a8w8_bpreshuffle_cktile_0x0x8x4x1x0x0x0x0x1_32x64x512_1x4x1_16x16x64_default
80,512,512,7168,9,0,22.7694,a8w8_bpreshuffle_cktile_0x0x8x4x1x0x0x0x0x1_32x64x512_1x4x1_16x16x64_default
80,512,576,7168,9,0,23.0015,a8w8_bpreshuffle_cktile_0x0x8x4x1x0x0x0x0x1_32x64x512_1x4x1_16x16x64_default
80,512,1280,8192,24,0,38.4724,a8w8_bpreshuffle_cktile_0x0x8x4x1x0x0x0x0x1_64x128x256_1x4x1_16x16x64_default
80,512,1536,7168,23,0,49.856,a8w8_bpreshuffle_cktile_0x0x8x4x1x0x0x0x0x1_32x128x256_1x4x1_16x16x64_default
80,512,2048,7168,24,0,55.5148,a8w8_bpreshuffle_cktile_0x0x8x4x1x0x0x0x0x1_64x128x256_1x4x1_16x16x64_default
80,512,2112,7168,11,0,67.7368,a8w8_bpreshuffle_cktile_0x0x8x4x1x0x0x0x0x1_128x64x128_1x4x1_16x16x64_default
80,512,3072,1536,23,0,23.3819,a8w8_bpreshuffle_cktile_0x0x8x4x1x0x0x0x0x1_32x128x256_1x4x1_16x16x64_default
80,512,4096,512,18,0,15.8722,a8w8_bpreshuffle_cktile_0x0x8x4x1x0x0x0x0x1_64x128x128_1x4x1_16x16x64_default
80,512,4608,7168,0,0,102.0033,a8w8_bpreshuffle_cktile_0x0x8x4x1x0x0x0x0x1_128x128x128_1x4x1_16x16x64_default
80,512,7168,256,10,0,16.0822,a8w8_bpreshuffle_cktile_0x0x8x4x1x0x0x0x0x1_64x256x64_1x4x1_16x16x64_default
80,512,7168,512,18,0,22.0743,a8w8_bpreshuffle_cktile_0x0x8x4x1x0x0x0x0x1_64x128x128_1x4x1_16x16x64_default
80,512,7168,576,10,0,23.5799,a8w8_bpreshuffle_cktile_0x0x8x4x1x0x0x0x0x1_64x256x64_1x4x1_16x16x64_default
80,512,7168,1536,18,0,42.8375,a8w8_bpreshuffle_cktile_0x0x8x4x1x0x0x0x0x1_64x128x128_1x4x1_16x16x64_default
80,512,7168,2048,0,0,53.7868,a8w8_bpreshuffle_cktile_0x0x8x4x1x0x0x0x0x1_128x128x128_1x4x1_16x16x64_default
80,512,7168,2304,18,0,56.3324,a8w8_bpreshuffle_cktile_0x0x8x4x1x0x0x0x0x1_64x128x128_1x4x1_16x16x64_default
80,512,8192,1024,18,0,36.3047,a8w8_bpreshuffle_cktile_0x0x8x4x1x0x0x0x0x1_64x128x128_1x4x1_16x16x64_default
80,1024,256,7168,9,0,22.5215,a8w8_bpreshuffle_cktile_0x0x8x4x1x0x0x0x0x1_32x64x512_1x4x1_16x16x64_default
80,1024,512,7168,24,0,34.0915,a8w8_bpreshuffle_cktile_0x0x8x4x1x0x0x0x0x1_64x128x256_1x4x1_16x16x64_default
80,1024,576,7168,22,0,35.7631,a8w8_bpreshuffle_cktile_0x0x8x4x1x0x0x0x0x1_64x64x256_1x4x1_16x16x64_default
80,1024,1280,8192,24,0,63.0944,a8w8_bpreshuffle_cktile_0x0x8x4x1x0x0x0x0x1_64x128x256_1x4x1_16x16x64_default
80,1024,1536,7168,26,0,77.6289,a8w8_bpreshuffle_cktile_0x0x8x4x1x0x0x0x0x1_64x192x128_1x4x1_16x16x64_default
80,1024,2048,7168,20,0,101.1286,a8w8_bpreshuffle_cktile_0x0x8x4x1x0x0x0x0x1_64x256x128_1x4x1_16x16x64_default
80,1024,2112,7168,26,0,110.6865,a8w8_bpreshuffle_cktile_0x0x8x4x1x0x0x0x0x1_64x192x128_1x4x1_16x16x64_default
80,1024,3072,1536,18,0,38.8395,a8w8_bpreshuffle_cktile_0x0x8x4x1x0x0x0x0x1_64x128x128_1x4x1_16x16x64_default
80,1024,4096,512,19,0,24.5403,a8w8_bpreshuffle_cktile_0x0x8x4x1x0x0x0x0x1_32x256x128_1x4x1_16x16x64_default
80,1024,4608,4096,26,0,111.5906,a8w8_bpreshuffle_cktile_0x0x8x4x1x0x0x0x0x1_64x192x128_1x4x1_16x16x64_default
80,1024,4608,7168,26,0,183.8244,a8w8_bpreshuffle_cktile_0x0x8x4x1x0x0x0x0x1_64x192x128_1x4x1_16x16x64_default
80,1024,7168,256,10,0,26.3131,a8w8_bpreshuffle_cktile_0x0x8x4x1x0x0x0x0x1_64x256x64_1x4x1_16x16x64_default
80,1024,7168,512,18,0,37.8719,a8w8_bpreshuffle_cktile_0x0x8x4x1x0x0x0x0x1_64x128x128_1x4x1_16x16x64_default
80,1024,7168,576,10,0,40.2687,a8w8_bpreshuffle_cktile_0x0x8x4x1x0x0x0x0x1_64x256x64_1x4x1_16x16x64_default
80,1024,7168,1536,18,0,78.8461,a8w8_bpreshuffle_cktile_0x0x8x4x1x0x0x0x0x1_64x128x128_1x4x1_16x16x64_default
80,1024,7168,2048,18,0,98.7662,a8w8_bpreshuffle_cktile_0x0x8x4x1x0x0x0x0x1_64x128x128_1x4x1_16x16x64_default
80,1024,7168,2304,18,0,104.5406,a8w8_bpreshuffle_cktile_0x0x8x4x1x0x0x0x0x1_64x128x128_1x4x1_16x16x64_default
80,1024,8192,1024,18,0,66.8784,a8w8_bpreshuffle_cktile_0x0x8x4x1x0x0x0x0x1_64x128x128_1x4x1_16x16x64_default
80,1024,9216,4096,26,0,213.5961,a8w8_bpreshuffle_cktile_0x0x8x4x1x0x0x0x0x1_64x192x128_1x4x1_16x16x64_default
80,1536,512,7168,23,0,50.8952,a8w8_bpreshuffle_cktile_0x0x8x4x1x0x0x0x0x1_32x128x256_1x4x1_16x16x64_default
80,1536,576,7168,26,0,49.5316,a8w8_bpreshuffle_cktile_0x0x8x4x1x0x0x0x0x1_64x192x128_1x4x1_16x16x64_default
80,1536,1536,7168,0,0,101.1954,a8w8_bpreshuffle_cktile_0x0x8x4x1x0x0x0x0x1_128x128x128_1x4x1_16x16x64_default
80,1536,3072,1536,26,0,50.9268,a8w8_bpreshuffle_cktile_0x0x8x4x1x0x0x0x0x1_64x192x128_1x4x1_16x16x64_default
80,1536,4096,512,18,0,32.4883,a8w8_bpreshuffle_cktile_0x0x8x4x1x0x0x0x0x1_64x128x128_1x4x1_16x16x64_default
80,1536,4608,7168,18,0,276.3971,a8w8_bpreshuffle_cktile_0x0x8x4x1x0x0x0x0x1_64x128x128_1x4x1_16x16x64_default
80,1536,7168,256,19,0,35.7795,a8w8_bpreshuffle_cktile_0x0x8x4x1x0x0x0x0x1_32x256x128_1x4x1_16x16x64_default
80,1536,7168,2048,18,0,136.4043,a8w8_bpreshuffle_cktile_0x0x8x4x1x0x0x0x0x1_64x128x128_1x4x1_16x16x64_default
80,1536,7168,2304,18,0,145.3623,a8w8_bpreshuffle_cktile_0x0x8x4x1x0x0x0x0x1_64x128x128_1x4x1_16x16x64_default
80,2048,256,7168,24,0,35.5559,a8w8_bpreshuffle_cktile_0x0x8x4x1x0x0x0x0x1_64x128x256_1x4x1_16x16x64_default
80,2048,512,7168,24,0,54.864,a8w8_bpreshuffle_cktile_0x0x8x4x1x0x0x0x0x1_64x128x256_1x4x1_16x16x64_default
80,2048,576,7168,11,0,68.4384,a8w8_bpreshuffle_cktile_0x0x8x4x1x0x0x0x0x1_128x64x128_1x4x1_16x16x64_default
80,2048,1280,8192,20,0,115.9882,a8w8_bpreshuffle_cktile_0x0x8x4x1x0x0x0x0x1_64x256x128_1x4x1_16x16x64_default
80,2048,1536,7168,24,0,131.0014,a8w8_bpreshuffle_cktile_0x0x8x4x1x0x0x0x0x1_64x128x256_1x4x1_16x16x64_default
80,2048,2048,7168,24,0,179.486,a8w8_bpreshuffle_cktile_0x0x8x4x1x0x0x0x0x1_64x128x256_1x4x1_16x16x64_default
80,2048,2112,7168,26,0,182.19,a8w8_bpreshuffle_cktile_0x0x8x4x1x0x0x0x0x1_64x192x128_1x4x1_16x16x64_default
80,2048,3072,1536,18,0,65.848,a8w8_bpreshuffle_cktile_0x0x8x4x1x0x0x0x0x1_64x128x128_1x4x1_16x16x64_default
80,2048,4096,512,18,0,41.698,a8w8_bpreshuffle_cktile_0x0x8x4x1x0x0x0x0x1_64x128x128_1x4x1_16x16x64_default
80,2048,4096,5120,18,0,234.4734,a8w8_bpreshuffle_cktile_0x0x8x4x1x0x0x0x0x1_64x128x128_1x4x1_16x16x64_default
80,2048,4608,4096,26,0,212.3629,a8w8_bpreshuffle_cktile_0x0x8x4x1x0x0x0x0x1_64x192x128_1x4x1_16x16x64_default
80,2048,4608,7168,26,0,356.2706,a8w8_bpreshuffle_cktile_0x0x8x4x1x0x0x0x0x1_64x192x128_1x4x1_16x16x64_default
80,2048,7168,256,18,0,46.1799,a8w8_bpreshuffle_cktile_0x0x8x4x1x0x0x0x0x1_64x128x128_1x4x1_16x16x64_default
80,2048,7168,512,18,0,66.7848,a8w8_bpreshuffle_cktile_0x0x8x4x1x0x0x0x0x1_64x128x128_1x4x1_16x16x64_default
80,2048,7168,576,10,0,72.93,a8w8_bpreshuffle_cktile_0x0x8x4x1x0x0x0x0x1_64x256x64_1x4x1_16x16x64_default
80,2048,7168,1536,18,0,142.1891,a8w8_bpreshuffle_cktile_0x0x8x4x1x0x0x0x0x1_64x128x128_1x4x1_16x16x64_default
80,2048,7168,2048,18,0,182.2596,a8w8_bpreshuffle_cktile_0x0x8x4x1x0x0x0x0x1_64x128x128_1x4x1_16x16x64_default
80,2048,7168,2304,18,0,192.9633,a8w8_bpreshuffle_cktile_0x0x8x4x1x0x0x0x0x1_64x128x128_1x4x1_16x16x64_default
80,2048,8192,1024,18,0,119.1762,a8w8_bpreshuffle_cktile_0x0x8x4x1x0x0x0x0x1_64x128x128_1x4x1_16x16x64_default
80,2048,9216,4096,18,0,411.6495,a8w8_bpreshuffle_cktile_0x0x8x4x1x0x0x0x0x1_64x128x128_1x4x1_16x16x64_default
80,4096,256,7168,24,0,56.2128,a8w8_bpreshuffle_cktile_0x0x8x4x1x0x0x0x0x1_64x128x256_1x4x1_16x16x64_default
80,4096,512,7168,0,0,101.1146,a8w8_bpreshuffle_cktile_0x0x8x4x1x0x0x0x0x1_128x128x128_1x4x1_16x16x64_default
80,4096,576,7168,26,0,111.599,a8w8_bpreshuffle_cktile_0x0x8x4x1x0x0x0x0x1_64x192x128_1x4x1_16x16x64_default
80,4096,1280,8192,20,0,225.8953,a8w8_bpreshuffle_cktile_0x0x8x4x1x0x0x0x0x1_64x256x128_1x4x1_16x16x64_default
80,4096,1536,7168,0,0,248.7646,a8w8_bpreshuffle_cktile_0x0x8x4x1x0x0x0x0x1_128x128x128_1x4x1_16x16x64_default
80,4096,2048,7168,18,0,325.3985,a8w8_bpreshuffle_cktile_0x0x8x4x1x0x0x0x0x1_64x128x128_1x4x1_16x16x64_default
80,4096,2112,7168,26,0,323.4329,a8w8_bpreshuffle_cktile_0x0x8x4x1x0x0x0x0x1_64x192x128_1x4x1_16x16x64_default
80,4096,3072,1536,26,0,120.629,a8w8_bpreshuffle_cktile_0x0x8x4x1x0x0x0x0x1_64x192x128_1x4x1_16x16x64_default
80,4096,4096,512,18,0,74.2453,a8w8_bpreshuffle_cktile_0x0x8x4x1x0x0x0x0x1_64x128x128_1x4x1_16x16x64_default
80,4096,4608,4096,18,0,412.3228,a8w8_bpreshuffle_cktile_0x0x8x4x1x0x0x0x0x1_64x128x128_1x4x1_16x16x64_default
80,4096,4608,7168,18,0,699.3734,a8w8_bpreshuffle_cktile_0x0x8x4x1x0x0x0x0x1_64x128x128_1x4x1_16x16x64_default
80,4096,7168,256,10,0,83.1469,a8w8_bpreshuffle_cktile_0x0x8x4x1x0x0x0x0x1_64x256x64_1x4x1_16x16x64_default
80,4096,7168,512,18,0,124.0374,a8w8_bpreshuffle_cktile_0x0x8x4x1x0x0x0x0x1_64x128x128_1x4x1_16x16x64_default
80,4096,7168,576,10,0,133.9002,a8w8_bpreshuffle_cktile_0x0x8x4x1x0x0x0x0x1_64x256x64_1x4x1_16x16x64_default
80,4096,7168,1536,18,0,269.6255,a8w8_bpreshuffle_cktile_0x0x8x4x1x0x0x0x0x1_64x128x128_1x4x1_16x16x64_default
80,4096,7168,2048,18,0,344.519,a8w8_bpreshuffle_cktile_0x0x8x4x1x0x0x0x0x1_64x128x128_1x4x1_16x16x64_default
80,4096,7168,2304,18,0,370.6675,a8w8_bpreshuffle_cktile_0x0x8x4x1x0x0x0x0x1_64x128x128_1x4x1_16x16x64_default
80,4096,8192,1024,18,0,224.803,a8w8_bpreshuffle_cktile_0x0x8x4x1x0x0x0x0x1_64x128x128_1x4x1_16x16x64_default
80,4096,9216,4096,18,0,807.3152,a8w8_bpreshuffle_cktile_0x0x8x4x1x0x0x0x0x1_64x128x128_1x4x1_16x16x64_default
80,4240,9216,4096,26,0,844.4437,a8w8_bpreshuffle_cktile_0x0x8x4x1x0x0x0x0x1_64x192x128_1x4x1_16x16x64_default
80,5104,5120,8192,18,0,1084.9709,a8w8_bpreshuffle_cktile_0x0x8x4x1x0x0x0x0x1_64x128x128_1x4x1_16x16x64_default
80,5112,6912,5120,26,0,916.5628,a8w8_bpreshuffle_cktile_0x0x8x4x1x0x0x0x0x1_64x192x128_1x4x1_16x16x64_default
80,5120,5120,4096,18,0,561.5756,a8w8_bpreshuffle_cktile_0x0x8x4x1x0x0x0x0x1_64x128x128_1x4x1_16x16x64_default
80,5120,5120,8192,20,0,1097.1286,a8w8_bpreshuffle_cktile_0x0x8x4x1x0x0x0x0x1_64x256x128_1x4x1_16x16x64_default
80,8192,256,7168,20,0,104.7314,a8w8_bpreshuffle_cktile_0x0x8x4x1x0x0x0x0x1_64x256x128_1x4x1_16x16x64_default
80,8192,512,7168,24,0,180.5044,a8w8_bpreshuffle_cktile_0x0x8x4x1x0x0x0x0x1_64x128x256_1x4x1_16x16x64_default
80,8192,576,7168,26,0,186.1856,a8w8_bpreshuffle_cktile_0x0x8x4x1x0x0x0x0x1_64x192x128_1x4x1_16x16x64_default
80,8192,1280,8192,0,0,444.6193,a8w8_bpreshuffle_cktile_0x0x8x4x1x0x0x0x0x1_128x128x128_1x4x1_16x16x64_default
80,8192,1536,7168,18,0,482.4858,a8w8_bpreshuffle_cktile_0x0x8x4x1x0x0x0x0x1_64x128x128_1x4x1_16x16x64_default
80,8192,2048,7168,0,0,629.2967,a8w8_bpreshuffle_cktile_0x0x8x4x1x0x0x0x0x1_128x128x128_1x4x1_16x16x64_default
80,8192,2112,7168,26,0,636.2131,a8w8_bpreshuffle_cktile_0x0x8x4x1x0x0x0x0x1_64x192x128_1x4x1_16x16x64_default
80,8192,3072,1536,26,0,229.6854,a8w8_bpreshuffle_cktile_0x0x8x4x1x0x0x0x0x1_64x192x128_1x4x1_16x16x64_default
80,8192,4096,512,18,0,140.1687,a8w8_bpreshuffle_cktile_0x0x8x4x1x0x0x0x0x1_64x128x128_1x4x1_16x16x64_default
80,8192,4608,7168,26,0,1362.9149,a8w8_bpreshuffle_cktile_0x0x8x4x1x0x0x0x0x1_64x192x128_1x4x1_16x16x64_default
80,8192,7168,256,10,0,154.2875,a8w8_bpreshuffle_cktile_0x0x8x4x1x0x0x0x0x1_64x256x64_1x4x1_16x16x64_default
80,8192,7168,512,18,0,236.1762,a8w8_bpreshuffle_cktile_0x0x8x4x1x0x0x0x0x1_64x128x128_1x4x1_16x16x64_default
80,8192,7168,576,10,0,253.785,a8w8_bpreshuffle_cktile_0x0x8x4x1x0x0x0x0x1_64x256x64_1x4x1_16x16x64_default
80,8192,7168,1536,18,0,525.4971,a8w8_bpreshuffle_cktile_0x0x8x4x1x0x0x0x0x1_64x128x128_1x4x1_16x16x64_default
80,8192,7168,2048,18,0,673.3641,a8w8_bpreshuffle_cktile_0x0x8x4x1x0x0x0x0x1_64x128x128_1x4x1_16x16x64_default
80,8192,7168,2304,18,0,734.4784,a8w8_bpreshuffle_cktile_0x0x8x4x1x0x0x0x0x1_64x128x128_1x4x1_16x16x64_default
80,8192,8192,1024,18,0,433.2652,a8w8_bpreshuffle_cktile_0x0x8x4x1x0x0x0x0x1_64x128x128_1x4x1_16x16x64_default
80,16384,256,7168,24,0,183.0468,a8w8_bpreshuffle_cktile_0x0x8x4x1x0x0x0x0x1_64x128x256_1x4x1_16x16x64_default
80,16384,512,7168,24,0,331.5966,a8w8_bpreshuffle_cktile_0x0x8x4x1x0x0x0x0x1_64x128x256_1x4x1_16x16x64_default
80,16384,576,7168,26,0,362.7266,a8w8_bpreshuffle_cktile_0x0x8x4x1x0x0x0x0x1_64x192x128_1x4x1_16x16x64_default
80,16384,1280,8192,0,0,880.1631,a8w8_bpreshuffle_cktile_0x0x8x4x1x0x0x0x0x1_128x128x128_1x4x1_16x16x64_default
80,16384,1536,7168,26,0,917.9413,a8w8_bpreshuffle_cktile_0x0x8x4x1x0x0x0x0x1_64x192x128_1x4x1_16x16x64_default
80,16384,2048,7168,0,0,1248.8183,a8w8_bpreshuffle_cktile_0x0x8x4x1x0x0x0x0x1_128x128x128_1x4x1_16x16x64_default
80,16384,2112,7168,26,0,1292.9144,a8w8_bpreshuffle_cktile_0x0x8x4x1x0x0x0x0x1_64x192x128_1x4x1_16x16x64_default
80,16384,3072,1536,26,0,448.4049,a8w8_bpreshuffle_cktile_0x0x8x4x1x0x0x0x0x1_64x192x128_1x4x1_16x16x64_default
80,16384,4096,512,10,0,268.5471,a8w8_bpreshuffle_cktile_0x0x8x4x1x0x0x0x0x1_64x256x64_1x4x1_16x16x64_default
80,16384,4608,4096,26,0,1580.9022,a8w8_bpreshuffle_cktile_0x0x8x4x1x0x0x0x0x1_64x192x128_1x4x1_16x16x64_default
80,16384,4608,7168,26,0,2685.3215,a8w8_bpreshuffle_cktile_0x0x8x4x1x0x0x0x0x1_64x192x128_1x4x1_16x16x64_default
80,16384,7168,256,10,0,296.6024,a8w8_bpreshuffle_cktile_0x0x8x4x1x0x0x0x0x1_64x256x64_1x4x1_16x16x64_default
80,16384,7168,512,10,0,457.5157,a8w8_bpreshuffle_cktile_0x0x8x4x1x0x0x0x0x1_64x256x64_1x4x1_16x16x64_default
80,16384,7168,576,10,0,498.191,a8w8_bpreshuffle_cktile_0x0x8x4x1x0x0x0x0x1_64x256x64_1x4x1_16x16x64_default
80,16384,7168,1536,18,0,1038.672,a8w8_bpreshuffle_cktile_0x0x8x4x1x0x0x0x0x1_64x128x128_1x4x1_16x16x64_default
80,16384,7168,2048,18,0,1330.1784,a8w8_bpreshuffle_cktile_0x0x8x4x1x0x0x0x0x1_64x128x128_1x4x1_16x16x64_default
80,16384,7168,2304,18,0,1460.5905,a8w8_bpreshuffle_cktile_0x0x8x4x1x0x0x0x0x1_64x128x128_1x4x1_16x16x64_default
80,16384,8192,1024,18,0,854.0079,a8w8_bpreshuffle_cktile_0x0x8x4x1x0x0x0x0x1_64x128x128_1x4x1_16x16x64_default
80,16384,9216,4096,26,0,3147.3168,a8w8_bpreshuffle_cktile_0x0x8x4x1x0x0x0x0x1_64x192x128_1x4x1_16x16x64_default
80,20480,512,7168,20,0,399.486,a8w8_bpreshuffle_cktile_0x0x8x4x1x0x0x0x0x1_64x256x128_1x4x1_16x16x64_default
80,20480,576,7168,26,0,441.0973,a8w8_bpreshuffle_cktile_0x0x8x4x1x0x0x0x0x1_64x192x128_1x4x1_16x16x64_default
80,20480,1536,7168,26,0,1132.6788,a8w8_bpreshuffle_cktile_0x0x8x4x1x0x0x0x0x1_64x192x128_1x4x1_16x16x64_default
80,20480,3072,1536,26,0,553.5369,a8w8_bpreshuffle_cktile_0x0x8x4x1x0x0x0x0x1_64x192x128_1x4x1_16x16x64_default
80,20480,4096,512,10,0,331.0386,a8w8_bpreshuffle_cktile_0x0x8x4x1x0x0x0x0x1_64x256x64_1x4x1_16x16x64_default
80,20480,4608,7168,26,0,3346.5918,a8w8_bpreshuffle_cktile_0x0x8x4x1x0x0x0x0x1_64x192x128_1x4x1_16x16x64_default
80,20480,7168,256,10,0,368.0871,a8w8_bpreshuffle_cktile_0x0x8x4x1x0x0x0x0x1_64x256x64_1x4x1_16x16x64_default
80,20480,7168,2048,18,0,1659.9699,a8w8_bpreshuffle_cktile_0x0x8x4x1x0x0x0x0x1_64x128x128_1x4x1_16x16x64_default
80,20480,7168,2304,18,0,1819.2686,a8w8_bpreshuffle_cktile_0x0x8x4x1x0x0x0x0x1_64x128x128_1x4x1_16x16x64_default
80,32768,4608,4096,26,0,3155.6679,a8w8_bpreshuffle_cktile_0x0x8x4x1x0x0x0x0x1_64x192x128_1x4x1_16x16x64_default
80,32768,9216,4096,26,0,6282.4299,a8w8_bpreshuffle_cktile_0x0x8x4x1x0x0x0x0x1_64x192x128_1x4x1_16x16x64_default
=======
80,1,1280,8192,2,0,13.7255,a8w8_bpreshuffle_cktile_0x0x8x4x1x0x0x0x0x1_16x64x512_1x4x1_16x16x64_default
80,1,4608,4096,30,0,10.6394,a8w8_bpreshuffle_cktile_0x0x8x4x1x0x0x0x0x2_16x64x512_1x4x1_16x16x64_default
80,1,8192,1024,31,0,6.1958,a8w8_bpreshuffle_cktile_0x0x8x4x1x0x0x0x0x2_16x128x512_1x4x1_16x16x64_default
80,1,9216,4096,30,0,14.0099,a8w8_bpreshuffle_cktile_0x0x8x4x1x0x0x0x0x2_16x64x512_1x4x1_16x16x64_default
80,2,4608,4096,2,0,10.735,a8w8_bpreshuffle_cktile_0x0x8x4x1x0x0x0x0x1_16x64x512_1x4x1_16x16x64_default
80,2,9216,4096,30,0,14.213,a8w8_bpreshuffle_cktile_0x0x8x4x1x0x0x0x0x2_16x64x512_1x4x1_16x16x64_default
80,4,4608,4096,2,0,10.2078,a8w8_bpreshuffle_cktile_0x0x8x4x1x0x0x0x0x1_16x64x512_1x4x1_16x16x64_default
80,4,9216,4096,2,0,14.6558,a8w8_bpreshuffle_cktile_0x0x8x4x1x0x0x0x0x1_16x64x512_1x4x1_16x16x64_default
80,8,4608,4096,30,0,10.9986,a8w8_bpreshuffle_cktile_0x0x8x4x1x0x0x0x0x2_16x64x512_1x4x1_16x16x64_default
80,8,9216,4096,30,0,14.671,a8w8_bpreshuffle_cktile_0x0x8x4x1x0x0x0x0x2_16x64x512_1x4x1_16x16x64_default
80,16,512,7168,2,0,11.9894,a8w8_bpreshuffle_cktile_0x0x8x4x1x0x0x0x0x1_16x64x512_1x4x1_16x16x64_default
80,16,576,7168,30,0,12.0438,a8w8_bpreshuffle_cktile_0x0x8x4x1x0x0x0x0x2_16x64x512_1x4x1_16x16x64_default
80,16,1536,7168,30,0,12.5242,a8w8_bpreshuffle_cktile_0x0x8x4x1x0x0x0x0x2_16x64x512_1x4x1_16x16x64_default
80,16,3072,1536,2,0,5.877,a8w8_bpreshuffle_cktile_0x0x8x4x1x0x0x0x0x1_16x64x512_1x4x1_16x16x64_default
80,16,4096,512,30,0,4.2866,a8w8_bpreshuffle_cktile_0x0x8x4x1x0x0x0x0x2_16x64x512_1x4x1_16x16x64_default
80,16,4608,4096,30,0,10.4186,a8w8_bpreshuffle_cktile_0x0x8x4x1x0x0x0x0x2_16x64x512_1x4x1_16x16x64_default
80,16,4608,7168,2,0,13.9134,a8w8_bpreshuffle_cktile_0x0x8x4x1x0x0x0x0x1_16x64x512_1x4x1_16x16x64_default
80,16,7168,256,5,0,4.135,a8w8_bpreshuffle_cktile_0x0x8x4x1x0x0x0x0x1_16x64x256_1x4x1_16x16x64_default
80,16,7168,2048,30,0,8.941,a8w8_bpreshuffle_cktile_0x0x8x4x1x0x0x0x0x2_16x64x512_1x4x1_16x16x64_default
80,16,7168,2304,5,0,10.5886,a8w8_bpreshuffle_cktile_0x0x8x4x1x0x0x0x0x1_16x64x256_1x4x1_16x16x64_default
80,16,9216,4096,30,0,15.3551,a8w8_bpreshuffle_cktile_0x0x8x4x1x0x0x0x0x2_16x64x512_1x4x1_16x16x64_default
80,32,256,7168,2,0,11.897,a8w8_bpreshuffle_cktile_0x0x8x4x1x0x0x0x0x1_16x64x512_1x4x1_16x16x64_default
80,32,512,7168,2,0,12.6618,a8w8_bpreshuffle_cktile_0x0x8x4x1x0x0x0x0x1_16x64x512_1x4x1_16x16x64_default
80,32,576,7168,2,0,12.2522,a8w8_bpreshuffle_cktile_0x0x8x4x1x0x0x0x0x1_16x64x512_1x4x1_16x16x64_default
80,32,1280,8192,2,0,13.8022,a8w8_bpreshuffle_cktile_0x0x8x4x1x0x0x0x0x1_16x64x512_1x4x1_16x16x64_default
80,32,1536,7168,2,0,12.8954,a8w8_bpreshuffle_cktile_0x0x8x4x1x0x0x0x0x1_16x64x512_1x4x1_16x16x64_default
80,32,2048,7168,2,0,13.4123,a8w8_bpreshuffle_cktile_0x0x8x4x1x0x0x0x0x1_16x64x512_1x4x1_16x16x64_default
80,32,2112,7168,2,0,13.1619,a8w8_bpreshuffle_cktile_0x0x8x4x1x0x0x0x0x1_16x64x512_1x4x1_16x16x64_default
80,32,3072,1536,9,0,6.6798,a8w8_bpreshuffle_cktile_0x0x8x4x1x0x0x0x0x1_32x64x512_1x4x1_16x16x64_default
80,32,4096,512,49,0,4.8142,a8w8_bpreshuffle_cktile_0x0x8x4x1x0x0x0x0x2_32x64x256_1x4x1_16x16x64_default
80,32,4608,4096,37,0,11.4074,a8w8_bpreshuffle_cktile_0x0x8x4x1x0x0x0x0x2_32x64x512_1x4x1_16x16x64_default
80,32,4608,7168,9,0,15.5859,a8w8_bpreshuffle_cktile_0x0x8x4x1x0x0x0x0x1_32x64x512_1x4x1_16x16x64_default
80,32,7168,256,21,0,4.6598,a8w8_bpreshuffle_cktile_0x0x8x4x1x0x0x0x0x1_32x64x256_1x4x1_16x16x64_default
80,32,7168,512,49,0,5.7558,a8w8_bpreshuffle_cktile_0x0x8x4x1x0x0x0x0x2_32x64x256_1x4x1_16x16x64_default
80,32,7168,1536,51,0,9.1646,a8w8_bpreshuffle_cktile_0x0x8x4x1x0x0x0x0x2_32x128x256_1x4x1_16x16x64_default
80,32,7168,2048,51,0,10.3651,a8w8_bpreshuffle_cktile_0x0x8x4x1x0x0x0x0x2_32x128x256_1x4x1_16x16x64_default
80,32,7168,2304,23,0,11.4946,a8w8_bpreshuffle_cktile_0x0x8x4x1x0x0x0x0x1_32x128x256_1x4x1_16x16x64_default
80,32,8192,1024,49,0,7.421,a8w8_bpreshuffle_cktile_0x0x8x4x1x0x0x0x0x2_32x64x256_1x4x1_16x16x64_default
80,32,9216,4096,37,0,18.4295,a8w8_bpreshuffle_cktile_0x0x8x4x1x0x0x0x0x2_32x64x512_1x4x1_16x16x64_default
80,64,256,7168,30,0,11.8327,a8w8_bpreshuffle_cktile_0x0x8x4x1x0x0x0x0x2_16x64x512_1x4x1_16x16x64_default
80,64,512,7168,2,0,12.6319,a8w8_bpreshuffle_cktile_0x0x8x4x1x0x0x0x0x1_16x64x512_1x4x1_16x16x64_default
80,64,576,7168,2,0,12.8415,a8w8_bpreshuffle_cktile_0x0x8x4x1x0x0x0x0x1_16x64x512_1x4x1_16x16x64_default
80,64,1280,8192,2,0,13.9506,a8w8_bpreshuffle_cktile_0x0x8x4x1x0x0x0x0x1_16x64x512_1x4x1_16x16x64_default
80,64,1536,7168,9,0,15.3059,a8w8_bpreshuffle_cktile_0x0x8x4x1x0x0x0x0x1_32x64x512_1x4x1_16x16x64_default
80,64,2048,7168,37,0,16.1659,a8w8_bpreshuffle_cktile_0x0x8x4x1x0x0x0x0x2_32x64x512_1x4x1_16x16x64_default
80,64,2112,7168,9,0,15.617,a8w8_bpreshuffle_cktile_0x0x8x4x1x0x0x0x0x1_32x64x512_1x4x1_16x16x64_default
80,64,3072,1536,23,0,8.5162,a8w8_bpreshuffle_cktile_0x0x8x4x1x0x0x0x0x1_32x128x256_1x4x1_16x16x64_default
80,64,4096,512,21,0,5.6178,a8w8_bpreshuffle_cktile_0x0x8x4x1x0x0x0x0x1_32x64x256_1x4x1_16x16x64_default
80,64,4608,4096,9,0,16.3239,a8w8_bpreshuffle_cktile_0x0x8x4x1x0x0x0x0x1_32x64x512_1x4x1_16x16x64_default
80,64,4608,7168,51,0,24.1139,a8w8_bpreshuffle_cktile_0x0x8x4x1x0x0x0x0x2_32x128x256_1x4x1_16x16x64_default
80,64,7168,256,16,0,5.805,a8w8_bpreshuffle_cktile_0x0x8x4x1x0x0x0x0x1_64x64x128_1x4x1_16x16x64_default
80,64,7168,512,49,0,7.2839,a8w8_bpreshuffle_cktile_0x0x8x4x1x0x0x0x0x2_32x64x256_1x4x1_16x16x64_default
80,64,7168,1536,24,0,12.2547,a8w8_bpreshuffle_cktile_0x0x8x4x1x0x0x0x0x1_64x128x256_1x4x1_16x16x64_default
80,64,7168,2048,24,0,13.9239,a8w8_bpreshuffle_cktile_0x0x8x4x1x0x0x0x0x1_64x128x256_1x4x1_16x16x64_default
80,64,7168,2304,49,0,15.1203,a8w8_bpreshuffle_cktile_0x0x8x4x1x0x0x0x0x2_32x64x256_1x4x1_16x16x64_default
80,64,8192,1024,52,0,10.0007,a8w8_bpreshuffle_cktile_0x0x8x4x1x0x0x0x0x2_64x128x256_1x4x1_16x16x64_default
80,64,9216,4096,70,0,24.9735,a8w8_bpreshuffle_cktile_0x0x8x4x1x0x0x0x0x2_32x256x256_1x4x1_16x16x64_default
80,96,256,7168,30,0,11.7535,a8w8_bpreshuffle_cktile_0x0x8x4x1x0x0x0x0x2_16x64x512_1x4x1_16x16x64_default
80,96,2048,7168,49,0,21.4087,a8w8_bpreshuffle_cktile_0x0x8x4x1x0x0x0x0x2_32x64x256_1x4x1_16x16x64_default
80,96,2112,7168,37,0,23.0571,a8w8_bpreshuffle_cktile_0x0x8x4x1x0x0x0x0x2_32x64x512_1x4x1_16x16x64_default
80,96,3072,1536,23,0,8.701,a8w8_bpreshuffle_cktile_0x0x8x4x1x0x0x0x0x1_32x128x256_1x4x1_16x16x64_default
80,96,7168,512,45,0,8.7266,a8w8_bpreshuffle_cktile_0x0x8x4x1x0x0x0x0x2_32x128x128_1x4x1_16x16x64_default
80,96,7168,1536,17,0,15.4086,a8w8_bpreshuffle_cktile_0x0x8x4x1x0x0x0x0x1_32x128x128_1x4x1_16x16x64_default
80,96,7168,2048,45,0,17.9394,a8w8_bpreshuffle_cktile_0x0x8x4x1x0x0x0x0x2_32x128x128_1x4x1_16x16x64_default
80,128,256,7168,2,0,12.0187,a8w8_bpreshuffle_cktile_0x0x8x4x1x0x0x0x0x1_16x64x512_1x4x1_16x16x64_default
80,128,512,7168,30,0,12.5099,a8w8_bpreshuffle_cktile_0x0x8x4x1x0x0x0x0x2_16x64x512_1x4x1_16x16x64_default
80,128,576,7168,30,0,12.9074,a8w8_bpreshuffle_cktile_0x0x8x4x1x0x0x0x0x2_16x64x512_1x4x1_16x16x64_default
80,128,1280,8192,37,0,17.2599,a8w8_bpreshuffle_cktile_0x0x8x4x1x0x0x0x0x2_32x64x512_1x4x1_16x16x64_default
80,128,1536,7168,49,0,21.3055,a8w8_bpreshuffle_cktile_0x0x8x4x1x0x0x0x0x2_32x64x256_1x4x1_16x16x64_default
80,128,2048,7168,37,0,23.2942,a8w8_bpreshuffle_cktile_0x0x8x4x1x0x0x0x0x2_32x64x512_1x4x1_16x16x64_default
80,128,2112,7168,37,0,23.3631,a8w8_bpreshuffle_cktile_0x0x8x4x1x0x0x0x0x2_32x64x512_1x4x1_16x16x64_default
80,128,3072,1536,57,0,10.2238,a8w8_bpreshuffle_cktile_0x0x8x4x1x0x0x0x0x1_32x192x256_1x4x1_16x16x64_default
80,128,4096,512,17,0,7.1958,a8w8_bpreshuffle_cktile_0x0x8x4x1x0x0x0x0x1_32x128x128_1x4x1_16x16x64_default
80,128,4608,4096,24,0,23.6079,a8w8_bpreshuffle_cktile_0x0x8x4x1x0x0x0x0x1_64x128x256_1x4x1_16x16x64_default
80,128,4608,7168,24,0,34.642,a8w8_bpreshuffle_cktile_0x0x8x4x1x0x0x0x0x1_64x128x256_1x4x1_16x16x64_default
80,128,7168,256,45,0,7.4606,a8w8_bpreshuffle_cktile_0x0x8x4x1x0x0x0x0x2_32x128x128_1x4x1_16x16x64_default
80,128,7168,512,23,0,9.5394,a8w8_bpreshuffle_cktile_0x0x8x4x1x0x0x0x0x1_32x128x256_1x4x1_16x16x64_default
80,128,7168,1536,51,0,16.741,a8w8_bpreshuffle_cktile_0x0x8x4x1x0x0x0x0x2_32x128x256_1x4x1_16x16x64_default
80,128,7168,2048,23,0,19.732,a8w8_bpreshuffle_cktile_0x0x8x4x1x0x0x0x0x1_32x128x256_1x4x1_16x16x64_default
80,128,7168,2304,44,0,21.6191,a8w8_bpreshuffle_cktile_0x0x8x4x1x0x0x0x0x2_64x64x128_1x4x1_16x16x64_default
80,128,8192,1024,24,0,14.4102,a8w8_bpreshuffle_cktile_0x0x8x4x1x0x0x0x0x1_64x128x256_1x4x1_16x16x64_default
80,128,9216,4096,24,0,34.9303,a8w8_bpreshuffle_cktile_0x0x8x4x1x0x0x0x0x1_64x128x256_1x4x1_16x16x64_default
80,192,1280,8192,9,0,25.3259,a8w8_bpreshuffle_cktile_0x0x8x4x1x0x0x0x0x1_32x64x512_1x4x1_16x16x64_default
80,192,8192,1024,18,0,18.1059,a8w8_bpreshuffle_cktile_0x0x8x4x1x0x0x0x0x1_64x128x128_1x4x1_16x16x64_default
80,256,256,7168,2,0,12.6291,a8w8_bpreshuffle_cktile_0x0x8x4x1x0x0x0x0x1_16x64x512_1x4x1_16x16x64_default
80,256,512,7168,9,0,15.3411,a8w8_bpreshuffle_cktile_0x0x8x4x1x0x0x0x0x1_32x64x512_1x4x1_16x16x64_default
80,256,576,7168,37,0,15.5875,a8w8_bpreshuffle_cktile_0x0x8x4x1x0x0x0x0x2_32x64x512_1x4x1_16x16x64_default
80,256,1280,8192,51,0,25.7427,a8w8_bpreshuffle_cktile_0x0x8x4x1x0x0x0x0x2_32x128x256_1x4x1_16x16x64_default
80,256,1536,7168,57,0,29.4471,a8w8_bpreshuffle_cktile_0x0x8x4x1x0x0x0x0x1_32x192x256_1x4x1_16x16x64_default
80,256,2048,7168,24,0,35.0692,a8w8_bpreshuffle_cktile_0x0x8x4x1x0x0x0x0x1_64x128x256_1x4x1_16x16x64_default
80,256,2112,7168,22,0,35.8456,a8w8_bpreshuffle_cktile_0x0x8x4x1x0x0x0x0x1_64x64x256_1x4x1_16x16x64_default
80,256,3072,1536,58,0,14.5491,a8w8_bpreshuffle_cktile_0x0x8x4x1x0x0x0x0x1_64x192x256_1x4x1_16x16x64_default
80,256,4096,512,51,0,10.131,a8w8_bpreshuffle_cktile_0x0x8x4x1x0x0x0x0x2_32x128x256_1x4x1_16x16x64_default
80,256,4608,4096,24,0,34.7604,a8w8_bpreshuffle_cktile_0x0x8x4x1x0x0x0x0x1_64x128x256_1x4x1_16x16x64_default
80,256,4608,7168,59,0,55.9973,a8w8_bpreshuffle_cktile_0x0x8x4x1x0x0x0x0x1_64x256x256_1x4x1_16x16x64_default
80,256,7168,256,46,0,9.9058,a8w8_bpreshuffle_cktile_0x0x8x4x1x0x0x0x0x2_64x128x128_1x4x1_16x16x64_default
80,256,7168,512,46,0,13.2978,a8w8_bpreshuffle_cktile_0x0x8x4x1x0x0x0x0x2_64x128x128_1x4x1_16x16x64_default
80,256,7168,1536,46,0,24.8411,a8w8_bpreshuffle_cktile_0x0x8x4x1x0x0x0x0x2_64x128x128_1x4x1_16x16x64_default
80,256,7168,2048,46,0,29.6591,a8w8_bpreshuffle_cktile_0x0x8x4x1x0x0x0x0x2_64x128x128_1x4x1_16x16x64_default
80,256,7168,2304,46,0,31.1011,a8w8_bpreshuffle_cktile_0x0x8x4x1x0x0x0x0x2_64x128x128_1x4x1_16x16x64_default
80,256,8192,1024,48,0,21.7947,a8w8_bpreshuffle_cktile_0x0x8x4x1x0x0x0x0x2_64x256x128_1x4x1_16x16x64_default
80,256,9216,4096,20,0,61.6213,a8w8_bpreshuffle_cktile_0x0x8x4x1x0x0x0x0x1_64x256x128_1x4x1_16x16x64_default
80,320,1280,8192,51,0,36.562,a8w8_bpreshuffle_cktile_0x0x8x4x1x0x0x0x0x2_32x128x256_1x4x1_16x16x64_default
80,320,8192,1024,20,0,22.4887,a8w8_bpreshuffle_cktile_0x0x8x4x1x0x0x0x0x1_64x256x128_1x4x1_16x16x64_default
80,512,256,7168,9,0,15.6379,a8w8_bpreshuffle_cktile_0x0x8x4x1x0x0x0x0x1_32x64x512_1x4x1_16x16x64_default
80,512,512,7168,9,0,22.3463,a8w8_bpreshuffle_cktile_0x0x8x4x1x0x0x0x0x1_32x64x512_1x4x1_16x16x64_default
80,512,576,7168,37,0,23.2727,a8w8_bpreshuffle_cktile_0x0x8x4x1x0x0x0x0x2_32x64x512_1x4x1_16x16x64_default
80,512,1280,8192,24,0,39.142,a8w8_bpreshuffle_cktile_0x0x8x4x1x0x0x0x0x1_64x128x256_1x4x1_16x16x64_default
80,512,1536,7168,58,0,43.4835,a8w8_bpreshuffle_cktile_0x0x8x4x1x0x0x0x0x1_64x192x256_1x4x1_16x16x64_default
80,512,2048,7168,24,0,54.6537,a8w8_bpreshuffle_cktile_0x0x8x4x1x0x0x0x0x1_64x128x256_1x4x1_16x16x64_default
80,512,2112,7168,39,0,66.4796,a8w8_bpreshuffle_cktile_0x0x8x4x1x0x0x0x0x2_128x64x128_1x4x1_16x16x64_default
80,512,3072,1536,54,0,23.0462,a8w8_bpreshuffle_cktile_0x0x8x4x1x0x0x0x0x2_64x192x128_1x4x1_16x16x64_default
80,512,4096,512,46,0,15.2451,a8w8_bpreshuffle_cktile_0x0x8x4x1x0x0x0x0x2_64x128x128_1x4x1_16x16x64_default
80,512,4608,7168,0,0,100.9395,a8w8_bpreshuffle_cktile_0x0x8x4x1x0x0x0x0x1_128x128x128_1x4x1_16x16x64_default
80,512,7168,256,73,0,15.1827,a8w8_bpreshuffle_cktile_0x0x8x4x1x0x0x0x0x2_64x256x64_1x4x1_16x16x64_default
80,512,7168,512,38,0,20.8434,a8w8_bpreshuffle_cktile_0x0x8x4x1x0x0x0x0x2_64x256x64_1x4x1_16x16x64_default
80,512,7168,1536,48,0,40.7115,a8w8_bpreshuffle_cktile_0x0x8x4x1x0x0x0x0x2_64x256x128_1x4x1_16x16x64_default
80,512,7168,2048,48,0,49.6896,a8w8_bpreshuffle_cktile_0x0x8x4x1x0x0x0x0x2_64x256x128_1x4x1_16x16x64_default
80,512,7168,2304,48,0,54.7045,a8w8_bpreshuffle_cktile_0x0x8x4x1x0x0x0x0x2_64x256x128_1x4x1_16x16x64_default
80,512,8192,1024,46,0,35.8888,a8w8_bpreshuffle_cktile_0x0x8x4x1x0x0x0x0x2_64x128x128_1x4x1_16x16x64_default
80,1024,256,7168,37,0,22.4355,a8w8_bpreshuffle_cktile_0x0x8x4x1x0x0x0x0x2_32x64x512_1x4x1_16x16x64_default
80,1024,512,7168,24,0,34.4685,a8w8_bpreshuffle_cktile_0x0x8x4x1x0x0x0x0x1_64x128x256_1x4x1_16x16x64_default
80,1024,576,7168,50,0,35.64,a8w8_bpreshuffle_cktile_0x0x8x4x1x0x0x0x0x2_64x64x256_1x4x1_16x16x64_default
80,1024,1280,8192,59,0,62.5217,a8w8_bpreshuffle_cktile_0x0x8x4x1x0x0x0x0x1_64x256x256_1x4x1_16x16x64_default
80,1024,1536,7168,58,0,76.4485,a8w8_bpreshuffle_cktile_0x0x8x4x1x0x0x0x0x1_64x192x256_1x4x1_16x16x64_default
80,1024,2048,7168,69,0,99.7954,a8w8_bpreshuffle_cktile_0x0x8x4x1x0x0x0x0x2_64x256x256_1x4x1_16x16x64_default
80,1024,2112,7168,57,0,107.8563,a8w8_bpreshuffle_cktile_0x0x8x4x1x0x0x0x0x1_32x192x256_1x4x1_16x16x64_default
80,1024,3072,1536,46,0,37.6963,a8w8_bpreshuffle_cktile_0x0x8x4x1x0x0x0x0x2_64x128x128_1x4x1_16x16x64_default
80,1024,4096,512,46,0,23.3694,a8w8_bpreshuffle_cktile_0x0x8x4x1x0x0x0x0x2_64x128x128_1x4x1_16x16x64_default
80,1024,4608,4096,54,0,109.9114,a8w8_bpreshuffle_cktile_0x0x8x4x1x0x0x0x0x2_64x192x128_1x4x1_16x16x64_default
80,1024,4608,7168,26,0,184.2622,a8w8_bpreshuffle_cktile_0x0x8x4x1x0x0x0x0x1_64x192x128_1x4x1_16x16x64_default
80,1024,7168,256,41,0,25.0891,a8w8_bpreshuffle_cktile_0x0x8x4x1x0x0x0x0x2_128x128x64_1x4x1_16x16x64_default
80,1024,7168,512,38,0,36.8286,a8w8_bpreshuffle_cktile_0x0x8x4x1x0x0x0x0x2_64x256x64_1x4x1_16x16x64_default
80,1024,7168,1536,48,0,74.516,a8w8_bpreshuffle_cktile_0x0x8x4x1x0x0x0x0x2_64x256x128_1x4x1_16x16x64_default
80,1024,7168,2048,48,0,93.2507,a8w8_bpreshuffle_cktile_0x0x8x4x1x0x0x0x0x2_64x256x128_1x4x1_16x16x64_default
80,1024,7168,2304,41,0,101.2094,a8w8_bpreshuffle_cktile_0x0x8x4x1x0x0x0x0x2_128x128x64_1x4x1_16x16x64_default
80,1024,8192,1024,41,0,64.5733,a8w8_bpreshuffle_cktile_0x0x8x4x1x0x0x0x0x2_128x128x64_1x4x1_16x16x64_default
80,1024,9216,4096,54,0,212.8962,a8w8_bpreshuffle_cktile_0x0x8x4x1x0x0x0x0x2_64x192x128_1x4x1_16x16x64_default
80,1536,512,7168,51,0,48.5581,a8w8_bpreshuffle_cktile_0x0x8x4x1x0x0x0x0x2_32x128x256_1x4x1_16x16x64_default
80,1536,576,7168,58,0,43.4784,a8w8_bpreshuffle_cktile_0x0x8x4x1x0x0x0x0x1_64x192x256_1x4x1_16x16x64_default
80,1536,1536,7168,69,0,101.2002,a8w8_bpreshuffle_cktile_0x0x8x4x1x0x0x0x0x2_64x256x256_1x4x1_16x16x64_default
80,1536,3072,1536,54,0,49.1712,a8w8_bpreshuffle_cktile_0x0x8x4x1x0x0x0x0x2_64x192x128_1x4x1_16x16x64_default
80,1536,4096,512,38,0,31.0555,a8w8_bpreshuffle_cktile_0x0x8x4x1x0x0x0x0x2_64x256x64_1x4x1_16x16x64_default
80,1536,4608,7168,18,0,275.9998,a8w8_bpreshuffle_cktile_0x0x8x4x1x0x0x0x0x1_64x128x128_1x4x1_16x16x64_default
80,1536,7168,256,41,0,32.9228,a8w8_bpreshuffle_cktile_0x0x8x4x1x0x0x0x0x2_128x128x64_1x4x1_16x16x64_default
80,1536,7168,2048,18,0,134.4588,a8w8_bpreshuffle_cktile_0x0x8x4x1x0x0x0x0x1_64x128x128_1x4x1_16x16x64_default
80,1536,7168,2304,46,0,143.6184,a8w8_bpreshuffle_cktile_0x0x8x4x1x0x0x0x0x2_64x128x128_1x4x1_16x16x64_default
80,2048,256,7168,60,0,35.5028,a8w8_bpreshuffle_cktile_0x0x8x4x1x0x0x0x0x1_32x256x256_1x4x1_16x16x64_default
80,2048,512,7168,24,0,54.58,a8w8_bpreshuffle_cktile_0x0x8x4x1x0x0x0x0x1_64x128x256_1x4x1_16x16x64_default
80,2048,576,7168,39,0,66.7765,a8w8_bpreshuffle_cktile_0x0x8x4x1x0x0x0x0x2_128x64x128_1x4x1_16x16x64_default
80,2048,1280,8192,20,0,113.9787,a8w8_bpreshuffle_cktile_0x0x8x4x1x0x0x0x0x1_64x256x128_1x4x1_16x16x64_default
80,2048,1536,7168,24,0,130.8756,a8w8_bpreshuffle_cktile_0x0x8x4x1x0x0x0x0x1_64x128x256_1x4x1_16x16x64_default
80,2048,2048,7168,18,0,176.577,a8w8_bpreshuffle_cktile_0x0x8x4x1x0x0x0x0x1_64x128x128_1x4x1_16x16x64_default
80,2048,2112,7168,26,0,180.9706,a8w8_bpreshuffle_cktile_0x0x8x4x1x0x0x0x0x1_64x192x128_1x4x1_16x16x64_default
80,2048,3072,1536,48,0,63.9712,a8w8_bpreshuffle_cktile_0x0x8x4x1x0x0x0x0x2_64x256x128_1x4x1_16x16x64_default
80,2048,4096,512,41,0,40.6844,a8w8_bpreshuffle_cktile_0x0x8x4x1x0x0x0x0x2_128x128x64_1x4x1_16x16x64_default
80,2048,4096,5120,46,0,235.028,a8w8_bpreshuffle_cktile_0x0x8x4x1x0x0x0x0x2_64x128x128_1x4x1_16x16x64_default
80,2048,4608,4096,26,0,212.4991,a8w8_bpreshuffle_cktile_0x0x8x4x1x0x0x0x0x1_64x192x128_1x4x1_16x16x64_default
80,2048,4608,7168,26,0,355.7022,a8w8_bpreshuffle_cktile_0x0x8x4x1x0x0x0x0x1_64x192x128_1x4x1_16x16x64_default
80,2048,7168,256,41,0,42.0136,a8w8_bpreshuffle_cktile_0x0x8x4x1x0x0x0x0x2_128x128x64_1x4x1_16x16x64_default
80,2048,7168,512,41,0,63.6174,a8w8_bpreshuffle_cktile_0x0x8x4x1x0x0x0x0x2_128x128x64_1x4x1_16x16x64_default
80,2048,7168,1536,41,0,140.5868,a8w8_bpreshuffle_cktile_0x0x8x4x1x0x0x0x0x2_128x128x64_1x4x1_16x16x64_default
80,2048,7168,2048,41,0,177.455,a8w8_bpreshuffle_cktile_0x0x8x4x1x0x0x0x0x2_128x128x64_1x4x1_16x16x64_default
80,2048,7168,2304,46,0,189.195,a8w8_bpreshuffle_cktile_0x0x8x4x1x0x0x0x0x2_64x128x128_1x4x1_16x16x64_default
80,2048,8192,1024,41,0,111.7655,a8w8_bpreshuffle_cktile_0x0x8x4x1x0x0x0x0x2_128x128x64_1x4x1_16x16x64_default
80,2048,9216,4096,48,0,409.8398,a8w8_bpreshuffle_cktile_0x0x8x4x1x0x0x0x0x2_64x256x128_1x4x1_16x16x64_default
80,4096,256,7168,24,0,56.1477,a8w8_bpreshuffle_cktile_0x0x8x4x1x0x0x0x0x1_64x128x256_1x4x1_16x16x64_default
80,4096,512,7168,0,0,100.9731,a8w8_bpreshuffle_cktile_0x0x8x4x1x0x0x0x0x1_128x128x128_1x4x1_16x16x64_default
80,4096,576,7168,26,0,111.1771,a8w8_bpreshuffle_cktile_0x0x8x4x1x0x0x0x0x1_64x192x128_1x4x1_16x16x64_default
80,4096,1280,8192,48,0,222.6335,a8w8_bpreshuffle_cktile_0x0x8x4x1x0x0x0x0x2_64x256x128_1x4x1_16x16x64_default
80,4096,1536,7168,48,0,241.2448,a8w8_bpreshuffle_cktile_0x0x8x4x1x0x0x0x0x2_64x256x128_1x4x1_16x16x64_default
80,4096,2048,7168,46,0,324.7128,a8w8_bpreshuffle_cktile_0x0x8x4x1x0x0x0x0x2_64x128x128_1x4x1_16x16x64_default
80,4096,2112,7168,26,0,322.4288,a8w8_bpreshuffle_cktile_0x0x8x4x1x0x0x0x0x1_64x192x128_1x4x1_16x16x64_default
80,4096,3072,1536,54,0,117.1323,a8w8_bpreshuffle_cktile_0x0x8x4x1x0x0x0x0x2_64x192x128_1x4x1_16x16x64_default
80,4096,4096,512,41,0,71.9254,a8w8_bpreshuffle_cktile_0x0x8x4x1x0x0x0x0x2_128x128x64_1x4x1_16x16x64_default
80,4096,4608,4096,18,0,411.4443,a8w8_bpreshuffle_cktile_0x0x8x4x1x0x0x0x0x1_64x128x128_1x4x1_16x16x64_default
80,4096,4608,7168,48,0,697.9341,a8w8_bpreshuffle_cktile_0x0x8x4x1x0x0x0x0x2_64x256x128_1x4x1_16x16x64_default
80,4096,7168,256,41,0,74.8454,a8w8_bpreshuffle_cktile_0x0x8x4x1x0x0x0x0x2_128x128x64_1x4x1_16x16x64_default
80,4096,7168,512,41,0,113.3175,a8w8_bpreshuffle_cktile_0x0x8x4x1x0x0x0x0x2_128x128x64_1x4x1_16x16x64_default
80,4096,7168,1536,41,0,257.7085,a8w8_bpreshuffle_cktile_0x0x8x4x1x0x0x0x0x2_128x128x64_1x4x1_16x16x64_default
80,4096,7168,2048,41,0,330.0349,a8w8_bpreshuffle_cktile_0x0x8x4x1x0x0x0x0x2_128x128x64_1x4x1_16x16x64_default
80,4096,7168,2304,41,0,361.8494,a8w8_bpreshuffle_cktile_0x0x8x4x1x0x0x0x0x2_128x128x64_1x4x1_16x16x64_default
80,4096,8192,1024,41,0,215.5291,a8w8_bpreshuffle_cktile_0x0x8x4x1x0x0x0x0x2_128x128x64_1x4x1_16x16x64_default
80,4096,9216,4096,48,0,787.9349,a8w8_bpreshuffle_cktile_0x0x8x4x1x0x0x0x0x2_64x256x128_1x4x1_16x16x64_default
80,4240,9216,4096,26,0,845.8167,a8w8_bpreshuffle_cktile_0x0x8x4x1x0x0x0x0x1_64x192x128_1x4x1_16x16x64_default
80,5104,5120,8192,48,0,1058.0401,a8w8_bpreshuffle_cktile_0x0x8x4x1x0x0x0x0x2_64x256x128_1x4x1_16x16x64_default
80,5112,6912,5120,48,0,909.0482,a8w8_bpreshuffle_cktile_0x0x8x4x1x0x0x0x0x2_64x256x128_1x4x1_16x16x64_default
80,5120,5120,4096,48,0,548.0322,a8w8_bpreshuffle_cktile_0x0x8x4x1x0x0x0x0x2_64x256x128_1x4x1_16x16x64_default
80,8192,256,7168,20,0,102.4899,a8w8_bpreshuffle_cktile_0x0x8x4x1x0x0x0x0x1_64x256x128_1x4x1_16x16x64_default
80,8192,512,7168,24,0,179.9786,a8w8_bpreshuffle_cktile_0x0x8x4x1x0x0x0x0x1_64x128x256_1x4x1_16x16x64_default
80,8192,576,7168,58,0,185.1926,a8w8_bpreshuffle_cktile_0x0x8x4x1x0x0x0x0x1_64x192x256_1x4x1_16x16x64_default
80,8192,1280,8192,48,0,430.8468,a8w8_bpreshuffle_cktile_0x0x8x4x1x0x0x0x0x2_64x256x128_1x4x1_16x16x64_default
80,8192,1536,7168,26,0,464.7058,a8w8_bpreshuffle_cktile_0x0x8x4x1x0x0x0x0x1_64x192x128_1x4x1_16x16x64_default
80,8192,2048,7168,48,0,608.9681,a8w8_bpreshuffle_cktile_0x0x8x4x1x0x0x0x0x2_64x256x128_1x4x1_16x16x64_default
80,8192,2112,7168,26,0,635.4722,a8w8_bpreshuffle_cktile_0x0x8x4x1x0x0x0x0x1_64x192x128_1x4x1_16x16x64_default
80,8192,3072,1536,41,0,224.0892,a8w8_bpreshuffle_cktile_0x0x8x4x1x0x0x0x0x2_128x128x64_1x4x1_16x16x64_default
80,8192,4096,512,41,0,127.3624,a8w8_bpreshuffle_cktile_0x0x8x4x1x0x0x0x0x2_128x128x64_1x4x1_16x16x64_default
80,8192,4608,7168,48,0,1344.0217,a8w8_bpreshuffle_cktile_0x0x8x4x1x0x0x0x0x2_64x256x128_1x4x1_16x16x64_default
80,8192,7168,256,41,0,137.9732,a8w8_bpreshuffle_cktile_0x0x8x4x1x0x0x0x0x2_128x128x64_1x4x1_16x16x64_default
80,8192,7168,512,41,0,213.9567,a8w8_bpreshuffle_cktile_0x0x8x4x1x0x0x0x0x2_128x128x64_1x4x1_16x16x64_default
80,8192,7168,1536,41,0,493.9448,a8w8_bpreshuffle_cktile_0x0x8x4x1x0x0x0x0x2_128x128x64_1x4x1_16x16x64_default
80,8192,7168,2048,41,0,637.5406,a8w8_bpreshuffle_cktile_0x0x8x4x1x0x0x0x0x2_128x128x64_1x4x1_16x16x64_default
80,8192,7168,2304,41,0,700.3005,a8w8_bpreshuffle_cktile_0x0x8x4x1x0x0x0x0x2_128x128x64_1x4x1_16x16x64_default
80,8192,8192,1024,41,0,409.8303,a8w8_bpreshuffle_cktile_0x0x8x4x1x0x0x0x0x2_128x128x64_1x4x1_16x16x64_default
80,16384,256,7168,52,0,184.3898,a8w8_bpreshuffle_cktile_0x0x8x4x1x0x0x0x0x2_64x128x256_1x4x1_16x16x64_default
80,16384,512,7168,24,0,331.5429,a8w8_bpreshuffle_cktile_0x0x8x4x1x0x0x0x0x1_64x128x256_1x4x1_16x16x64_default
80,16384,576,7168,72,0,363.5406,a8w8_bpreshuffle_cktile_0x0x8x4x1x0x0x0x0x2_128x192x128_1x4x1_16x16x64_default
80,16384,1280,8192,48,0,851.607,a8w8_bpreshuffle_cktile_0x0x8x4x1x0x0x0x0x2_64x256x128_1x4x1_16x16x64_default
80,16384,1536,7168,26,0,917.9502,a8w8_bpreshuffle_cktile_0x0x8x4x1x0x0x0x0x1_64x192x128_1x4x1_16x16x64_default
80,16384,2048,7168,69,0,1230.092,a8w8_bpreshuffle_cktile_0x0x8x4x1x0x0x0x0x2_64x256x256_1x4x1_16x16x64_default
80,16384,2112,7168,54,0,1261.8942,a8w8_bpreshuffle_cktile_0x0x8x4x1x0x0x0x0x2_64x192x128_1x4x1_16x16x64_default
80,16384,3072,1536,41,0,430.5497,a8w8_bpreshuffle_cktile_0x0x8x4x1x0x0x0x0x2_128x128x64_1x4x1_16x16x64_default
80,16384,4096,512,41,0,244.3869,a8w8_bpreshuffle_cktile_0x0x8x4x1x0x0x0x0x2_128x128x64_1x4x1_16x16x64_default
80,16384,4608,4096,48,0,1568.2943,a8w8_bpreshuffle_cktile_0x0x8x4x1x0x0x0x0x2_64x256x128_1x4x1_16x16x64_default
80,16384,4608,7168,26,0,2686.1268,a8w8_bpreshuffle_cktile_0x0x8x4x1x0x0x0x0x1_64x192x128_1x4x1_16x16x64_default
80,16384,7168,256,41,0,273.2462,a8w8_bpreshuffle_cktile_0x0x8x4x1x0x0x0x0x2_128x128x64_1x4x1_16x16x64_default
80,16384,7168,512,73,0,432.9845,a8w8_bpreshuffle_cktile_0x0x8x4x1x0x0x0x0x2_64x256x64_1x4x1_16x16x64_default
80,16384,7168,1536,48,0,1002.4202,a8w8_bpreshuffle_cktile_0x0x8x4x1x0x0x0x0x2_64x256x128_1x4x1_16x16x64_default
80,16384,7168,2048,41,0,1261.3558,a8w8_bpreshuffle_cktile_0x0x8x4x1x0x0x0x0x2_128x128x64_1x4x1_16x16x64_default
80,16384,7168,2304,41,0,1391.1191,a8w8_bpreshuffle_cktile_0x0x8x4x1x0x0x0x0x2_128x128x64_1x4x1_16x16x64_default
80,16384,8192,1024,41,0,793.5368,a8w8_bpreshuffle_cktile_0x0x8x4x1x0x0x0x0x2_128x128x64_1x4x1_16x16x64_default
80,16384,9216,4096,48,0,3120.34,a8w8_bpreshuffle_cktile_0x0x8x4x1x0x0x0x0x2_64x256x128_1x4x1_16x16x64_default
80,20480,512,7168,48,0,386.7511,a8w8_bpreshuffle_cktile_0x0x8x4x1x0x0x0x0x2_64x256x128_1x4x1_16x16x64_default
80,20480,576,7168,72,0,435.1733,a8w8_bpreshuffle_cktile_0x0x8x4x1x0x0x0x0x2_128x192x128_1x4x1_16x16x64_default
80,20480,1536,7168,48,0,1119.2158,a8w8_bpreshuffle_cktile_0x0x8x4x1x0x0x0x0x2_64x256x128_1x4x1_16x16x64_default
80,20480,3072,1536,41,0,534.1021,a8w8_bpreshuffle_cktile_0x0x8x4x1x0x0x0x0x2_128x128x64_1x4x1_16x16x64_default
80,20480,4096,512,41,0,301.7339,a8w8_bpreshuffle_cktile_0x0x8x4x1x0x0x0x0x2_128x128x64_1x4x1_16x16x64_default
80,20480,4608,7168,48,0,3320.2204,a8w8_bpreshuffle_cktile_0x0x8x4x1x0x0x0x0x2_64x256x128_1x4x1_16x16x64_default
80,20480,7168,256,38,0,360.7106,a8w8_bpreshuffle_cktile_0x0x8x4x1x0x0x0x0x2_64x256x64_1x4x1_16x16x64_default
80,20480,7168,2048,41,0,1578.4931,a8w8_bpreshuffle_cktile_0x0x8x4x1x0x0x0x0x2_128x128x64_1x4x1_16x16x64_default
80,20480,7168,2304,41,0,1728.2258,a8w8_bpreshuffle_cktile_0x0x8x4x1x0x0x0x0x2_128x128x64_1x4x1_16x16x64_default
80,32768,4608,4096,48,0,3125.8511,a8w8_bpreshuffle_cktile_0x0x8x4x1x0x0x0x0x2_64x256x128_1x4x1_16x16x64_default
80,32768,9216,4096,48,0,6208.4574,a8w8_bpreshuffle_cktile_0x0x8x4x1x0x0x0x0x2_64x256x128_1x4x1_16x16x64_default
>>>>>>> 3c7af2e6 (add more instances)
