aiter/configs/tuned_fmoe.csv
token,model_dim,inter_dim,expert,topk,act_type,dtype,q_dtype_a,q_dtype_w,q_type,use_g1u1,block_m,ksplit,us,tag,err
256,6144,4096,8,2,ActivationType.Silu,torch.bfloat16,torch.float8_e4m3fnuz,torch.float8_e4m3fnuz,QuantType.per_128x128,1,32,0,254.79263999999995,fmoe_stage1_bf16_pertokenFp8_blockscale_g1u1_32x512_pf3,1.6%
512,6144,4096,8,2,ActivationType.Silu,torch.bfloat16,torch.int8,torch.int8,QuantType.per_Tensor,1,48,0,339.24499,fmoe_stage1_bf16_pertokenInt8_g1u1_48x256_pf3,0.0%
512,6144,4096,8,2,ActivationType.Silu,torch.bfloat16,torch.int8,torch.int8,QuantType.per_Token,1,48,0,328.98294999999996,fmoe_stage1_bf16_pertokenInt8_g1u1_48x256_pf3,0.0%
512,6144,4096,8,2,ActivationType.Silu,torch.bfloat16,torch.float8_e4m3fnuz,torch.float8_e4m3fnuz,QuantType.per_Token,1,48,0,326.68973,fmoe_stage1_bf16_pertokenFp8_g1u1_48x256_pf3,0.0%
512,6144,4096,8,2,ActivationType.Silu,torch.bfloat16,torch.float8_e4m3fnuz,torch.uint32,QuantType.per_Tensor,1,128,0,837.86339,ck_128,0.1%
512,6144,4096,8,2,ActivationType.Gelu,torch.bfloat16,torch.int8,torch.int8,QuantType.per_Tensor,1,48,0,343.2134,fmoe_stage1_bf16_pertokenInt8_g1u1_48x256_pf3,0.0%
512,6144,4096,8,2,ActivationType.Gelu,torch.bfloat16,torch.int8,torch.int8,QuantType.per_Token,1,48,0,333.64736,fmoe_stage1_bf16_pertokenInt8_g1u1_48x256_pf3,0.0%
512,6144,4096,8,2,ActivationType.Gelu,torch.bfloat16,torch.float8_e4m3fnuz,torch.float8_e4m3fnuz,QuantType.per_Token,1,48,0,339.4434499999999,fmoe_stage1_bf16_pertokenFp8_g1u1_48x256_pf3,0.0%
512,6144,4096,8,2,ActivationType.Gelu,torch.bfloat16,torch.float8_e4m3fnuz,torch.uint32,QuantType.per_Tensor,1,128,0,630.59812,ck_128,0.0%
