aiter/configs/tuned_fmoe.csv
token,model_dim,inter_dim,expert,topk,act_type,dtype,q_dtype_a,q_dtype_w,q_type,use_g1u1,block_m,ksplit,us,tag,err
512,6144,4096,8,2,ActivationType.Silu,torch.bfloat16,torch.int8,torch.int8,QuantType.per_Tensor,1,48,0,341.97323000000006,fmoe_stage1_bf16_pertokenInt8_g1u1_48x256_pf3,0.0%
512,6144,4096,8,2,ActivationType.Silu,torch.bfloat16,torch.int8,torch.int8,QuantType.per_Token,1,48,0,329.13721999999996,fmoe_stage1_bf16_pertokenInt8_g1u1_48x256_pf3,0.0%
512,6144,4096,8,2,ActivationType.Silu,torch.bfloat16,torch.float8_e4m3fnuz,torch.float8_e4m3fnuz,QuantType.per_Token,1,48,0,328.55437,fmoe_stage1_bf16_pertokenFp8_g1u1_48x256_pf3,0.0%
512,6144,4096,8,2,ActivationType.Silu,torch.bfloat16,torch.float8_e4m3fnuz,torch.uint32,QuantType.per_Tensor,1,128,0,842.64106,ck_128,0.0%
512,6144,4096,8,2,ActivationType.Gelu,torch.bfloat16,torch.int8,torch.int8,QuantType.per_Tensor,1,48,0,340.47203,fmoe_stage1_bf16_pertokenInt8_g1u1_48x256_pf3,0.0%
512,6144,4096,8,2,ActivationType.Gelu,torch.bfloat16,torch.int8,torch.int8,QuantType.per_Token,1,48,0,329.6391899999999,fmoe_stage1_bf16_pertokenInt8_g1u1_48x256_pf3,0.0%
512,6144,4096,8,2,ActivationType.Gelu,torch.bfloat16,torch.float8_e4m3fnuz,torch.float8_e4m3fnuz,QuantType.per_Token,1,48,0,328.01879,fmoe_stage1_bf16_pertokenFp8_g1u1_48x256_pf3,0.0%
512,6144,4096,8,2,ActivationType.Gelu,torch.bfloat16,torch.float8_e4m3fnuz,torch.uint32,QuantType.per_Tensor,1,128,0,840.0117200000002,ck_128,0.0%
