aiter/ops/triton/configs/gemm/MI300X-BATCHED_GEMM-A8W8-A_PER_TOKEN_GROUP_PREQUANT_W_PER_BATCHED_TENSOR_QUANT-N=512-K=128.json
{
  "small" : {
    "BLOCK_SIZE_M": 16,
    "BLOCK_SIZE_N": 128,
    "BLOCK_SIZE_K": 128,
    "GROUP_SIZE_M": 1,
    "num_warps": 4,
    "num_stages": 2,
    "waves_per_eu": 4,
    "matrix_instr_nonkdim": 16,
    "kpack": 2,
    "cache_modifier": ".cg"
  },
  "small_M16" : {
    "BLOCK_SIZE_M": 16,
    "BLOCK_SIZE_N": 64,
    "BLOCK_SIZE_K": 128,
    "GROUP_SIZE_M": 1,
    "num_warps": 4,
    "num_stages": 2,
    "waves_per_eu": 6,
    "matrix_instr_nonkdim": 16,
    "kpack": 2,
    "cache_modifier": ".cg"
  },
  "medium_M32" : {
    "BLOCK_SIZE_M": 16,
    "BLOCK_SIZE_N": 128,
    "BLOCK_SIZE_K": 128,
    "GROUP_SIZE_M": 1,
    "num_warps": 4,
    "num_stages": 2,
    "waves_per_eu": 6,
    "matrix_instr_nonkdim": 16,
    "kpack": 2,
    "cache_modifier": ".cg"
  },
  "medium_M64" : {
    "BLOCK_SIZE_M": 16,
    "BLOCK_SIZE_N": 128,
    "BLOCK_SIZE_K": 128,
    "GROUP_SIZE_M": 1,
    "num_warps": 4,
    "num_stages": 2,
    "waves_per_eu": 6,
    "matrix_instr_nonkdim": 16,
    "kpack": 2,
    "cache_modifier": ".cg"
  },
  "medium_M128" : {
    "BLOCK_SIZE_M": 16,
    "BLOCK_SIZE_N": 128,
    "BLOCK_SIZE_K": 128,
    "GROUP_SIZE_M": 1,
    "num_warps": 4,
    "num_stages": 2,
    "waves_per_eu": 6,
    "matrix_instr_nonkdim": 16,
    "kpack": 2,
    "cache_modifier": ".cg"
  },
  "large" : {
    "BLOCK_SIZE_M": 16,
    "BLOCK_SIZE_N": 128,
    "BLOCK_SIZE_K": 128,
    "GROUP_SIZE_M": 1,
    "num_warps": 4,
    "num_stages": 2,
    "waves_per_eu": 6,
    "matrix_instr_nonkdim": 16,
    "kpack": 2,
    "cache_modifier": ".cg"
  },
  "xlarge" : {
    "BLOCK_SIZE_M": 16,
    "BLOCK_SIZE_N": 128,
    "BLOCK_SIZE_K": 128,
    "GROUP_SIZE_M": 1,
    "num_warps": 4,
    "num_stages": 2,
    "waves_per_eu": 6,
    "matrix_instr_nonkdim": 16,
    "kpack": 2,
    "cache_modifier": ".cg"
  },
  "any" : {
    "BLOCK_SIZE_M": 16,
    "BLOCK_SIZE_N": 128,
    "BLOCK_SIZE_K": 128,
    "GROUP_SIZE_M": 1,
    "num_warps": 4,
    "num_stages": 2,
    "waves_per_eu": 6,
    "matrix_instr_nonkdim": 16,
    "kpack": 2,
    "cache_modifier": ".cg"
  }
}

  